exp	description	val_bpb	peak_mem_gb	tok_sec	mfu	steps	status	notes	gpu_name	baseline_sha
exp0	baseline (no modifications)	1.075771	17.1	253333	28.3	1159	baseline	depth=10, NVIDIA RTX PRO 6000 Blackwell Server Edition	NVIDIA RTX PRO 6000 Blackwell Server Edition	81f26e347c9cb46d475e338008f4d6138a83bea3
exp1	Reduce DEVICE_BATCH_SIZE from default to 8 to increase gradient steps	0.000000	0.0	0	0.0	0	crash	training crashed or timed out	NVIDIA RTX PRO 6000 Blackwell Server Edition	81f26e347c9cb46d475e338008f4d6138a83bea3
exp2	Reduce TOTAL_BATCH_SIZE from default to 32768 to increase gradient steps	0.000000	0.0	0	0.0	0	crash	training crashed or timed out	NVIDIA RTX PRO 6000 Blackwell Server Edition	81f26e347c9cb46d475e338008f4d6138a83bea3
exp3	Increase DEPTH from default to 12 to better utilize available compute	1.095102	24.3	167666	30.0	768	discard	The baseline shows we have significant headroom with only 17.1GB memory usage ou	NVIDIA RTX PRO 6000 Blackwell Server Edition	81f26e347c9cb46d475e338008f4d6138a83bea3
exp4	Reduce TOTAL_BATCH_SIZE from default to 16384 to increase gradient steps	0.000000	0.0	0	0.0	0	crash	training crashed or timed out	NVIDIA RTX PRO 6000 Blackwell Server Edition	81f26e347c9cb46d475e338008f4d6138a83bea3
exp5	Reduce DEVICE_BATCH_SIZE from default to 16 to increase gradient steps	0.000000	0.0	0	0.0	0	crash	training crashed or timed out	NVIDIA RTX PRO 6000 Blackwell Server Edition	81f26e347c9cb46d475e338008f4d6138a83bea3
exp6	Increase MATRIX_LR from 0.04 to 0.05	1.078415	17.1	253164	28.3	1160	discard	Since reducing batch sizes has caused crashes, I'll try increasing the learning 	NVIDIA RTX PRO 6000 Blackwell Server Edition	81f26e347c9cb46d475e338008f4d6138a83bea3
exp7	Reduce MATRIX_LR from 0.04 to 0.035	1.074724	17.1	253333	28.3	1159	keep	The previous experiment increasing MATRIX_LR to 0.05 performed worse than baseli	NVIDIA RTX PRO 6000 Blackwell Server Edition	81f26e347c9cb46d475e338008f4d6138a83bea3
exp8	Reduce MATRIX_LR from 0.035 to 0.03	1.072803	17.1	253666	28.4	1161	keep	The previous experiment showed that reducing MATRIX_LR from 0.04 to 0.035 improv	NVIDIA RTX PRO 6000 Blackwell Server Edition	81f26e347c9cb46d475e338008f4d6138a83bea3
exp9	Reduce MATRIX_LR from 0.03 to 0.025	1.072986	17.1	253164	28.3	1159	discard	The trend shows consistent improvement as we reduce MATRIX_LR (0.04→0.035→0.03),	NVIDIA RTX PRO 6000 Blackwell Server Edition	81f26e347c9cb46d475e338008f4d6138a83bea3
exp10	Reduce WEIGHT_DECAY from 0.2 to 0.15	1.075913	17.1	253164	28.3	1160	discard	Since we've found the optimal MATRIX_LR around 0.03, the next logical step is to	NVIDIA RTX PRO 6000 Blackwell Server Edition	81f26e347c9cb46d475e338008f4d6138a83bea3
exp11	Increase EMBEDDING_LR from 0.6 to 0.8	1.076653	17.1	253248	28.3	1159	discard	Since reducing MATRIX_LR improved performance, the learning rates may still be s	NVIDIA RTX PRO 6000 Blackwell Server Edition	81f26e347c9cb46d475e338008f4d6138a83bea3
exp12	Reduce UNEMBEDDING_LR from 0.004 to 0.003	1.074614	17.1	253248	28.3	1159	discard	The MATRIX_LR reduction from 0.04 to 0.03 improved performance, suggesting lower	NVIDIA RTX PRO 6000 Blackwell Server Edition	81f26e347c9cb46d475e338008f4d6138a83bea3
exp13	Reduce SCALAR_LR from 0.5 to 0.4	1.072719	17.1	253248	28.3	1159	keep	The matrix learning rate optimization showed clear improvement when reduced from	NVIDIA RTX PRO 6000 Blackwell Server Edition	81f26e347c9cb46d475e338008f4d6138a83bea3
exp14	Reduce SCALAR_LR from 0.4 to 0.35	1.074640	17.1	253248	28.3	1159	discard	The trend shows consistent improvement as we reduce SCALAR_LR: 0.5 → 0.4 improve	NVIDIA RTX PRO 6000 Blackwell Server Edition	81f26e347c9cb46d475e338008f4d6138a83bea3
exp15	Increase WARMDOWN_RATIO from 0.5 to 0.6	1.071789	17.1	253248	28.3	1160	keep	The current best results come from learning rate tuning, and warmdown scheduling	NVIDIA RTX PRO 6000 Blackwell Server Edition	81f26e347c9cb46d475e338008f4d6138a83bea3
exp16	Increase WARMDOWN_RATIO from 0.6 to 0.7	1.071089	17.1	253164	28.3	1160	keep	The last two experiments show that increasing WARMDOWN_RATIO has been beneficial	NVIDIA RTX PRO 6000 Blackwell Server Edition	81f26e347c9cb46d475e338008f4d6138a83bea3
exp17	Increase WARMDOWN_RATIO from 0.7 to 0.8	1.070822	17.1	253248	28.3	1160	keep	The trend shows consistent improvement as WARMDOWN_RATIO increased from 0.5 to 0	NVIDIA RTX PRO 6000 Blackwell Server Edition	81f26e347c9cb46d475e338008f4d6138a83bea3
exp18	Increase WARMDOWN_RATIO from 0.8 to 0.9	1.071156	17.1	253080	28.3	1160	discard	The warmdown ratio has shown consistent improvement from 0.5 → 0.6 → 0.7 → 0.8, 	NVIDIA RTX PRO 6000 Blackwell Server Edition	81f26e347c9cb46d475e338008f4d6138a83bea3
exp19	Reduce FINAL_LR_FRAC from 0.0 to 0.1	1.070312	17.1	253248	28.3	1160	keep	The current best experiments have been optimizing the warmdown schedule, with WA	NVIDIA RTX PRO 6000 Blackwell Server Edition	81f26e347c9cb46d475e338008f4d6138a83bea3
exp20	Reduce FINAL_LR_FRAC from 0.1 to 0.05	1.070023	17.1	253164	28.3	1160	keep	The trend shows that increasing WARMDOWN_RATIO to 0.8 and setting FINAL_LR_FRAC 	NVIDIA RTX PRO 6000 Blackwell Server Edition	81f26e347c9cb46d475e338008f4d6138a83bea3
exp21	Reduce EMBEDDING_LR from 0.6 to 0.5	1.070552	17.1	253497	28.4	1161	discard	The embedding learning rate is currently at 0.6, which is relatively high. Since	NVIDIA RTX PRO 6000 Blackwell Server Edition	81f26e347c9cb46d475e338008f4d6138a83bea3
exp22	Increase ASPECT_RATIO from 64 to 80	1.082800	23.8	175274	34.8	802	discard	The current configuration achieves good performance with val_bpb=1.0700, but we 	NVIDIA RTX PRO 6000 Blackwell Server Edition	81f26e347c9cb46d475e338008f4d6138a83bea3
exp23	Reduce FINAL_LR_FRAC from 0.05 to 0.02	1.070148	17.1	253333	28.3	1159	discard	The trend from exp19 to exp20 shows that reducing FINAL_LR_FRAC from 0.1 to 0.05	NVIDIA RTX PRO 6000 Blackwell Server Edition	81f26e347c9cb46d475e338008f4d6138a83bea3
exp24	Increase HEAD_DIM from 128 to 160	1.076524	17.1	231922	25.9	1062	discard	The current HEAD_DIM of 128 may be suboptimal for the model architecture. Increa	NVIDIA RTX PRO 6000 Blackwell Server Edition	81f26e347c9cb46d475e338008f4d6138a83bea3
exp25	Reduce WARMUP_RATIO from 0.0 to -0.1 (negative warmup for immediate high learning rates)	1.069121	17.1	253582	28.4	1161	keep	The current setup has no warmup (0.0) followed by a long warmdown (0.8). Since w	NVIDIA RTX PRO 6000 Blackwell Server Edition	81f26e347c9cb46d475e338008f4d6138a83bea3
exp26	Reduce FINAL_LR_FRAC from 0.05 to 0.01	1.070635	17.1	253582	28.4	1161	discard	The recent improvement from negative warmup (exp25) suggests that aggressive lea	NVIDIA RTX PRO 6000 Blackwell Server Edition	81f26e347c9cb46d475e338008f4d6138a83bea3
exp27	Increase WARMDOWN_RATIO from 0.8 to 0.85	1.069378	17.1	253248	28.3	1160	discard	The current best result uses WARMUP_RATIO=-0.1 and WARMDOWN_RATIO=0.8. Since inc	NVIDIA RTX PRO 6000 Blackwell Server Edition	81f26e347c9cb46d475e338008f4d6138a83bea3
exp28	Reduce ADAM_BETAS from (0.8, 0.95) to (0.7, 0.95)	1.068531	17.1	253582	28.4	1161	keep	The current best experiments have optimized learning rates and scheduling, but h	NVIDIA RTX PRO 6000 Blackwell Server Edition	81f26e347c9cb46d475e338008f4d6138a83bea3
exp29	Reduce ADAM_BETAS from (0.7, 0.95) to (0.6, 0.95)	1.070075	17.1	253248	28.3	1160	discard	The previous experiment showed improvement by reducing beta1 from 0.8 to 0.7, wh	NVIDIA RTX PRO 6000 Blackwell Server Edition	81f26e347c9cb46d475e338008f4d6138a83bea3
exp30	Reduce ADAM_BETAS from (0.7, 0.95) to (0.7, 0.90)	1.069288	17.1	253666	28.4	1161	discard	The current best result uses ADAM_BETAS (0.7, 0.95), and exp29 showed that reduc	NVIDIA RTX PRO 6000 Blackwell Server Edition	81f26e347c9cb46d475e338008f4d6138a83bea3
exp31	Reduce ADAM_BETAS from (0.7, 0.95) to (0.65, 0.95)	1.068992	17.1	253333	28.3	1160	discard	The current best result came from reducing beta1 from 0.8 to 0.7, which improved	NVIDIA RTX PRO 6000 Blackwell Server Edition	81f26e347c9cb46d475e338008f4d6138a83bea3
exp32	Change WINDOW_PATTERN from "SSSL" to "SSL" to reduce computation per layer	1.064057	17.1	270576	30.8	1239	keep	The current pattern "SSSL" has 3 sliding window layers and 1 full attention laye	NVIDIA RTX PRO 6000 Blackwell Server Edition	81f26e347c9cb46d475e338008f4d6138a83bea3
exp33	Reduce MATRIX_LR from 0.03 to 0.025 (following the previous successful trend)	1.063304	17.1	270576	30.8	1239	keep	The history shows a clear pattern where reducing MATRIX_LR has consistently impr	NVIDIA RTX PRO 6000 Blackwell Server Edition	81f26e347c9cb46d475e338008f4d6138a83bea3
exp34	Reduce MATRIX_LR from 0.025 to 0.022 to continue the successful downward trend	1.064928	17.1	270486	30.8	1239	discard	The experiments show a clear pattern where reducing MATRIX_LR has consistently i	NVIDIA RTX PRO 6000 Blackwell Server Edition	81f26e347c9cb46d475e338008f4d6138a83bea3
exp35	Reduce EMBEDDING_LR from 0.6 to 0.55	1.064150	17.1	270576	30.8	1239	discard	The current best configuration has MATRIX_LR=0.025 working well. Since embedding	NVIDIA RTX PRO 6000 Blackwell Server Edition	81f26e347c9cb46d475e338008f4d6138a83bea3
exp36	Reduce UNEMBEDDING_LR from 0.004 to 0.0035	1.064412	17.1	270819	30.8	1240	discard	The model has responded well to reducing MATRIX_LR in the recent experiments. Si	NVIDIA RTX PRO 6000 Blackwell Server Edition	81f26e347c9cb46d475e338008f4d6138a83bea3
exp37	Reduce SCALAR_LR from 0.4 to 0.35	1.062525	17.1	270819	30.8	1240	keep	The current best configuration uses MATRIX_LR=0.025, and previous experiments sh	NVIDIA RTX PRO 6000 Blackwell Server Edition	81f26e347c9cb46d475e338008f4d6138a83bea3
exp38	Reduce WEIGHT_DECAY from 0.2 to 0.1	1.063496	17.1	270486	30.8	1239	discard	With the current best configuration achieving 1.0625 val_bpb, we should explore 	NVIDIA RTX PRO 6000 Blackwell Server Edition	81f26e347c9cb46d475e338008f4d6138a83bea3
exp39	Reduce SCALAR_LR from 0.35 to 0.3	1.065500	17.1	270819	30.8	1240	discard	The recent experiments show a clear pattern where reducing SCALAR_LR has been be	NVIDIA RTX PRO 6000 Blackwell Server Edition	81f26e347c9cb46d475e338008f4d6138a83bea3
exp40	Reduce MATRIX_LR from 0.025 to 0.02	1.064817	17.1	270819	30.8	1240	discard	The MATRIX_LR has shown a clear trend of improvement when reduced (from 0.035 to	NVIDIA RTX PRO 6000 Blackwell Server Edition	81f26e347c9cb46d475e338008f4d6138a83bea3
exp41	Increase WARMDOWN_RATIO from 0.8 to 0.82 to fine-tune the learning rate schedule	1.062408	17.1	271000	30.9	1240	keep	The best result (1.0625) came from exp37 which reduced SCALAR_LR, but recent mat	NVIDIA RTX PRO 6000 Blackwell Server Edition	81f26e347c9cb46d475e338008f4d6138a83bea3
exp42	Increase WARMDOWN_RATIO from 0.82 to 0.84 to continue fine-tuning the learning rate schedule	1.062382	17.1	270666	30.8	1239	keep	The last experiment (exp41) improved val_bpb by increasing WARMDOWN_RATIO from 0	NVIDIA RTX PRO 6000 Blackwell Server Edition	81f26e347c9cb46d475e338008f4d6138a83bea3
exp43	Increase WARMDOWN_RATIO from 0.84 to 0.86	1.062608	17.1	270819	30.9	1240	discard	The last two experiments (exp41 and exp42) both improved val_bpb by fine-tuning 	NVIDIA RTX PRO 6000 Blackwell Server Edition	81f26e347c9cb46d475e338008f4d6138a83bea3
exp44	Reduce FINAL_LR_FRAC from 0.05 to 0.03 to improve learning rate schedule convergence	1.062739	17.1	270576	30.8	1239	discard	The recent improvements from fine-tuning WARMDOWN_RATIO suggest that learning ra	NVIDIA RTX PRO 6000 Blackwell Server Edition	81f26e347c9cb46d475e338008f4d6138a83bea3
exp45	Reduce WARMUP_RATIO from -0.1 to -0.15 to start with even higher learning rates immediately	1.062387	17.1	270819	30.9	1240	discard	The negative warmup has been beneficial (exp25), and since we've optimized other	NVIDIA RTX PRO 6000 Blackwell Server Edition	81f26e347c9cb46d475e338008f4d6138a83bea3
exp46	Reduce MATRIX_LR from 0.025 to 0.023	1.063598	17.1	270666	30.8	1239	discard	The history shows a clear pattern where reducing MATRIX_LR has been consistently	NVIDIA RTX PRO 6000 Blackwell Server Edition	81f26e347c9cb46d475e338008f4d6138a83bea3
exp47	Reduce EMBEDDING_LR from 0.6 to 0.5	1.063496	17.1	270486	30.8	1239	discard	The embedding learning rate has remained at 0.6 throughout most successful exper	NVIDIA RTX PRO 6000 Blackwell Server Edition	81f26e347c9cb46d475e338008f4d6138a83bea3
exp48	Reduce UNEMBEDDING_LR from 0.004 to 0.0038	1.062545	17.1	270576	30.8	1239	discard	The unembedding layer learning rate hasn't been successfully tuned yet, with exp	NVIDIA RTX PRO 6000 Blackwell Server Edition	81f26e347c9cb46d475e338008f4d6138a83bea3
exp49	Reduce HEAD_DIM from 128 to 96 to increase throughput and gradient steps within time budget	1.074379	18.0	234843	29.0	1075	discard	The current best results have been achieved by optimizing the learning rate sche	NVIDIA RTX PRO 6000 Blackwell Server Edition	81f26e347c9cb46d475e338008f4d6138a83bea3
exp50	Reduce WEIGHT_DECAY from 0.2 to 0.15 to allow for more aggressive parameter updates	1.062680	17.1	270576	30.8	1239	discard	With the current optimal hyperparameters established, weight decay might be cons	NVIDIA RTX PRO 6000 Blackwell Server Edition	81f26e347c9cb46d475e338008f4d6138a83bea3
exp51	Reduce ADAM_BETAS from (0.7, 0.95) to (0.75, 0.95)	1.062078	17.1	270819	30.8	1240	keep	The current best configuration uses ADAM_BETAS=(0.7, 0.95), but we haven't fully	NVIDIA RTX PRO 6000 Blackwell Server Edition	81f26e347c9cb46d475e338008f4d6138a83bea3
exp52	Reduce ADAM_BETAS from (0.75, 0.95) to (0.8, 0.95)	1.063603	17.1	271000	30.9	1240	discard	The trend shows improvement when increasing beta1 from 0.7 to 0.75 (exp51 achiev	NVIDIA RTX PRO 6000 Blackwell Server Edition	81f26e347c9cb46d475e338008f4d6138a83bea3
exp53	Reduce ADAM_BETAS from (0.75, 0.95) to (0.74, 0.95)	1.062399	17.1	270666	30.8	1239	discard	The recent experiments show a clear pattern where reducing the first Adam beta f	NVIDIA RTX PRO 6000 Blackwell Server Edition	81f26e347c9cb46d475e338008f4d6138a83bea3
exp54	Reduce ADAM_BETAS from (0.75, 0.95) to (0.76, 0.95)	1.062633	17.1	271000	30.9	1240	discard	The last successful experiment (exp51) improved val_bpb by increasing beta1 from	NVIDIA RTX PRO 6000 Blackwell Server Edition	81f26e347c9cb46d475e338008f4d6138a83bea3
exp55	Reduce ADAM_BETAS from (0.75, 0.95) to (0.73, 0.95)	1.062322	17.1	270576	30.8	1239	discard	The recent experiments show that ADAM_BETAS=(0.75, 0.95) achieved the best val_b	NVIDIA RTX PRO 6000 Blackwell Server Edition	81f26e347c9cb46d475e338008f4d6138a83bea3
exp56	Reduce ADAM_BETAS from (0.75, 0.95) to (0.72, 0.95)	1.062347	17.1	270576	30.8	1239	discard	The experiments around ADAM_BETAS show a clear pattern: reducing beta1 from 0.8 	NVIDIA RTX PRO 6000 Blackwell Server Edition	81f26e347c9cb46d475e338008f4d6138a83bea3
exp57	Reduce ADAM_BETAS from (0.75, 0.95) to (0.75, 0.94)	1.062531	17.1	270576	30.8	1239	discard	The recent experiments show that beta1=0.75 is optimal, but we haven't explored 	NVIDIA RTX PRO 6000 Blackwell Server Edition	81f26e347c9cb46d475e338008f4d6138a83bea3
exp58	Increase ASPECT_RATIO from 64 to 72 to better balance model width and depth	1.069889	20.5	220852	34.2	1012	discard	The current best configuration has been optimized for learning rates and schedul	NVIDIA RTX PRO 6000 Blackwell Server Edition	81f26e347c9cb46d475e338008f4d6138a83bea3
exp59	Reduce MATRIX_LR from 0.025 to 0.024	1.063593	17.1	270576	30.8	1239	discard	The experiments show a clear pattern where reducing MATRIX_LR has been beneficia	NVIDIA RTX PRO 6000 Blackwell Server Edition	81f26e347c9cb46d475e338008f4d6138a83bea3
exp60	Reduce FINAL_LR_FRAC from 0.05 to 0.04	1.062212	17.1	270576	30.8	1239	discard	The current best configuration has been achieved through careful tuning of Adam 	NVIDIA RTX PRO 6000 Blackwell Server Edition	81f26e347c9cb46d475e338008f4d6138a83bea3
exp61	Reduce EMBEDDING_LR from 0.6 to 0.45	1.064292	17.1	270819	30.9	1240	discard	The current best configuration has optimized most hyperparameters, but EMBEDDING	NVIDIA RTX PRO 6000 Blackwell Server Edition	81f26e347c9cb46d475e338008f4d6138a83bea3
exp62	Reduce SCALAR_LR from 0.35 to 0.32	1.066839	17.1	270486	30.8	1239	discard	The current best performing configuration has SCALAR_LR at 0.35 (from exp37), an	NVIDIA RTX PRO 6000 Blackwell Server Edition	81f26e347c9cb46d475e338008f4d6138a83bea3
exp63	Increase FINAL_LR_FRAC from 0.05 to 0.06	1.062155	17.1	270909	30.9	1240	discard	The current best configuration has FINAL_LR_FRAC at 0.05, but we've only tested 	NVIDIA RTX PRO 6000 Blackwell Server Edition	81f26e347c9cb46d475e338008f4d6138a83bea3
exp64	Reduce UNEMBEDDING_LR from 0.004 to 0.0036	1.063491	17.1	270576	30.8	1239	discard	The unembedding layer learning rate hasn't been successfully optimized yet, and 	NVIDIA RTX PRO 6000 Blackwell Server Edition	81f26e347c9cb46d475e338008f4d6138a83bea3
exp65	Reduce WEIGHT_DECAY from 0.2 to 0.05 to allow more aggressive parameter updates	1.064682	17.1	270819	30.9	1241	discard	Weight decay acts as a regularization constraint that can slow convergence. Give	NVIDIA RTX PRO 6000 Blackwell Server Edition	81f26e347c9cb46d475e338008f4d6138a83bea3
exp66	Increase WARMDOWN_RATIO from 0.84 to 0.88	1.062484	17.1	270576	30.8	1239	discard	The best performing experiments have consistently benefited from higher WARMDOWN	NVIDIA RTX PRO 6000 Blackwell Server Edition	81f26e347c9cb46d475e338008f4d6138a83bea3
exp67	Reduce WARMDOWN_RATIO from 0.84 to 0.80	1.062182	17.1	270576	30.8	1239	discard	The recent experiments show diminishing returns from fine-tuning individual lear	NVIDIA RTX PRO 6000 Blackwell Server Edition	81f26e347c9cb46d475e338008f4d6138a83bea3
exp68	Change WINDOW_PATTERN from "SSL" to "SL" to reduce computation per attention layer	1.057516	17.1	290139	33.7	1329	keep	The current best experiments use WINDOW_PATTERN="SSL" which gives 3 attention pa	NVIDIA RTX PRO 6000 Blackwell Server Edition	81f26e347c9cb46d475e338008f4d6138a83bea3
exp69	Reduce MATRIX_LR from 0.025 to 0.022 to optimize for the new "SL" window pattern	1.057405	17.1	289806	33.6	1328	keep	The recent change to "SL" window pattern significantly improved performance (1.0	NVIDIA RTX PRO 6000 Blackwell Server Edition	81f26e347c9cb46d475e338008f4d6138a83bea3
exp70	Reduce SCALAR_LR from 0.35 to 0.32 to optimize scalar parameters for the "SL" window pattern	1.060077	17.1	290236	33.7	1329	discard	With the successful window pattern change to "SL" in exp68-69, we should re-opti	NVIDIA RTX PRO 6000 Blackwell Server Edition	81f26e347c9cb46d475e338008f4d6138a83bea3
exp71	Reduce EMBEDDING_LR from 0.6 to 0.55	1.057451	17.1	289806	33.6	1328	discard	With the current best configuration using "SL" window pattern and MATRIX_LR at 0	NVIDIA RTX PRO 6000 Blackwell Server Edition	81f26e347c9cb46d475e338008f4d6138a83bea3
exp72	Reduce UNEMBEDDING_LR from 0.004 to 0.003	1.060241	17.1	290139	33.7	1329	discard	The current best experiments (exp68, exp69) achieved significant improvements by	NVIDIA RTX PRO 6000 Blackwell Server Edition	81f26e347c9cb46d475e338008f4d6138a83bea3
exp73	Reduce WEIGHT_DECAY from 0.2 to 0.1 to allow more aggressive parameter updates with the optimized "SL" pattern	1.058729	17.1	289903	33.7	1328	discard	With the current best configuration using "SL" window pattern and MATRIX_LR=0.02	NVIDIA RTX PRO 6000 Blackwell Server Edition	81f26e347c9cb46d475e338008f4d6138a83bea3
exp74	Reduce MATRIX_LR from 0.022 to 0.02	1.059604	17.1	290473	33.7	1330	discard	The trend shows consistent improvement when reducing MATRIX_LR: from 0.03 to 0.0	NVIDIA RTX PRO 6000 Blackwell Server Edition	81f26e347c9cb46d475e338008f4d6138a83bea3
exp75	Increase WARMDOWN_RATIO from 0.84 to 0.86	1.058004	17.1	289903	33.7	1328	discard	With the "SL" window pattern providing significant improvements, we should fine-	NVIDIA RTX PRO 6000 Blackwell Server Edition	81f26e347c9cb46d475e338008f4d6138a83bea3
exp76	Reduce FINAL_LR_FRAC from 0.05 to 0.02 to improve convergence with the optimized SL pattern	1.058450	17.1	290666	33.7	1330	discard	With the highly effective SL window pattern providing faster throughput and more	NVIDIA RTX PRO 6000 Blackwell Server Edition	81f26e347c9cb46d475e338008f4d6138a83bea3
exp77	Reduce ADAM_BETAS from (0.75, 0.95) to (0.7, 0.95)	1.057820	17.1	290139	33.7	1329	discard	The current best configuration uses "SL" window pattern with MATRIX_LR=0.022. Pr	NVIDIA RTX PRO 6000 Blackwell Server Edition	81f26e347c9cb46d475e338008f4d6138a83bea3
exp78	Reduce WARMUP_RATIO from -0.1 to -0.2	1.058414	17.1	290236	33.7	1329	discard	With the optimized "SL" window pattern giving us the best results so far, we sho	NVIDIA RTX PRO 6000 Blackwell Server Edition	81f26e347c9cb46d475e338008f4d6138a83bea3
exp79	Increase WARMDOWN_RATIO from 0.84 to 0.85 to fine-tune the learning rate schedule for the SL pattern	1.057853	17.1	290139	33.7	1329	discard	The current best results use WARMDOWN_RATIO of 0.84, and previous experiments sh	NVIDIA RTX PRO 6000 Blackwell Server Edition	81f26e347c9cb46d475e338008f4d6138a83bea3
