exp	description	val_bpb	peak_mem_gb	tok_sec	mfu	steps	status	notes	gpu_name	baseline_sha	watts	joules_per_token	total_energy_joules
exp69	Increase ASPECT_RATIO from 64 to 76 to leverage unused memory capacity (only 3.6GB of 31GB used) for increased model width while maintaining high step count	1.049164	4.5	366000	34.2	3352	discard	With MLP_RATIO tuning plateauing around 4.125 and only 12% memory utilization (3	NVIDIA GeForce RTX 5090	be1708a31970fe92fe4243ad68d39cf15f0a928e	560.7	0.001532	168221.9
exp70	Reduce WARMUP_RATIO from 0.1 to 0.08 to spend slightly more training time at peak learning rate	1.042521	3.6	514000	33.9	4707	discard	Previous WARMUP_RATIO experiments show 0.05 was worse (1.0435) and 0.12 was wors	NVIDIA GeForce RTX 5090	be1708a31970fe92fe4243ad68d39cf15f0a928e	532.4	0.001036	159739.4
exp71	Adjust WARMDOWN_RATIO from 0.58 to 0.55 to explore intermediate warmdown schedule between the current best (0.58) and a previous trial (0.5)	1.040124	3.6	514333	33.9	4709	discard	exp43 with WARMDOWN_RATIO=0.5 achieved 1.0409, while 0.58 achieved 1.0400. An in	NVIDIA GeForce RTX 5090	be1708a31970fe92fe4243ad68d39cf15f0a928e	532.0	0.001034	159624.2
exp72	Reduce WARMDOWN_RATIO from 0.58 to 0.52 to spend more training time at peak learning rate while maintaining stable convergence	1.040254	3.6	514000	33.9	4705	discard	With MLP_RATIO optimized at 4.125 achieving 1.0400, schedule tuning offers anoth	NVIDIA GeForce RTX 5090	be1708a31970fe92fe4243ad68d39cf15f0a928e	535.1	0.001041	160538.5
exp73	Increase ASPECT_RATIO from 64 to 66 to leverage unused memory capacity with optimized MLP_RATIO	1.049207	4.5	366333	34.3	3354	discard	Only 3.6GB of 31GB is being used, indicating significant unused capacity. Previo	NVIDIA GeForce RTX 5090	be1708a31970fe92fe4243ad68d39cf15f0a928e	560.2	0.001530	168099.5
exp74	Increase WARMDOWN_RATIO from 0.58 to 0.62 to spend more training time in the learning rate decay phase	1.039770	3.6	514333	33.9	4708	keep	The experiment history shows a clear trend where higher WARMDOWN_RATIO correlate	NVIDIA GeForce RTX 5090	be1708a31970fe92fe4243ad68d39cf15f0a928e	532.2	0.001035	159696.5
exp75	Increase WARMDOWN_RATIO from 0.62 to 0.65 to extend the learning rate decay phase further	1.040011	3.6	514666	33.9	4711	discard	The previous increase from 0.58 to 0.62 (exp74) yielded the best result (1.0398)	NVIDIA GeForce RTX 5090	be1708a31970fe92fe4243ad68d39cf15f0a928e	532.7	0.001035	159831.1
exp76	Reduce FINAL_LR_FRAC from 0.055 to 0.025 to enable more aggressive learning rate decay with the optimized WARMDOWN_RATIO of 0.62	1.040206	3.6	513495	33.9	4703	discard	With the improved WARMDOWN_RATIO of 0.62 from exp74, the learning rate schedule 	NVIDIA GeForce RTX 5090	be1708a31970fe92fe4243ad68d39cf15f0a928e	537.1	0.001046	161152.9
exp77	Reduce WARMUP_RATIO from 0.1 to 0.09 to spend more training time at peak learning rate while keeping the successful WARMDOWN_RATIO=0.62	1.041623	3.6	514000	33.9	4705	discard	Exp74 showed WARMDOWN_RATIO=0.62 is optimal, but WARMUP_RATIO=0.1 means 72% of t	NVIDIA GeForce RTX 5090	be1708a31970fe92fe4243ad68d39cf15f0a928e	537.0	0.001045	161121.5
exp78	Reduce WARMDOWN_RATIO from 0.62 to 0.61 to fine-tune the learning rate decay schedule around the current optimum	1.040297	3.6	514000	33.9	4705	discard	Exp74 found WARMDOWN_RATIO=0.62 achieves 1.0398 (best), while exp75's 0.65 gave 	NVIDIA GeForce RTX 5090	be1708a31970fe92fe4243ad68d39cf15f0a928e	534.3	0.001040	160298.9
exp79	Increase SCALAR_LR from 0.35 to 0.45 to better optimize scalar parameters (layer norms, biases) in the high step count regime	1.041408	3.6	514333	33.9	4708	discard	SCALAR_LR controls learning rate for per-layer scalars which behave differently 	NVIDIA GeForce RTX 5090	be1708a31970fe92fe4243ad68d39cf15f0a928e	532.8	0.001036	159841.7
exp80	Reduce FINAL_LR_FRAC from 0.055 to 0.05 to fine-tune the learning rate decay endpoint with the optimal WARMDOWN_RATIO=0.62	1.039910	3.6	514000	33.9	4707	discard	The best result (exp74: 1.0398) used WARMDOWN_RATIO=0.62 with FINAL_LR_FRAC=0.05	NVIDIA GeForce RTX 5090	be1708a31970fe92fe4243ad68d39cf15f0a928e	534.3	0.001039	160316.9
exp81	Reduce FINAL_LR_FRAC from 0.055 to 0.045 to fine-tune the learning rate decay endpoint with the optimal WARMDOWN_RATIO=0.62	1.039934	3.6	513666	33.9	4703	discard	Exp74 achieved the best val_bpb (1.0398) with WARMDOWN_RATIO=0.62 and FINAL_LR_F	NVIDIA GeForce RTX 5090	be1708a31970fe92fe4243ad68d39cf15f0a928e	535.8	0.001043	160766.6
exp82	Increase FINAL_LR_FRAC from 0.055 to 0.06 to explore slightly higher end-of-training learning rate with the optimal WARMDOWN_RATIO=0.62	1.040171	3.6	513666	33.9	4702	discard	The best result (exp74: 1.0398) used FINAL_LR_FRAC=0.055 with WARMDOWN_RATIO=0.6	NVIDIA GeForce RTX 5090	be1708a31970fe92fe4243ad68d39cf15f0a928e	536.3	0.001044	160900.3
exp83	Increase DEPTH from default to 11 to add model capacity while staying safely within memory limits enabled by activation checkpointing	1.069999	7.3	217188	36.8	1991	discard	The current configuration uses only 3.6GB of 31GB available memory, leaving sign	NVIDIA GeForce RTX 5090	be1708a31970fe92fe4243ad68d39cf15f0a928e	471.6	0.002170	141559.3
exp84	Reduce FINAL_LR_FRAC from 0.055 to 0.0475 to fine-tune the learning rate decay endpoint between the two best-performing values (0.045 and 0.05 both achieved 1.0399)	1.040136	3.6	514000	33.9	4707	discard	Experiments exp80 (FINAL_LR_FRAC=0.05) and exp81 (FINAL_LR_FRAC=0.045) both achi	NVIDIA GeForce RTX 5090	be1708a31970fe92fe4243ad68d39cf15f0a928e	533.9	0.001039	160182.3
exp85	Reduce FINAL_LR_FRAC from 0.055 to 0.049 to fine-tune the learning rate decay endpoint between the best-performing values (0.045 and 0.05 both achieved 1.0399)	1.040098	3.6	513666	33.9	4704	discard	The best results cluster around FINAL_LR_FRAC values of 0.045-0.05 (exp80, exp81	NVIDIA GeForce RTX 5090	be1708a31970fe92fe4243ad68d39cf15f0a928e	535.7	0.001043	160713.8
exp86	Fine-tune FINAL_LR_FRAC from 0.055 to 0.048 to search for optimal learning rate decay endpoint between the best-performing values (0.045 and 0.05 both achieved 1.0399)	0.000000	0.0	0	0.0	0	crash	training crashed or timed out	NVIDIA GeForce RTX 5090		0.0	0.000000	0.0
exp87	Increase WARMUP_RATIO from 0.1 to 0.11 to explore slightly more gradual learning rate ramp-up with the optimized WARMDOWN_RATIO=0.62	1.040091	3.6	512666	33.8	4694	discard	With WARMDOWN_RATIO=0.62 giving the best result (exp74: 1.0398), I want to fine-	NVIDIA GeForce RTX 5090		533.5	0.001041	160057.9
exp88	Adjust ADAM_BETAS beta2 from 0.988 to 0.987 to explore slightly lower momentum in the high step count regime	1.040106	3.6	512495	33.8	4695	discard	The beta2 parameter has shown sensitivity around 0.988-0.989 (exp66 got 1.0401 w	NVIDIA GeForce RTX 5090		533.6	0.001041	160122.6
exp89	Reduce EMBEDDING_LR from 0.9 to 0.8 to better balance embedding layer learning with the optimized WARMDOWN_RATIO=0.62 schedule	1.042979	3.6	512666	33.8	4693	discard	Previous EMBEDDING_LR experiments (0.6, 0.7, 1.0) were tested with suboptimal sc	NVIDIA GeForce RTX 5090		532.9	0.001040	159898.1
exp90	Fine-tune FINAL_LR_FRAC from 0.055 to 0.05125 to search for optimal learning rate decay endpoint between the best-performing values (0.045 and 0.05 both achieved 1.0399)	0.000000	0.0	0	0.0	0	crash	training crashed or timed out	NVIDIA GeForce RTX 5090		0.0	0.000000	0.0
exp91	Reduce HEAD_DIM from 128 to 112 to slightly decrease per-step computation while maintaining attention capacity	1.054441	4.3	407333	30.9	3730	discard	With only 3.6GB of 31GB memory used, there's headroom to explore architecture ch	NVIDIA GeForce RTX 5090		474.6	0.001165	142397.9
exp92	Increase DEPTH from default to 12 to add model capacity while leveraging memory headroom (3.6GB used of 31GB) enabled by activation checkpointing and optimized config	1.074693	7.8	200266	36.8	1833	discard	Previous depth increases crashed at higher memory usage (7-14GB), but the curren	NVIDIA GeForce RTX 5090		476.1	0.002379	142875.1
exp93	Increase WARMDOWN_RATIO from 0.62 to 0.63 to extend the learning rate decay phase slightly beyond the current best configuration	1.040275	3.6	512333	33.8	4691	discard	The current best result (exp74, WARMDOWN_RATIO=0.62, val_bpb=1.0398) suggests th	NVIDIA GeForce RTX 5090		536.3	0.001047	160905.7
exp94	Reduce ADAM_BETAS beta1 from 0.84 to 0.80 to explore lower momentum in the high step count regime	1.041143	3.6	512495	33.8	4693	discard	Beta1 has been tested at 0.82, 0.84, 0.86, and 0.9, but never below 0.82. Lower 	NVIDIA GeForce RTX 5090		534.2	0.001042	160280.7
exp95	Reduce WEIGHT_DECAY from 0.05 to 0.04 to test less regularization with the optimal WARMDOWN_RATIO=0.62 schedule	1.040698	3.6	511829	33.8	4687	discard	Previous weight decay experiments (exp19: 0.02, exp23: 0.08) were tested before 	NVIDIA GeForce RTX 5090		538.2	0.001051	161485.1
exp96	Reduce FINAL_LR_FRAC from 0.055 to 0.0525 to fine-tune the learning rate decay endpoint between the best-performing values (0.05 and 0.055)	1.040258	3.6	512162	33.8	4691	discard	Exp74 achieved 1.0398 with FINAL_LR_FRAC=0.055, while exp80 achieved 1.0399 with	NVIDIA GeForce RTX 5090		536.3	0.001047	160924.5
exp97	Reduce FINAL_LR_FRAC from 0.055 to 0.046 to fine-tune the learning rate decay endpoint between the best-performing values (0.045 and 0.05 both achieved 1.0399)	1.040239	3.6	512333	33.8	4691	discard	The best val_bpb results cluster around FINAL_LR_FRAC values of 0.045-0.05 (exp8	NVIDIA GeForce RTX 5090		536.2	0.001047	160876.0
exp98	Increase MATRIX_LR from 0.0266 to 0.030 to better leverage the high step count regime with optimized schedule	1.040193	3.6	511496	33.7	4685	discard	With ~4700 steps and the optimized WARMDOWN_RATIO=0.62 schedule, a slightly high	NVIDIA GeForce RTX 5090		536.2	0.001048	160893.8
exp99	Increase UNEMBEDDING_LR from 0.006 to 0.008 to better balance output layer learning with other parameters	1.041753	3.6	513000	33.8	4698	discard	UNEMBEDDING_LR has only been tried once (exp30 at 0.012, which was too high). Th	NVIDIA GeForce RTX 5090		532.8	0.001038	159866.7
