exp	description	val_bpb	peak_mem_gb	tok_sec	mfu	steps	status	notes	gpu_name	baseline_sha	watts	joules_per_token	total_energy_joules
exp87	Increase SCALAR_LR from 10.0 to 13.0	1.037707	5.8	546666	36.0	5006	discard	We have seen small gains by increasing MATRIX_LR and UNEMBEDDING_LR. Since SCALA	NVIDIA GeForce RTX 5090	31130ae2797ecafd91510fe75904552b5230e0b7	560.3	0.001025	168094.2
exp88	Increase SCALAR_LR from 10.0 to 11.5	1.039563	5.8	547000	36.1	5009	discard	Previous attempts at SCALAR_LR (11.0, 12.0, 12.5, 13.0, 15.0) were either discar	NVIDIA GeForce RTX 5090	31130ae2797ecafd91510fe75904552b5230e0b7	559.9	0.001024	167997.2
exp89	Increase MATRIX_LR from 0.04 to 0.0425	1.035926	5.8	546666	36.0	5006	discard	Experiment 81 (0.04) showed significant improvement over 78 (0.035), but 82 (0.0	NVIDIA GeForce RTX 5090	31130ae2797ecafd91510fe75904552b5230e0b7	559.7	0.001024	167921.2
exp90	Increase UNEMBEDDING_LR from 0.02 to 0.035	1.039272	5.8	547333	36.1	5010	discard	Exp80 showed a significant improvement by increasing UNEMBEDDING_LR to 0.02, whi	NVIDIA GeForce RTX 5090	31130ae2797ecafd91510fe75904552b5230e0b7	559.7	0.001023	167913.0
exp91	Increase SCALAR_LR from 10.0 to 14.0	1.041581	5.8	547000	36.1	5008	discard	Previous attempts to increase SCALAR_LR (11.0, 12.0, 12.5, 13.0) were slightly u	NVIDIA GeForce RTX 5090	31130ae2797ecafd91510fe75904552b5230e0b7	560.8	0.001025	168244.7
exp92	Increase SCALAR_LR from 10.0 to 18.0	1.038797	5.8	546000	36.0	4999	discard	Previous small increases in SCALAR_LR (11.0, 12.0, 13.0, 14.0) failed or were di	NVIDIA GeForce RTX 5090	31130ae2797ecafd91510fe75904552b5230e0b7	559.1	0.001024	167735.6
exp93	Increase SCALAR_LR from 10.0 to 15.0	1.038150	5.8	547333	36.1	5011	discard	While some SCALAR_LR increases were discarded, the current state is highly optim	NVIDIA GeForce RTX 5090	31130ae2797ecafd91510fe75904552b5230e0b7	558.3	0.001020	167516.4
exp94	Increase SCALAR_LR from 10.0 to 25.0	1.041058	5.8	547000	36.1	5008	discard	Previous attempts to increase SCALAR_LR in small increments (11.0, 12.0, 13.0, 1	NVIDIA GeForce RTX 5090	31130ae2797ecafd91510fe75904552b5230e0b7	559.3	0.001023	167804.1
exp95	Increase TOTAL_BATCH_SIZE from 32768 to 40960	0.000000	0.0	0	0.0	0	crash	training crashed or timed out	NVIDIA GeForce RTX 5090	31130ae2797ecafd91510fe75904552b5230e0b7	0.0	0.000000	0.0
exp96	Decrease ADAM_BETAS beta1 from 0.8 to 0.7	1.035072	5.8	545484	36.0	4997	discard	Lowering beta1 can increase the adaptability of the optimizer to recent gradient	NVIDIA GeForce RTX 5090	31130ae2797ecafd91510fe75904552b5230e0b7	556.9	0.001021	167108.4
exp97	Increase DEPTH by 1 and enable ACTIVATION_CHECKPOINTING	1.059365	5.0	325224	33.9	2977	discard	Previous attempts to increase DEPTH alone (exp11) or with activation checkpointi	NVIDIA GeForce RTX 5090	31130ae2797ecafd91510fe75904552b5230e0b7	554.1	0.001704	166259.1
exp98	Increase FINAL_LR_FRAC from 0.03 to 0.05	1.036404	5.8	547333	36.1	5010	discard	Exp 65 showed that increasing FINAL_LR_FRAC from 0.02 to 0.03 improved val_bpb. 	NVIDIA GeForce RTX 5090	31130ae2797ecafd91510fe75904552b5230e0b7	560.2	0.001024	168085.7
exp99	Decrease TOTAL_BATCH_SIZE from 32768 to 30000	0.000000	0.0	0	0.0	0	crash	training crashed or timed out	NVIDIA GeForce RTX 5090	31130ae2797ecafd91510fe75904552b5230e0b7	0.0	0.000000	0.0
