exp	description	val_bpb	peak_mem_gb	tok_sec	mfu	steps	status	notes	gpu_name	baseline_sha	watts	joules_per_token	total_energy_joules
exp68	Reduce ADAM_BETAS beta2 from 0.975 to 0.973 for finer second-moment smoothing adjustment with the optimized configuration	1.076058	5.9	300899	17.1	2756	discard	The current best result (exp61) uses beta2=0.975, while exp60 tested beta2=0.97 	NVIDIA GeForce RTX 5090	1666bb5c223d000512afb21b1a09f15c69494df9	475.3	0.001579	142615.7
exp69	Reduce MATRIX_LR from 0.03 to 0.029 for slightly more conservative matrix parameter updates with the optimized Adam betas configuration	1.075537	5.9	300899	17.1	2755	keep	With the optimized Adam betas (0.75, 0.975) providing less smoothing, a slightly	NVIDIA GeForce RTX 5090	1666bb5c223d000512afb21b1a09f15c69494df9	477.7	0.001588	143335.1
exp70	Reduce MATRIX_LR from 0.029 to 0.0285 to test if slightly more conservative matrix parameter updates further improve convergence	1.075620	5.9	300333	17.1	2751	discard	The trend shows MATRIX_LR improvements: 0.03→0.029 gave the best result (1.0755)	NVIDIA GeForce RTX 5090	1666bb5c223d000512afb21b1a09f15c69494df9	481.0	0.001601	144309.9
exp71	Reduce WARMDOWN_RATIO from 0.55 to 0.54 to fine-tune the learning rate schedule around the current optimum	1.075940	5.9	300233	17.1	2750	discard	Exp61 found WARMDOWN_RATIO=0.55 optimal (1.0756), while exp66 with 0.56 was slig	NVIDIA GeForce RTX 5090	1666bb5c223d000512afb21b1a09f15c69494df9	480.2	0.001599	144110.9
exp72	Increase MATRIX_LR from 0.029 to 0.0295 to test if the optimal learning rate lies between 0.029 and 0.03	1.075780	5.9	300566	17.1	2752	discard	Exp69 found 0.029 to be better than 0.03, but exp70 showed 0.0285 was worse than	NVIDIA GeForce RTX 5090	1666bb5c223d000512afb21b1a09f15c69494df9	476.4	0.001585	142955.6
exp73	Reduce MATRIX_LR from 0.029 to 0.0288 to test if the optimal learning rate lies slightly below 0.029	1.075811	5.9	299900	17.1	2747	discard	The MATRIX_LR tuning shows an asymmetric pattern: 0.0285 gave 1.0756, 0.029 gave	NVIDIA GeForce RTX 5090	1666bb5c223d000512afb21b1a09f15c69494df9	476.3	0.001588	142914.9
exp74	Reduce UNEMBEDDING_LR from 0.003 to 0.0025 for more conservative unembedding layer updates with the optimized configuration	1.076893	5.9	300000	17.1	2748	discard	UNEMBEDDING_LR has remained at 0.003 since exp23 without systematic exploration 	NVIDIA GeForce RTX 5090	1666bb5c223d000512afb21b1a09f15c69494df9	480.2	0.001600	144054.0
exp75	Change WINDOW_PATTERN from "SSSL" to "SLSL" to test a different sliding window configuration with optimized learning rates	1.065113	5.9	353000	21.1	3231	keep	Only "SSSS" (exp18) has been tried as an alternative to the default "SSSL", and 	NVIDIA GeForce RTX 5090	1666bb5c223d000512afb21b1a09f15c69494df9	475.8	0.001348	142750.7
exp76	Reduce ASPECT_RATIO from 64 to 44 to increase throughput and gradient steps with the optimized SLSL window pattern	1.069909	4.5	509333	19.5	4662	discard	The SLSL window pattern (exp75) unlocked significant throughput gains (353k vs 3	NVIDIA GeForce RTX 5090	1666bb5c223d000512afb21b1a09f15c69494df9	476.4	0.000936	142936.6
exp77	Reduce DEVICE_BATCH_SIZE to increase gradient steps with the optimized SLSL window pattern	1.065475	5.9	353000	21.1	3231	discard	Exp76 showed that architectural changes with SLSL can significantly increase thr	NVIDIA GeForce RTX 5090	1666bb5c223d000512afb21b1a09f15c69494df9	490.5	0.001390	147179.6
exp78	Increase MATRIX_LR from 0.029 to 0.031 with the SLSL window pattern to test if higher throughput allows more aggressive learning rates	1.065337	5.9	352333	21.1	3226	discard	The SLSL window pattern (exp75) increased throughput by ~17%, providing more gra	NVIDIA GeForce RTX 5090	1666bb5c223d000512afb21b1a09f15c69494df9	491.1	0.001394	147361.4
exp79	Increase DEPTH by 2 layers with the SLSL window pattern to leverage improved throughput for more model capacity	1.075917	8.9	219926	23.2	2014	discard	The SLSL window pattern (exp75) increased throughput from ~300k to ~353k Tok/s, 	NVIDIA GeForce RTX 5090	1666bb5c223d000512afb21b1a09f15c69494df9	509.9	0.002319	153026.1
exp80	Reduce HEAD_DIM from 128 to 112 with SLSL window pattern to test intermediate head dimension for improved throughput	1.073625	6.5	293333	20.3	2687	discard	HEAD_DIM=96 (exp10) and HEAD_DIM=160 (exp48) were both tested with SSSL but neit	NVIDIA GeForce RTX 5090	1666bb5c223d000512afb21b1a09f15c69494df9	474.3	0.001616	142281.9
exp81	Change COMPILE_MODE from 'reduce-overhead' to 'max-autotune' with the SLSL window pattern to leverage GPU-specific kernel optimization	0.000000	0.0	0	0.0	0	crash	training crashed or timed out	NVIDIA GeForce RTX 5090	1666bb5c223d000512afb21b1a09f15c69494df9	0.0	0.000000	0.0
exp82	Reduce MATRIX_LR from 0.029 to 0.027 with the SLSL window pattern to leverage the increased gradient steps for more conservative convergence	1.064288	5.9	352333	21.1	3227	keep	With the SLSL window pattern (exp75), we now get 3231 steps vs ~2750 previously 	NVIDIA GeForce RTX 5090	1666bb5c223d000512afb21b1a09f15c69494df9	490.6	0.001392	147186.7
exp83	Reduce SCALAR_LR from 0.3 to 0.25 with the SLSL window pattern to test more conservative scalar parameter updates	1.064776	5.9	352666	21.1	3230	discard	The current best experiment (exp82) optimized MATRIX_LR with SLSL but kept SCALA	NVIDIA GeForce RTX 5090	1666bb5c223d000512afb21b1a09f15c69494df9	491.3	0.001393	147397.4
exp84	Reduce MATRIX_LR from 0.027 to 0.026 to continue the successful trend of more conservative matrix parameter updates with the SLSL window pattern	1.064567	5.9	352215	21.1	3227	discard	The trend shows MATRIX_LR=0.027 (exp82: 1.0643) outperformed MATRIX_LR=0.029 (ex	NVIDIA GeForce RTX 5090	1666bb5c223d000512afb21b1a09f15c69494df9	495.4	0.001406	148659.0
exp86	Increase MATRIX_LR from 0.027 to 0.0275 to test if the optimal learning rate is slightly higher with the SLSL window pattern	1.064307	5.9	353215	21.1	3234	discard	Exp82 (0.027) achieved 1.0643, while exp84 (0.026) got 1.0646, suggesting the op	NVIDIA GeForce RTX 5090	1666bb5c223d000512afb21b1a09f15c69494df9	494.4	0.001400	148375.8
exp87	Increase WARMDOWN_RATIO from 0.55 to 0.58 with the SLSL window pattern to extend the high learning rate phase leveraging improved throughput	1.063995	5.9	353000	21.1	3232	keep	The SLSL window pattern (exp75) dramatically improved throughput from ~300k to ~	NVIDIA GeForce RTX 5090	1666bb5c223d000512afb21b1a09f15c69494df9	494.6	0.001401	148409.4
exp88	Change WINDOW_PATTERN from "SLSL" to "LLSL" to increase full-context attention coverage while maintaining the high-throughput configuration	1.050578	5.9	428190	26.9	3920	keep	The SLSL pattern (2 full, 2 half context) gave a major improvement, but we haven	NVIDIA GeForce RTX 5090	1666bb5c223d000512afb21b1a09f15c69494df9	492.7	0.001151	147842.1
exp89	Reduce EMBEDDING_LR from 0.6 to 0.5 with the LLSL window pattern to test more conservative embedding updates with the improved attention coverage configuration	1.050807	5.9	428523	27.0	3925	discard	The LLSL window pattern (exp88) significantly improved val_bpb to 1.0506, but EM	NVIDIA GeForce RTX 5090	1666bb5c223d000512afb21b1a09f15c69494df9	510.8	0.001192	153279.4
exp90	Reduce MATRIX_LR from 0.027 to 0.025 with the LLSL window pattern to test if more conservative matrix updates benefit from the higher throughput configuration	1.050789	5.9	428523	26.9	3924	discard	The LLSL window pattern (exp88) significantly increased throughput (428k tok/s v	NVIDIA GeForce RTX 5090	1666bb5c223d000512afb21b1a09f15c69494df9	515.9	0.001204	154794.5
exp91	Reduce UNEMBEDDING_LR from 0.003 to 0.002 with the LLSL window pattern to test more conservative unembedding layer updates with the high-throughput configuration	1.052925	5.9	428857	27.0	3928	discard	The unembedding layer learning rate has been relatively underexplored compared t	NVIDIA GeForce RTX 5090	1666bb5c223d000512afb21b1a09f15c69494df9	511.8	0.001193	153583.4
exp92	Increase WARMDOWN_RATIO from 0.58 to 0.62 to extend the high learning rate phase further with the LLSL window pattern	1.050695	5.9	427333	26.9	3911	discard	The LLSL window pattern (exp88) achieved the best val_bpb (1.0506) with signific	NVIDIA GeForce RTX 5090	1666bb5c223d000512afb21b1a09f15c69494df9	513.3	0.001202	153993.8
exp93	Increase WARMDOWN_RATIO from 0.58 to 0.59 to fine-tune the learning rate schedule with the high-throughput LLSL window pattern	1.050708	5.9	428333	26.9	3922	discard	The LLSL window pattern (exp88) achieved a breakthrough val_bpb of 1.0506. exp92	NVIDIA GeForce RTX 5090	1666bb5c223d000512afb21b1a09f15c69494df9	515.4	0.001203	154616.7
exp94	Increase FINAL_LR_FRAC from 0.05 to 0.06 with the LLSL window pattern to maintain a slightly stronger learning signal at end of training given the higher throughput	1.050453	5.9	428333	26.9	3920	keep	With the LLSL window pattern achieving ~428k Tok/s (vs ~300k before), we're gett	NVIDIA GeForce RTX 5090	1666bb5c223d000512afb21b1a09f15c69494df9	512.2	0.001196	153682.4
exp95	Reduce ADAM_BETAS beta2 from 0.975 to 0.97 with the LLSL window pattern to test if lower second-moment smoothing benefits from the higher throughput configuration	0.000000	0.0	0	0.0	0	crash	training crashed or timed out	NVIDIA GeForce RTX 5090	1666bb5c223d000512afb21b1a09f15c69494df9	0.0	0.000000	0.0
exp96	Reduce MLP_RATIO from 4.0 to 3.5 with the LLSL window pattern to decrease per-layer computation and increase throughput	1.051046	5.9	427333	26.9	3913	discard	MLP_RATIO reductions were only tested with SSSL window pattern (exp55, exp56), n	NVIDIA GeForce RTX 5090	1666bb5c223d000512afb21b1a09f15c69494df9	508.8	0.001190	152644.2
exp97	Reduce ASPECT_RATIO from 64 to 58 with the LLSL window pattern to increase throughput and gradient steps while preserving more model capacity than the failed ASPECT_RATIO=44 experiment	1.050910	5.9	427857	26.9	3917	discard	The current LLSL configuration achieves 428k Tok/s, but ASPECT_RATIO=44 previous	NVIDIA GeForce RTX 5090	1666bb5c223d000512afb21b1a09f15c69494df9	512.1	0.001197	153651.7
exp99	Increase DEPTH by 1 layer with the LLSL window pattern to add model capacity while leveraging the high-throughput configuration	1.058109	8.1	292902	29.4	2681	discard	The LLSL window pattern (exp88) achieved a major breakthrough with 428k tok/s th	NVIDIA GeForce RTX 5090	1666bb5c223d000512afb21b1a09f15c69494df9	508.1	0.001736	152476.8
