exp	description	val_bpb	peak_mem_gb	tok_sec	mfu	steps	status	notes	gpu_name	baseline_sha	watts	joules_per_token	total_energy_joules
exp86	Increase MLP_RATIO from 8.0 to 10.0	1.053157	5.9	426000	26.8	3901	discard	Experiments 84 and 85 showed a consistent trend where increasing MLP_RATIO (from	NVIDIA GeForce RTX 5090	c91026d4da487405ae576d8232f2f344b482bd91	552.7	0.001297	165801.1
exp87	Increase MATRIX_LR from 0.02 to 0.021 (re-evaluating small increase with MLP_RATIO=8.0)	1.055984	5.9	427000	26.9	3908	discard	Previous MATRIX_LR increases were tried with smaller MLP ratios. Now that we hav	NVIDIA GeForce RTX 5090	c91026d4da487405ae576d8232f2f344b482bd91	545.9	0.001279	163777.3
exp88	Increase FINAL_LR_FRAC from 0.05 to 0.15	1.056052	5.9	425524	26.8	3896	discard	Exp32 showed a benefit from introducing a non-zero FINAL_LR_FRAC. With the curre	NVIDIA GeForce RTX 5090	c91026d4da487405ae576d8232f2f344b482bd91	549.5	0.001292	164884.9
exp89	Increase MATRIX_LR from 0.02 to 0.0205	1.060206	5.9	426000	26.8	3900	discard	Previous attempts to increase MATRIX_LR (exp87, exp43, exp45) used increments of	NVIDIA GeForce RTX 5090	c91026d4da487405ae576d8232f2f344b482bd91	547.7	0.001286	164332.0
exp90	Decrease WEIGHT_DECAY from 0.12 to 0.08	1.053354	5.9	425666	26.8	3898	discard	We previously saw improvements by decreasing WEIGHT_DECAY from 0.2 to 0.15 and t	NVIDIA GeForce RTX 5090	c91026d4da487405ae576d8232f2f344b482bd91	548.4	0.001288	164515.8
exp91	Increase MATRIX_LR from 0.02 to 0.03	1.055293	5.9	426333	26.8	3904	discard	Since we have significantly increased the model capacity via MLP_RATIO (8.0), th	NVIDIA GeForce RTX 5090	c91026d4da487405ae576d8232f2f344b482bd91	542.5	0.001272	162777.8
exp92	Increase MATRIX_LR from 0.02 to 0.0201	1.052860	5.9	426333	26.8	3904	discard	Previous experiments showed that a very small decrease in MATRIX_LR (0.02) was o	NVIDIA GeForce RTX 5090	c91026d4da487405ae576d8232f2f344b482bd91	546.8	0.001282	164055.0
exp93	Increase MATRIX_LR from 0.02 to 0.0202	1.054169	5.9	425524	26.8	3898	discard	Exp85 showed that increasing capacity via MLP_RATIO improved performance. Since 	NVIDIA GeForce RTX 5090	c91026d4da487405ae576d8232f2f344b482bd91	550.6	0.001293	165199.2
exp94	Increase MATRIX_LR from 0.02 to 0.02005	1.053025	5.9	426333	26.8	3902	discard	Previous attempts to increase MATRIX_LR by 0.001 or more (exp 87, 89, 91) failed	NVIDIA GeForce RTX 5090	c91026d4da487405ae576d8232f2f344b482bd91	547.3	0.001284	164184.8
exp95	Increase ASPECT_RATIO from 64 to 70	1.060144	7.3	316561	28.4	2900	discard	Prior experiments with ASPECT_RATIO 66, 68, and 72 were either discarded or push	NVIDIA GeForce RTX 5090	c91026d4da487405ae576d8232f2f344b482bd91	565.9	0.001787	169797.8
exp96	Decrease ADAM_BETAS beta1 from 0.8 to 0.75	1.054570	5.9	425858	26.8	3901	discard	Experiment 29 (beta1=0.7) and Experiment 80 (beta1=0.7) were not successful, but	NVIDIA GeForce RTX 5090	c91026d4da487405ae576d8232f2f344b482bd91	548.1	0.001287	164466.1
exp97	Decrease ADAM_BETAS beta1 from 0.8 to 0.85	1.053532	5.9	427857	26.9	3919	discard	Previous attempts to decrease beta1 (0.7, 0.75, 0.6) were unsuccessful, but a sl	NVIDIA GeForce RTX 5090	c91026d4da487405ae576d8232f2f344b482bd91	541.2	0.001265	162394.7
exp98	Increase MATRIX_LR from 0.02 to 0.02001	1.055501	5.9	428190	26.9	3920	discard	Previous attempts to increase MATRIX_LR significantly (exp43, 45, 46, 47, 91) fa	NVIDIA GeForce RTX 5090	c91026d4da487405ae576d8232f2f344b482bd91	541.0	0.001264	162335.8
exp99	Increase MATRIX_LR from 0.02 to 0.0205 with MLP_RATIO=8.0	1.058563	5.9	428000	26.9	3919	discard	While previous matrix LR increases failed at smaller MLP ratios, the increased c	NVIDIA GeForce RTX 5090	c91026d4da487405ae576d8232f2f344b482bd91	541.7	0.001265	162501.3
