exp	description	val_bpb	peak_mem_gb	tok_sec	mfu	steps	status	notes	gpu_name	baseline_sha	watts	joules_per_token	total_energy_joules
exp89	Increase MLP_RATIO from 10.0 to 11.0	1.038898	5.8	538333	35.5	4928	discard	Exp43 showed that increasing MLP_RATIO from 8.0 to 10.0 was a keep (1.0391). Whi	NVIDIA GeForce RTX 5090	9a884b008ec4db04f866b485ba020b3a81cf2896	566.2	0.001052	169874.1
exp90	Increase ASPECT_RATIO from 64 to 68	1.048540	7.3	382000	35.7	3497	discard	Previous attempts to increase ASPECT_RATIO by 8 (to 72) or 6 (to 70) failed or w	NVIDIA GeForce RTX 5090	9a884b008ec4db04f866b485ba020b3a81cf2896	567.1	0.001485	170154.9
exp91	Increase MATRIX_LR from 0.045 to 0.0455	1.038402	5.8	542000	35.7	4962	discard	We have seen consistent small improvements with very slight increases in MATRIX_	NVIDIA GeForce RTX 5090	9a884b008ec4db04f866b485ba020b3a81cf2896	562.8	0.001039	168860.7
exp92	Increase ASPECT_RATIO from 64 to 66	1.048213	7.3	382333	35.8	3501	discard	Prior attempts to increase ASPECT_RATIO by larger jumps (70, 80) were discarded,	NVIDIA GeForce RTX 5090	9a884b008ec4db04f866b485ba020b3a81cf2896	567.1	0.001483	170164.0
exp93	Decrease WARMDOWN_RATIO from 0.6 to 0.55	1.037954	5.8	542485	35.8	4969	discard	Previous decreases in WARMDOWN_RATIO (exp24) showed a keep, while more aggressiv	NVIDIA GeForce RTX 5090	9a884b008ec4db04f866b485ba020b3a81cf2896	560.9	0.001034	168295.7
exp94	Increase MLP_RATIO from 10.0 to 12.0	1.037864	5.8	542333	35.8	4964	discard	Increasing the MLP capacity (MLP_RATIO) often helps in reducing val_bpb by allow	NVIDIA GeForce RTX 5090	9a884b008ec4db04f866b485ba020b3a81cf2896	563.6	0.001040	169112.1
exp95	Increase MLP_RATIO from 10.0 to 16.0	1.037884	5.8	540333	35.6	4946	discard	Exp 43 showed a gain when increasing MLP_RATIO to 10.0, but subsequent smaller i	NVIDIA GeForce RTX 5090	9a884b008ec4db04f866b485ba020b3a81cf2896	566.7	0.001049	170044.3
exp96	Increase SCALAR_LR from 10.0 to 15.0	1.044951	5.8	543333	35.8	4973	discard	Previous increases in SCALAR_LR (exp6, exp30) were successful in lowering val_bp	NVIDIA GeForce RTX 5090	9a884b008ec4db04f866b485ba020b3a81cf2896	561.4	0.001034	168442.7
exp97	Increase MLP_RATIO from 10.0 to 11.5	1.037722	5.8	543000	35.8	4971	discard	Prior experiments with MLP_RATIO (exp7, exp43, exp83, exp89, exp94, exp95) showe	NVIDIA GeForce RTX 5090	9a884b008ec4db04f866b485ba020b3a81cf2896	561.7	0.001035	168531.6
exp98	Decrease WARMDOWN_RATIO from 0.6 to 0.45	1.039674	5.8	539333	35.5	4937	discard	Previous experiments with WARMDOWN_RATIO were inconsistent, but a shorter warmdo	NVIDIA GeForce RTX 5090	9a884b008ec4db04f866b485ba020b3a81cf2896	563.9	0.001046	169193.5
exp99	Enable ACTIVATION_CHECKPOINTING with current best settings	1.045872	3.6	505666	33.3	4629	discard	Previous attempts to increase DEPTH (exp22, exp51) were discarded, likely due to	NVIDIA GeForce RTX 5090	9a884b008ec4db04f866b485ba020b3a81cf2896	539.4	0.001067	161829.9
