exp	description	val_bpb	peak_mem_gb	tok_sec	mfu	steps	status	notes	gpu_name	baseline_sha	watts	joules_per_token	total_energy_joules
exp0	baseline (no modifications)	1.090518	5.9	298666	17.0	2734	baseline	depth=8, NVIDIA GeForce RTX 5090	NVIDIA GeForce RTX 5090	31130ae2797ecafd91510fe75904552b5230e0b7	521.3	0.001746	156401.0
exp1	Decrease TOTAL_BATCH_SIZE by a factor of 2	0.000000	0.0	0	0.0	0	crash	training crashed or timed out	NVIDIA GeForce RTX 5090	31130ae2797ecafd91510fe75904552b5230e0b7	0.0	0.000000	0.0
exp2	Reduce TOTAL_BATCH_SIZE to a specific value (half of default) using a constant instead of the helper	1.038544	5.8	539666	35.6	4941	keep	The previous attempt to decrease batch size crashed, likely due to how the reduc	NVIDIA GeForce RTX 5090	31130ae2797ecafd91510fe75904552b5230e0b7	565.2	0.001047	169578.2
exp3	Decrease TOTAL_BATCH_SIZE from 32768 to 16384	0.000000	0.0	0	0.0	0	crash	training crashed or timed out	NVIDIA GeForce RTX 5090	31130ae2797ecafd91510fe75904552b5230e0b7	0.0	0.000000	0.0
exp4	Increase MATRIX_LR from 0.045 to 0.06	1.041706	5.8	543333	35.8	4974	discard	Since we have successfully increased the number of steps by reducing the batch s	NVIDIA GeForce RTX 5090	31130ae2797ecafd91510fe75904552b5230e0b7	560.8	0.001032	168254.2
exp5	Increase MATRIX_LR from 0.045 to 0.08	1.045620	5.8	539486	35.6	4941	discard	Exp4 tried a slight increase to 0.06 which had a marginal negative effect, but g	NVIDIA GeForce RTX 5090	31130ae2797ecafd91510fe75904552b5230e0b7	568.0	0.001053	170444.9
exp6	Enable ACTIVATION_CHECKPOINTING	1.044102	3.6	506666	33.4	4640	discard	With only 5.8GB of VRAM used, we have significant headroom on the RTX 5090 (31GB	NVIDIA GeForce RTX 5090	31130ae2797ecafd91510fe75904552b5230e0b7	555.4	0.001096	166628.3
exp7	Increase MLP_RATIO from 10.0 to 12.0	1.038494	5.8	539333	35.6	4938	keep	The current memory usage is very low (5.8GB out of 31GB), suggesting the model i	NVIDIA GeForce RTX 5090	31130ae2797ecafd91510fe75904552b5230e0b7	568.2	0.001054	170478.3
exp8	Decrease TOTAL_BATCH_SIZE from 32768 to 24576	0.000000	0.0	0	0.0	0	crash	training crashed or timed out	NVIDIA GeForce RTX 5090	31130ae2797ecafd91510fe75904552b5230e0b7	0.0	0.000000	0.0
exp9	Increase WARMUP_RATIO from 0.125 to 0.2	1.046928	5.8	540819	35.7	4953	discard	With a smaller batch size and high step count, a longer warmup period can stabil	NVIDIA GeForce RTX 5090	31130ae2797ecafd91510fe75904552b5230e0b7	566.0	0.001046	169830.3
exp10	Increase MATRIX_LR from 0.045 to 0.05	1.040098	5.8	539333	35.6	4938	discard	Prior experiments (exp4, exp5) showed that larger jumps in MATRIX_LR (to 0.06 an	NVIDIA GeForce RTX 5090	31130ae2797ecafd91510fe75904552b5230e0b7	568.0	0.001053	170392.2
exp11	Increase DEPTH by 1	1.054302	8.1	342333	35.7	3133	discard	The model has significant memory headroom (5.8GB used of 31GB) and is currently 	NVIDIA GeForce RTX 5090	31130ae2797ecafd91510fe75904552b5230e0b7	566.0	0.001654	169789.4
exp12	Increase SCALAR_LR from 10.0 to 20.0	1.038770	5.8	540666	35.6	4951	discard	Prior experiments showed that increasing the MATRIX_LR (Muon) did not help, sugg	NVIDIA GeForce RTX 5090	31130ae2797ecafd91510fe75904552b5230e0b7	566.2	0.001047	169880.5
exp13	Increase FINAL_LR_FRAC from 0.02 to 0.1	1.038753	5.8	543000	35.8	4972	discard	The current FINAL_LR_FRAC is very low, potentially causing the learning rate to 	NVIDIA GeForce RTX 5090	31130ae2797ecafd91510fe75904552b5230e0b7	562.2	0.001035	168678.9
exp14	Increase ASPECT_RATIO from 64 to 80	1.048559	7.3	382000	35.7	3497	discard	Given that increasing MLP_RATIO improved performance and increasing DEPTH was to	NVIDIA GeForce RTX 5090	31130ae2797ecafd91510fe75904552b5230e0b7	567.7	0.001486	170327.6
exp15	Increase WEIGHT_DECAY from 0.04 to 0.1	1.041603	5.8	541000	35.7	4952	discard	With a fixed time budget and smaller batch sizes, the model may be prone to over	NVIDIA GeForce RTX 5090	31130ae2797ecafd91510fe75904552b5230e0b7	566.4	0.001047	169952.6
exp16	Decrease WARMUP_RATIO from 0.125 to 0.05	1.038430	5.8	540666	35.6	4951	keep	Previous attempt to increase warmup (exp9) degraded performance. Since we have a	NVIDIA GeForce RTX 5090	31130ae2797ecafd91510fe75904552b5230e0b7	565.7	0.001046	169750.3
exp17	Decrease WARMDOWN_RATIO from 0.6 to 0.4	1.040944	5.8	540666	35.7	4951	discard	The current warmdown is quite aggressive (60% of the budget), which may be decay	NVIDIA GeForce RTX 5090	31130ae2797ecafd91510fe75904552b5230e0b7	567.3	0.001049	170194.3
exp18	Decrease WARMDOWN_RATIO from 0.6 to 0.3	1.043098	5.8	541486	35.7	4958	discard	Experiment 17 tried 0.4 and was discarded, but since we have successfully reduce	NVIDIA GeForce RTX 5090	31130ae2797ecafd91510fe75904552b5230e0b7	565.0	0.001044	169538.8
exp19	Decrease MATRIX_LR from 0.045 to 0.03	1.038132	5.8	539153	35.5	4937	keep	Previous attempts to increase MATRIX_LR (exp4, exp5, exp10) all resulted in wors	NVIDIA GeForce RTX 5090	31130ae2797ecafd91510fe75904552b5230e0b7	567.5	0.001053	170284.0
exp20	Increase MATRIX_LR from 0.03 to 0.035	1.037068	5.8	539000	35.5	4936	keep	Previous experiments showed that higher LRs (0.05-0.08) were detrimental, but th	NVIDIA GeForce RTX 5090	31130ae2797ecafd91510fe75904552b5230e0b7	567.9	0.001053	170390.6
exp21	Decrease MATRIX_LR from 0.035 to 0.032	1.037066	5.8	540486	35.6	4950	keep	Exp 19 (0.03) and Exp 20 (0.035) both showed improvement over the original 0.045	NVIDIA GeForce RTX 5090	31130ae2797ecafd91510fe75904552b5230e0b7	566.0	0.001047	169844.5
exp22	Decrease MATRIX_LR from 0.032 to 0.025	1.038348	5.8	539000	35.5	4935	discard	Recent experiments (exp19-21) show that lowering MATRIX_LR from higher values ha	NVIDIA GeForce RTX 5090	31130ae2797ecafd91510fe75904552b5230e0b7	567.4	0.001053	170234.1
exp23	Increase MLP_RATIO from 12.0 to 16.0	1.037475	5.8	538820	35.5	4936	discard	Exp7 showed that increasing MLP_RATIO from 10.0 to 12.0 maintained performance w	NVIDIA GeForce RTX 5090	31130ae2797ecafd91510fe75904552b5230e0b7	568.1	0.001054	170461.6
exp24	Decrease TOTAL_BATCH_SIZE to 25600	0.000000	0.0	0	0.0	0	crash	training crashed or timed out	NVIDIA GeForce RTX 5090	31130ae2797ecafd91510fe75904552b5230e0b7	0.0	0.000000	0.0
exp25	Decrease WARMDOWN_RATIO from 0.6 to 0.5	1.038333	5.8	542333	35.8	4964	discard	Exp 17 and 18 showed that aggressive reductions in warmdown (to 0.4 and 0.3) wer	NVIDIA GeForce RTX 5090	31130ae2797ecafd91510fe75904552b5230e0b7	563.3	0.001039	168986.7
exp26	Decrease WARMDOWN_RATIO from 0.6 to 0.45	1.038733	5.8	542333	35.8	4966	discard	Prior experiments with very low warmdown (0.3, 0.4) failed, but a slight reducti	NVIDIA GeForce RTX 5090	31130ae2797ecafd91510fe75904552b5230e0b7	563.1	0.001038	168951.1
exp27	Increase HEAD_DIM from 128 to 256	1.044204	5.8	522666	34.5	4785	discard	We have mostly focused on learning rates and batch size. Increasing the head dim	NVIDIA GeForce RTX 5090	31130ae2797ecafd91510fe75904552b5230e0b7	549.0	0.001050	164708.7
exp28	Increase FINAL_LR_FRAC from 0.02 to 0.05	1.038020	5.8	541819	35.7	4961	discard	Exp13 tried a jump to 0.1 which failed, but a moderate increase in the final lea	NVIDIA GeForce RTX 5090	31130ae2797ecafd91510fe75904552b5230e0b7	564.4	0.001042	169338.9
exp29	Decrease TOTAL_BATCH_SIZE from 32768 to 32000	0.000000	0.0	0	0.0	0	crash	training crashed or timed out	NVIDIA GeForce RTX 5090	31130ae2797ecafd91510fe75904552b5230e0b7	0.0	0.000000	0.0
exp30	Increase MATRIX_LR from 0.032 to 0.038	1.037614	5.8	542333	35.8	4964	discard	Recent experiments show a peak in performance around 0.032-0.035. A slight incre	NVIDIA GeForce RTX 5090	31130ae2797ecafd91510fe75904552b5230e0b7	563.1	0.001039	168954.7
exp31	Decrease TOTAL_BATCH_SIZE to 32768 / 1.25 (approx 26214) is risky due to previous crashes; instead, increase MATRIX_LR slightly to 0.034	1.037469	5.8	542333	35.8	4965	discard	Previous experiments show val_bpb is very sensitive to MATRIX_LR, with the optim	NVIDIA GeForce RTX 5090	31130ae2797ecafd91510fe75904552b5230e0b7	564.1	0.001040	169241.5
exp32	Increase TOTAL_BATCH_SIZE from 32768 to 65536	0.000000	0.0	0	0.0	0	crash	training crashed or timed out	NVIDIA GeForce RTX 5090	31130ae2797ecafd91510fe75904552b5230e0b7	0.0	0.000000	0.0
exp33	Decrease WARMDOWN_RATIO from 0.6 to 0.55	1.037420	5.8	540333	35.6	4947	discard	Recent experiments with significant reductions in WARMDOWN_RATIO (0.3-0.5) were 	NVIDIA GeForce RTX 5090	31130ae2797ecafd91510fe75904552b5230e0b7	566.7	0.001049	170021.6
exp34	Decrease WARMDOWN_RATIO from 0.6 to 0.35	1.038699	5.8	540000	35.6	4945	discard	Previous attempts to reduce warmdown slightly (0.55, 0.5, 0.45) were discarded, 	NVIDIA GeForce RTX 5090	31130ae2797ecafd91510fe75904552b5230e0b7	567.7	0.001051	170335.6
exp35	Decrease ADAM_BETAS beta1 from 0.8 to 0.7	1.037131	5.8	540333	35.6	4947	discard	The current beta1 is relatively low (0.8), but further decreasing it can sometim	NVIDIA GeForce RTX 5090	31130ae2797ecafd91510fe75904552b5230e0b7	567.2	0.001050	170170.6
exp36	Decrease ADAM_BETAS beta2 from 0.98 to 0.95	1.038667	5.8	542333	35.8	4966	discard	Beta2 controls the moving average of squared gradients. A slightly lower beta2 c	NVIDIA GeForce RTX 5090	31130ae2797ecafd91510fe75904552b5230e0b7	564.0	0.001040	169223.0
exp37	Change WINDOW_PATTERN from "LLLL" to "LSLS"	1.060891	5.9	385000	23.6	3524	discard	Switching to a sliding window pattern (S) in some layers can reduce the computat	NVIDIA GeForce RTX 5090	31130ae2797ecafd91510fe75904552b5230e0b7	523.1	0.001359	156930.8
exp38	Increase SCALAR_LR from 10.0 to 30.0	1.047516	5.8	539666	35.6	4942	discard	Previous increases in SCALAR_LR (exp12) showed a very slight degradation or neut	NVIDIA GeForce RTX 5090	31130ae2797ecafd91510fe75904552b5230e0b7	567.7	0.001052	170347.2
exp39	Decrease WARMDOWN_RATIO from 0.6 to 0.2	1.044114	5.8	538666	35.5	4933	discard	Previous experiments (exp17, 18, 25, 26, 33, 34) tried moderate reductions in wa	NVIDIA GeForce RTX 5090	31130ae2797ecafd91510fe75904552b5230e0b7	568.1	0.001055	170455.2
exp40	Increase EMBEDDING_LR from 1.0 to 2.0	1.042073	5.8	543333	35.8	4975	discard	Embedding layers often benefit from higher learning rates to converge faster, es	NVIDIA GeForce RTX 5090	31130ae2797ecafd91510fe75904552b5230e0b7	561.8	0.001034	168572.0
exp41	Increase MATRIX_LR from 0.032 to 0.033	1.036703	5.8	540333	35.6	4947	keep	Recent experiments show a tight peak for MATRIX_LR around 0.032-0.035. A very sm	NVIDIA GeForce RTX 5090	31130ae2797ecafd91510fe75904552b5230e0b7	567.3	0.001050	170209.4
exp42	Decrease ADAM_BETAS beta2 from 0.98 to 0.99	1.037477	5.8	542333	35.7	4964	discard	Many recent experiments with LR and schedule have yielded diminishing returns. A	NVIDIA GeForce RTX 5090	31130ae2797ecafd91510fe75904552b5230e0b7	563.0	0.001038	168919.0
exp43	Decrease ADAM_BETAS beta1 from 0.8 to 0.9	1.039290	5.8	541666	35.7	4958	discard	Beta1 of 0.8 is relatively low for Adam. Increasing it to 0.9 (the standard defa	NVIDIA GeForce RTX 5090	31130ae2797ecafd91510fe75904552b5230e0b7	564.4	0.001042	169331.5
exp44	Increase UNEMBEDDING_LR from 0.01 to 0.05	1.041137	5.8	542666	35.8	4968	discard	The unembedding layer is often under-optimized compared to the main matrix weigh	NVIDIA GeForce RTX 5090	31130ae2797ecafd91510fe75904552b5230e0b7	562.3	0.001036	168701.3
exp45	Decrease ADAM_BETAS beta1 from 0.8 to 0.75	1.037702	5.8	541666	35.7	4959	discard	Previous attempts to change betas were mostly discarded, but a slight shift in b	NVIDIA GeForce RTX 5090	31130ae2797ecafd91510fe75904552b5230e0b7	566.1	0.001045	169853.3
exp46	Increase MATRIX_LR from 0.033 to 0.036	1.036874	5.8	541666	35.7	4958	discard	The most recent successful experiments (exp19, exp20, exp21, exp41) showed a str	NVIDIA GeForce RTX 5090	31130ae2797ecafd91510fe75904552b5230e0b7	568.1	0.001049	170432.7
exp47	Decrease WARMDOWN_RATIO from 0.6 to 0.5	1.037315	5.8	545000	35.9	4991	discard	While several reductions in WARMDOWN_RATIO were tried (0.2, 0.3, 0.35, 0.4, 0.45	NVIDIA GeForce RTX 5090	31130ae2797ecafd91510fe75904552b5230e0b7	562.2	0.001031	168679.9
exp48	Increase MATRIX_LR from 0.033 to 0.034	1.037075	5.8	544333	35.9	4982	discard	The history shows a strong positive response to fine-grained MATRIX_LR adjustmen	NVIDIA GeForce RTX 5090	31130ae2797ecafd91510fe75904552b5230e0b7	564.8	0.001038	169453.5
exp49	Decrease TOTAL_BATCH_SIZE from 32768 to 16384 with a fixed constant	0.000000	0.0	0	0.0	0	crash	training crashed or timed out	NVIDIA GeForce RTX 5090	31130ae2797ecafd91510fe75904552b5230e0b7	0.0	0.000000	0.0
exp50	Decrease ADAM_BETAS beta2 from 0.98 to 0.97	1.036715	5.8	545333	36.0	4992	discard	Since several attempts to modify beta1 and beta2 have been tried, a slight decre	NVIDIA GeForce RTX 5090	31130ae2797ecafd91510fe75904552b5230e0b7	558.9	0.001025	167685.0
exp51	Decrease WEIGHT_DECAY from 0.04 to 0.01	1.038966	5.8	546333	36.0	5001	discard	Previous attempts to increase weight decay (exp15) were unsuccessful. Since the 	NVIDIA GeForce RTX 5090	31130ae2797ecafd91510fe75904552b5230e0b7	563.2	0.001031	168991.4
exp52	Increase ASPECT_RATIO from 64 to 72	1.047253	7.3	387204	36.2	3547	discard	Previous attempts to increase ASPECT_RATIO to 80 (exp14) were discarded, but a m	NVIDIA GeForce RTX 5090	31130ae2797ecafd91510fe75904552b5230e0b7	567.3	0.001465	170240.9
exp53	Increase MLP_RATIO from 12.0 to 14.0	1.037472	5.8	545000	35.9	4990	discard	Previous attempts to increase MLP_RATIO to 16.0 (exp23) were slightly detrimenta	NVIDIA GeForce RTX 5090	31130ae2797ecafd91510fe75904552b5230e0b7	566.5	0.001040	169978.2
exp54	Increase FINAL_LR_FRAC from 0.02 to 0.15	1.040245	5.8	546484	36.0	5006	discard	While exp13 (0.1) was discarded, a slightly more aggressive floor for the learni	NVIDIA GeForce RTX 5090	31130ae2797ecafd91510fe75904552b5230e0b7	560.2	0.001025	168096.3
exp55	Increase MATRIX_LR from 0.033 to 0.037	1.037061	5.8	545484	36.0	4996	discard	We have seen a positive trend when increasing MATRIX_LR up to 0.033 (exp41), but	NVIDIA GeForce RTX 5090	31130ae2797ecafd91510fe75904552b5230e0b7	564.2	0.001034	169294.6
exp56	Increase MATRIX_LR from 0.033 to 0.0345	1.040427	5.8	547333	36.1	5012	discard	The best results (exp41) were achieved with a slight increase to MATRIX_LR. Sinc	NVIDIA GeForce RTX 5090	31130ae2797ecafd91510fe75904552b5230e0b7	558.3	0.001020	167491.2
exp57	Decrease WEIGHT_DECAY from 0.04 to 0.02	1.038046	5.8	546000	36.0	5000	discard	Previous attempts to increase weight decay (exp15) and a large decrease (exp51 t	NVIDIA GeForce RTX 5090	31130ae2797ecafd91510fe75904552b5230e0b7	564.0	0.001033	169239.5
exp58	Decrease WARMUP_RATIO from 0.05 to 0.02	1.039398	5.8	545000	35.9	4991	discard	Exp16 showed that decreasing WARMUP_RATIO from 0.125 to 0.05 was a "keep" result	NVIDIA GeForce RTX 5090	31130ae2797ecafd91510fe75904552b5230e0b7	566.6	0.001039	169985.3
exp59	Decrease WEIGHT_DECAY from 0.04 to 0.03	1.037220	5.8	545666	36.0	4997	discard	Previous experiments with larger changes to weight decay (0.1, 0.01, 0.02) were 	NVIDIA GeForce RTX 5090	31130ae2797ecafd91510fe75904552b5230e0b7	564.5	0.001034	169373.2
exp60	Increase DEPTH by 1 while enabling ACTIVATION_CHECKPOINTING	1.054545	5.1	326333	34.0	2988	discard	Increasing model depth typically reduces bpb but consumes more memory. Since we 	NVIDIA GeForce RTX 5090	31130ae2797ecafd91510fe75904552b5230e0b7	545.9	0.001673	163778.8
exp61	Increase MATRIX_LR from 0.033 to 0.0335	1.037403	5.8	545151	36.0	4994	discard	The model has shown sensitivity to very small increments in MATRIX_LR, with exp4	NVIDIA GeForce RTX 5090	31130ae2797ecafd91510fe75904552b5230e0b7	565.7	0.001037	169741.2
exp62	Decrease WEIGHT_DECAY from 0.04 to 0.035	1.036609	5.8	547000	36.1	5009	keep	Previous attempts to decrease weight decay (0.01, 0.02, 0.03) were discarded, bu	NVIDIA GeForce RTX 5090	31130ae2797ecafd91510fe75904552b5230e0b7	560.0	0.001024	168009.1
exp63	Decrease WARMUP_RATIO from 0.05 to 0.03	1.039652	5.8	545151	36.0	4994	discard	Exp16 showed that reducing WARMUP_RATIO from 0.125 to 0.05 was beneficial. Furth	NVIDIA GeForce RTX 5090	31130ae2797ecafd91510fe75904552b5230e0b7	566.7	0.001039	170042.2
exp64	Increase SCALAR_LR from 10.0 to 15.0	1.039084	5.8	547150	36.1	5012	discard	Previous increase to 20.0 (exp12) was marginal, but scalar parameters often bene	NVIDIA GeForce RTX 5090	31130ae2797ecafd91510fe75904552b5230e0b7	560.2	0.001024	168099.5
exp65	Increase FINAL_LR_FRAC from 0.02 to 0.03	1.036499	5.8	547150	36.1	5012	keep	Experiment 28 showed a slight improvement (1.0380) with a higher FINAL_LR_FRAC (	NVIDIA GeForce RTX 5090	31130ae2797ecafd91510fe75904552b5230e0b7	559.5	0.001022	167880.6
exp66	Decrease WEIGHT_DECAY from 0.035 to 0.025	1.037832	5.8	545666	36.0	4995	discard	Exp 62 showed that decreasing weight decay to 0.035 was beneficial. Further redu	NVIDIA GeForce RTX 5090	31130ae2797ecafd91510fe75904552b5230e0b7	565.9	0.001037	169783.2
exp67	Decrease MATRIX_LR from 0.033 to 0.031	1.036749	5.8	545333	36.0	4992	discard	Previous experiments (exp19, exp20, exp21, exp41) suggest that the model is high	NVIDIA GeForce RTX 5090	31130ae2797ecafd91510fe75904552b5230e0b7	566.5	0.001039	169973.8
exp68	Increase SCALAR_LR from 10.0 to 12.0	1.037859	5.8	547000	36.1	5009	discard	Previous attempts with SCALAR_LR of 15.0 and 20.0 (exp12, exp64) were discarded,	NVIDIA GeForce RTX 5090	31130ae2797ecafd91510fe75904552b5230e0b7	560.1	0.001024	168041.5
exp69	Increase MLP_RATIO from 12.0 to 13.0	1.036437	5.8	547333	36.1	5012	keep	Exp7 showed that increasing MLP_RATIO to 12.0 was beneficial. Since subsequent i	NVIDIA GeForce RTX 5090	31130ae2797ecafd91510fe75904552b5230e0b7	559.4	0.001022	167828.0
exp70	Increase SCALAR_LR from 10.0 to 12.5	1.038049	5.8	547333	36.1	5012	discard	Previous attempts to increase SCALAR_LR to 12.0 (exp68) and 15.0 (exp64) were di	NVIDIA GeForce RTX 5090	31130ae2797ecafd91510fe75904552b5230e0b7	558.7	0.001021	167616.1
exp71	Decrease WEIGHT_DECAY from 0.035 to 0.03	1.040291	5.8	547150	36.1	5012	discard	Exp62 showed that reducing WEIGHT_DECAY from 0.04 to 0.035 was beneficial. A fur	NVIDIA GeForce RTX 5090	31130ae2797ecafd91510fe75904552b5230e0b7	559.8	0.001023	167966.7
exp72	Increase SCALAR_LR from 10.0 to 11.0	1.038195	5.8	546333	36.0	5001	discard	Previous experiments with SCALAR_LR showed that very large jumps (15.0, 20.0, 30	NVIDIA GeForce RTX 5090	31130ae2797ecafd91510fe75904552b5230e0b7	561.4	0.001028	168436.6
exp73	Increase EMBEDDING_LR from 1.0 to 1.2	1.037511	5.8	545666	36.0	4997	discard	We have focused heavily on MATRIX_LR and SCALAR_LR, but the embeddings have rema	NVIDIA GeForce RTX 5090	31130ae2797ecafd91510fe75904552b5230e0b7	564.8	0.001035	169453.7
exp74	Decrease WARMDOWN_RATIO from 0.6 to 0.55	1.038012	5.8	547333	36.1	5010	discard	Previous attempts to significantly reduce WARMDOWN_RATIO (0.2-0.4) failed, but a	NVIDIA GeForce RTX 5090	31130ae2797ecafd91510fe75904552b5230e0b7	559.2	0.001022	167776.4
exp75	Increase ASPECT_RATIO from 64 to 68	1.046759	7.3	388537	36.4	3557	discard	Previous attempts to increase model capacity via DEPTH (exp11, exp60) and larger	NVIDIA GeForce RTX 5090	31130ae2797ecafd91510fe75904552b5230e0b7	567.9	0.001462	170406.5
exp76	Increase EMBEDDING_LR from 1.0 to 1.5	1.037134	5.8	547000	36.1	5007	discard	Previous attempts to increase EMBEDDING_LR (exp40) were too aggressive or perfor	NVIDIA GeForce RTX 5090	31130ae2797ecafd91510fe75904552b5230e0b7	560.7	0.001025	168210.5
exp77	Decrease WARMUP_RATIO from 0.05 to 0.01	1.036765	5.8	546666	36.0	5005	discard	Previous experiments showed that decreasing WARMUP_RATIO to 0.05 improved perfor	NVIDIA GeForce RTX 5090	31130ae2797ecafd91510fe75904552b5230e0b7	560.7	0.001026	168212.7
exp78	Increase MATRIX_LR from 0.033 to 0.035	1.036202	5.8	547333	36.1	5011	keep	We previously found a local optimum around 0.033 (exp41) and noticed that small 	NVIDIA GeForce RTX 5090	31130ae2797ecafd91510fe75904552b5230e0b7	558.6	0.001021	167599.4
exp79	Increase MLP_RATIO from 13.0 to 14.0	1.036881	5.8	546333	36.0	5002	discard	Exp 69 showed that increasing MLP_RATIO to 13.0 improved val_bpb. Since the memo	NVIDIA GeForce RTX 5090	31130ae2797ecafd91510fe75904552b5230e0b7	563.5	0.001031	169051.9
exp80	Increase UNEMBEDDING_LR from 0.01 to 0.02	1.035095	5.8	547333	36.1	5010	keep	The unembedding layer often benefits from a higher learning rate than the defaul	NVIDIA GeForce RTX 5090	31130ae2797ecafd91510fe75904552b5230e0b7	560.3	0.001024	168092.5
exp81	Increase MATRIX_LR from 0.035 to 0.04	1.035036	5.8	547333	36.1	5010	keep	exp20 and exp78 showed that increasing MATRIX_LR within the 0.03-0.035 range was	NVIDIA GeForce RTX 5090	31130ae2797ecafd91510fe75904552b5230e0b7	559.3	0.001022	167789.8
exp82	Increase MATRIX_LR from 0.04 to 0.045	1.035710	5.8	547333	36.1	5010	discard	Recent experiments (exp78, exp80, exp81) show a clear positive trend as MATRIX_L	NVIDIA GeForce RTX 5090	31130ae2797ecafd91510fe75904552b5230e0b7	560.0	0.001023	168009.7
exp83	Increase MATRIX_LR from 0.04 to 0.042	1.035874	5.8	547000	36.1	5007	discard	Exp81 showed a strong improvement by increasing MATRIX_LR to 0.04, but Exp82's j	NVIDIA GeForce RTX 5090	31130ae2797ecafd91510fe75904552b5230e0b7	560.1	0.001024	168025.8
exp84	Increase MATRIX_LR from 0.04 to 0.041	1.038814	5.8	546333	36.0	5002	discard	Exp 81 (0.04) showed improvement, but Exp 82 (0.045) and Exp 83 (0.042) regresse	NVIDIA GeForce RTX 5090	31130ae2797ecafd91510fe75904552b5230e0b7	563.3	0.001031	168998.3
exp85	Increase UNEMBEDDING_LR from 0.02 to 0.03	1.039042	5.8	545666	36.0	4996	discard	Exp80 showed a significant gain when increasing UNEMBEDDING_LR to 0.02. Pushing 	NVIDIA GeForce RTX 5090	31130ae2797ecafd91510fe75904552b5230e0b7	564.7	0.001035	169424.8
exp86	Decrease WEIGHT_DECAY from 0.035 to 0.032	1.035014	5.8	546817	36.1	5008	keep	Previous experiments showed that reducing weight decay to 0.035 (exp62) was bene	NVIDIA GeForce RTX 5090	31130ae2797ecafd91510fe75904552b5230e0b7	559.6	0.001023	167917.3
