exp	description	val_bpb	peak_mem_gb	tok_sec	mfu	steps	status	notes	gpu_name	baseline_sha	watts	joules_per_token	total_energy_joules
exp73	Reduce FINAL_LR_FRAC from 0.055 to 0.054 to test finer-grained learning rate decay endpoint optimization	1.036831	5.8	545151	36.0	4992	discard	Exp63 achieved the best result (1.0366) with FINAL_LR_FRAC=0.055. Testing 0.054 	NVIDIA GeForce RTX 5090	d9035da2912d9df9b3856eb38e7907ec6da51bf4	547.3	0.001004	164209.9
exp74	Reduce MATRIX_LR from 0.027 to 0.0268 to test finer-grained matrix learning rate optimization between exp44 (0.0265) and current best (0.027)	1.036578	5.8	543333	35.8	4975	discard	The current best config (exp63) uses MATRIX_LR=0.027, while exp44 tested 0.0265 	NVIDIA GeForce RTX 5090	d9035da2912d9df9b3856eb38e7907ec6da51bf4	544.8	0.001003	163443.4
exp75	Reduce MATRIX_LR from 0.027 to 0.0266 to test finer-grained matrix learning rate optimization between exp44 (0.0265) and exp74 (0.0268)	1.036551	5.8	544000	35.9	4981	keep	Recent MATRIX_LR experiments show a pattern where values between 0.0265-0.027 pe	NVIDIA GeForce RTX 5090	d9035da2912d9df9b3856eb38e7907ec6da51bf4	546.1	0.001004	163857.3
exp76	Increase WARMDOWN_RATIO from 0.58 to 0.60 to extend the learning rate decay phase slightly with current optimal LR settings	1.038059	5.8	544151	35.9	4983	discard	With MATRIX_LR, SCALAR_LR, EMBEDDING_LR, and FINAL_LR_FRAC all finely tuned to o	NVIDIA GeForce RTX 5090	d9035da2912d9df9b3856eb38e7907ec6da51bf4	546.8	0.001005	164078.3
exp77	Increase MATRIX_LR from 0.0266 to 0.0267 to test intermediate matrix learning rate between exp75 (0.0266, best) and exp74 (0.0268, tied)	1.037217	5.8	543000	35.8	4971	discard	Both MATRIX_LR=0.0266 (exp75) and 0.0268 (exp74) achieved val_bpb=1.0366, sugges	NVIDIA GeForce RTX 5090	d9035da2912d9df9b3856eb38e7907ec6da51bf4	544.8	0.001004	163466.9
exp78	Change ADAM_BETAS from (0.85, 0.99) to (0.8, 0.99) to reduce beta1 for faster momentum adaptation	1.037976	5.8	544333	35.9	4984	discard	ADAM_BETAS has only been tested at (0.85, 0.99), (0.9, 0.99), and (0.9, 0.995). 	NVIDIA GeForce RTX 5090	d9035da2912d9df9b3856eb38e7907ec6da51bf4	542.9	0.000997	162900.7
exp79	Change ADAM_BETAS from (0.85, 0.99) to (0.85, 0.995) to increase beta2 for more stable second moment estimates near convergence	1.038444	5.8	544333	35.9	4984	discard	With MATRIX_LR and FINAL_LR_FRAC finely tuned, optimizer stability becomes more 	NVIDIA GeForce RTX 5090	d9035da2912d9df9b3856eb38e7907ec6da51bf4	544.9	0.001001	163462.6
exp80	Reduce WARMUP_RATIO from 0.1 to 0.09 to spend slightly more of the fixed time budget at peak learning rate	1.038588	5.8	543000	35.8	4970	discard	With the current optimal learning rates (MATRIX_LR=0.0266, FINAL_LR_FRAC=0.055),	NVIDIA GeForce RTX 5090	d9035da2912d9df9b3856eb38e7907ec6da51bf4	545.4	0.001005	163615.9
exp81	Test ADAM_BETAS = (0.82, 0.99) to explore intermediate beta1 value between current optimal (0.85) and previously tested (0.80)	1.036907	5.8	545000	35.9	4991	discard	ADAM_BETAS has been underexplored compared to learning rates. Exp78 tested beta1	NVIDIA GeForce RTX 5090	d9035da2912d9df9b3856eb38e7907ec6da51bf4	541.6	0.000994	162503.0
exp82	Set MLP_RATIO to 3.0 to test intermediate MLP expansion ratio for better capacity-efficiency balance	1.036495	5.8	544485	35.9	4988	keep	MLP_RATIO has not been explicitly tested in any previous experiment. The default	NVIDIA GeForce RTX 5090	d9035da2912d9df9b3856eb38e7907ec6da51bf4	543.4	0.000997	163035.3
exp83	Reduce TOTAL_BATCH_SIZE from auto-default (~16384) to 12288 to increase gradient steps while staying above the crash threshold observed at 8192	0.000000	0.0	0	0.0	0	crash	training crashed or timed out	NVIDIA GeForce RTX 5090	d9035da2912d9df9b3856eb38e7907ec6da51bf4	0.0	0.000000	0.0
exp84	Reduce ADAM_BETAS beta1 from 0.85 to 0.78 to test if faster momentum adaptation improves convergence with current optimal MLP_RATIO settings	1.038418	5.8	542333	35.8	4965	discard	Recent experiments show a trend where lower beta1 values improve val_bpb (exp81 	NVIDIA GeForce RTX 5090	d9035da2912d9df9b3856eb38e7907ec6da51bf4	539.4	0.000995	161818.1
exp85	Reduce HEAD_DIM from 128 to 112 to test intermediate head dimension between previously tested values (96 and 128)	1.050313	6.5	431666	32.7	3951	discard	HEAD_DIM=128 gave 1.0366 (exp12 with 96 gave 1.0638), but we haven't tested inte	NVIDIA GeForce RTX 5090	d9035da2912d9df9b3856eb38e7907ec6da51bf4	536.0	0.001242	160797.3
exp86	Reduce ADAM_BETAS beta1 from 0.85 to 0.83 to test intermediate momentum adaptation between exp81 (0.82, 1.0369) and current best (0.85, 1.0365)	1.036924	5.8	544666	35.9	4987	discard	The ADAM_BETAS parameter shows a clear trend where beta1 values between 0.82-0.8	NVIDIA GeForce RTX 5090	d9035da2912d9df9b3856eb38e7907ec6da51bf4	545.5	0.001002	163663.2
exp87	Change ADAM_BETAS from (0.85, 0.99) to (0.84, 0.99) to test intermediate beta1 value for momentum adaptation	1.036522	5.8	544666	35.9	4988	discard	exp82 achieved the best val_bpb (1.0365) with beta1=0.85, while exp86 with beta1	NVIDIA GeForce RTX 5090	d9035da2912d9df9b3856eb38e7907ec6da51bf4	542.8	0.000996	162858.0
exp88	Change ADAM_BETAS from (0.85, 0.99) to (0.84, 0.99) to test if slightly lower beta1 improves convergence with current optimal settings	1.036478	5.8	545333	36.0	4994	keep	exp87 with ADAM_BETAS (0.84, 0.99) achieved 1.0365, tying the best result from e	NVIDIA GeForce RTX 5090	d9035da2912d9df9b3856eb38e7907ec6da51bf4	542.4	0.000994	162722.4
exp89	Increase WEIGHT_DECAY from 0.05 to 0.055 to test if slightly stronger regularization improves convergence with current optimal learning rate settings	1.036568	5.8	544666	35.9	4987	discard	Previous WEIGHT_DECAY reductions (0.04, 0.03) both worsened performance, suggest	NVIDIA GeForce RTX 5090	d9035da2912d9df9b3856eb38e7907ec6da51bf4	545.8	0.001002	163754.4
exp90	Change ADAM_BETAS beta2 from 0.99 to 0.992 to test if slightly higher second moment stability improves convergence with current optimal beta1=0.84	1.036763	5.8	544333	35.9	4983	discard	The current best result uses ADAM_BETAS (0.84, 0.99). Exp79 tested beta2=0.995 w	NVIDIA GeForce RTX 5090	d9035da2912d9df9b3856eb38e7907ec6da51bf4	544.8	0.001001	163450.8
exp91	Reduce WARMDOWN_RATIO from 0.58 to 0.50 to extend the high-learning-rate training phase with current optimal ADAM_BETAS settings	1.036966	5.8	544151	35.9	4982	discard	Previous warmdown experiments (exp71 at 0.52 gave 1.0372, exp76 at 0.60 gave 1.0	NVIDIA GeForce RTX 5090	d9035da2912d9df9b3856eb38e7907ec6da51bf4	546.1	0.001004	163850.0
exp92	Increase HEAD_DIM from 128 to 136 to test if slightly more attention head capacity improves convergence with current optimal learning rate settings	1.047575	6.2	442185	32.0	4049	discard	Previous HEAD_DIM experiments (96, 112, 160) all performed worse than 128, but 1	NVIDIA GeForce RTX 5090	d9035da2912d9df9b3856eb38e7907ec6da51bf4	519.3	0.001175	155839.9
exp93	Reduce WEIGHT_DECAY from 0.05 to 0.045 to test intermediate regularization strength between exp36 (0.04, 1.0381) and current best (0.05, 1.0365)	1.036512	5.8	544151	35.9	4984	discard	WEIGHT_DECAY has only been tested at 0.03, 0.04, 0.05, and 0.055. Since 0.05 is 	NVIDIA GeForce RTX 5090	d9035da2912d9df9b3856eb38e7907ec6da51bf4	545.7	0.001003	163749.2
exp94	Reduce WEIGHT_DECAY from 0.05 to 0.0475 to test intermediate regularization strength between two best-performing values	1.036643	5.8	543000	35.8	4970	discard	Both WEIGHT_DECAY=0.05 (exp88, 1.0365) and WEIGHT_DECAY=0.045 (exp93, 1.0365) ac	NVIDIA GeForce RTX 5090	d9035da2912d9df9b3856eb38e7907ec6da51bf4	544.1	0.001002	163234.3
exp95	Reduce ADAM_BETAS beta2 from 0.99 to 0.988 to test if slightly lower second moment smoothing improves convergence	1.036171	5.8	545333	36.0	4993	keep	Current best uses beta2=0.99, but exp90 showed beta2=0.992 performed worse (1.03	NVIDIA GeForce RTX 5090	d9035da2912d9df9b3856eb38e7907ec6da51bf4	542.1	0.000994	162653.7
exp96	Reduce MATRIX_LR from 0.0266 to 0.0264 to test finer-grained matrix learning rate optimization with current optimal ADAM_BETAS	1.036509	5.8	544000	35.9	4979	discard	The best result (exp95, 1.0362) used MATRIX_LR=0.0266 with ADAM_BETAS=(0.84, 0.9	NVIDIA GeForce RTX 5090	d9035da2912d9df9b3856eb38e7907ec6da51bf4	544.1	0.001000	163219.3
exp97	Reduce ADAM_BETAS beta2 from 0.988 to 0.986 to test if further lowering second moment smoothing improves convergence	1.036540	5.8	544485	35.9	4986	discard	Exp95 showed that reducing beta2 from 0.99 to 0.988 improved val_bpb to the curr	NVIDIA GeForce RTX 5090	d9035da2912d9df9b3856eb38e7907ec6da51bf4	547.9	0.001006	164406.6
exp98	Increase SCALAR_LR from 0.35 to 0.37 to test if slightly higher per-layer scalar learning rate improves convergence with the new optimal ADAM_BETAS (0.84, 0.988)	1.036241	5.8	545333	36.0	4993	discard	The best result (exp95, 1.0362) used ADAM_BETAS (0.84, 0.988) with SCALAR_LR 0.3	NVIDIA GeForce RTX 5090	d9035da2912d9df9b3856eb38e7907ec6da51bf4	544.7	0.000999	163441.9
exp99	Increase SCALAR_LR from 0.37 to 0.39 to further accelerate per-layer scalar parameter convergence with the optimal ADAM_BETAS (0.84, 0.988)	1.036622	5.8	544000	35.9	4979	discard	Exp98 achieved the best val_bpb (1.0362) with SCALAR_LR=0.37 and ADAM_BETAS=(0.8	NVIDIA GeForce RTX 5090	d9035da2912d9df9b3856eb38e7907ec6da51bf4	548.3	0.001008	164501.9
