exp	description	val_bpb	peak_mem_gb	tok_sec	mfu	steps	status	notes	gpu_name	baseline_sha
exp0	baseline (no modifications)	1.090481	5.9	299333	17.0	2740	baseline	depth=8, NVIDIA GeForce RTX 5090	NVIDIA GeForce RTX 5090	14e1f266a40c145cf5bfb2bae54d286b17b89a3c
exp1	Decrease DEVICE_BATCH_SIZE from _hp_defaults['device_batch_size'] to half its value	0.000000	0.0	0	0.0	0	crash	training crashed or timed out	NVIDIA GeForce RTX 5090	14e1f266a40c145cf5bfb2bae54d286b17b89a3c
exp2	Decrease TOTAL_BATCH_SIZE from _hp_defaults['total_batch_size'] to half its value	0.000000	0.0	0	0.0	0	crash	training crashed or timed out	NVIDIA GeForce RTX 5090	14e1f266a40c145cf5bfb2bae54d286b17b89a3c
exp3	Decrease WEIGHT_DECAY from 0.2 to 0.1	1.084189	5.9	299233	17.0	2740	keep	Both attempts to lower batch sizes crashed, likely due to model or optimizer int	NVIDIA GeForce RTX 5090	14e1f266a40c145cf5bfb2bae54d286b17b89a3c
exp4	Increase WARMDOWN_RATIO from 0.5 to 0.7	1.082869	5.9	298900	17.0	2737	keep	Increasing the warmdown ratio allocates a greater proportion of the training bud	NVIDIA GeForce RTX 5090	14e1f266a40c145cf5bfb2bae54d286b17b89a3c
exp5	Decrease ASPECT_RATIO from 64 to 48	1.084641	4.5	426333	15.3	3903	discard	Reducing the ASPECT_RATIO lowers the overall model width, which decreases memory	NVIDIA GeForce RTX 5090	14e1f266a40c145cf5bfb2bae54d286b17b89a3c
exp6	Decrease HEAD_DIM from 128 to 96	1.094991	6.6	235254	16.2	2155	discard	Reducing the attention head dimension lowers memory and compute per step, enabli	NVIDIA GeForce RTX 5090	14e1f266a40c145cf5bfb2bae54d286b17b89a3c
exp7	Decrease MATRIX_LR from 0.04 to 0.03	1.082675	5.9	298666	17.0	2735	keep	Lowering the learning rate for matrix parameters may improve stability and allow	NVIDIA GeForce RTX 5090	14e1f266a40c145cf5bfb2bae54d286b17b89a3c
exp8	Decrease SCALAR_LR from 0.5 to 0.3	1.079777	5.9	298333	17.0	2732	keep	The SCALAR_LR controls the learning rate for per-layer scalars. Lowering SCALAR_	NVIDIA GeForce RTX 5090	14e1f266a40c145cf5bfb2bae54d286b17b89a3c
exp9	Decrease EMBEDDING_LR from 0.6 to 0.4	1.079668	5.9	298900	17.0	2736	keep	The embedding layer often benefits from a slightly lower learning rate to preven	NVIDIA GeForce RTX 5090	14e1f266a40c145cf5bfb2bae54d286b17b89a3c
exp10	Decrease UNEMBEDDING_LR from 0.008 to 0.004	1.079822	5.9	298666	17.0	2735	discard	The other learning rates have trended downward with improved val_bpb in previous	NVIDIA GeForce RTX 5090	14e1f266a40c145cf5bfb2bae54d286b17b89a3c
exp11	Decrease SCALAR_LR from 0.3 to 0.2	1.079049	5.9	298900	17.0	2736	keep	Prior reductions in optimizer learning rates (MATRIX_LR, EMBEDDING_LR, and SCALA	NVIDIA GeForce RTX 5090	14e1f266a40c145cf5bfb2bae54d286b17b89a3c
exp12	Decrease WARMDOWN_RATIO from 0.7 to 0.5	1.080629	5.9	297567	16.9	2724	discard	We previously increased WARMDOWN_RATIO from 0.5 to 0.7 (exp4), but the resulting	NVIDIA GeForce RTX 5090	14e1f266a40c145cf5bfb2bae54d286b17b89a3c
exp13	Decrease EMBEDDING_LR from 0.4 to 0.3	1.078365	5.9	298567	17.0	2734	keep	Lowering the embedding learning rate may improve stability and reduce overfittin	NVIDIA GeForce RTX 5090	14e1f266a40c145cf5bfb2bae54d286b17b89a3c
exp14	Decrease TOTAL_BATCH_SIZE from _hp_defaults['total_batch_size'] to three-quarters its value	0.000000	0.0	0	0.0	0	crash	training crashed or timed out	NVIDIA GeForce RTX 5090	14e1f266a40c145cf5bfb2bae54d286b17b89a3c
exp15	Decrease SCALAR_LR from 0.2 to 0.15	1.078976	5.9	298900	17.0	2738	discard	Recent successful experiments suggest that lowering SCALAR_LR continues to reduc	NVIDIA GeForce RTX 5090	14e1f266a40c145cf5bfb2bae54d286b17b89a3c
exp16	Decrease MATRIX_LR from 0.03 to 0.02	1.078321	5.9	298900	17.0	2737	keep	Recent decreases in learning rates have resulted in steady improvements in val_b	NVIDIA GeForce RTX 5090	14e1f266a40c145cf5bfb2bae54d286b17b89a3c
exp17	Decrease EMBEDDING_LR from 0.3 to 0.2	1.078567	5.9	298900	17.0	2737	discard	Lowering the learning rate for token embeddings may help stabilize training and 	NVIDIA GeForce RTX 5090	14e1f266a40c145cf5bfb2bae54d286b17b89a3c
exp18	Decrease EMBEDDING_LR from 0.3 to 0.25	1.078888	5.9	298333	17.0	2732	discard	Past reductions in EMBEDDING_LR have yielded steady improvements in val_bpb, but	NVIDIA GeForce RTX 5090	14e1f266a40c145cf5bfb2bae54d286b17b89a3c
exp19	Decrease EMBEDDING_LR from 0.3 to 0.28	1.078729	5.9	299000	17.0	2737	discard	Lowering learning rates in small increments after earlier improvements can furth	NVIDIA GeForce RTX 5090	14e1f266a40c145cf5bfb2bae54d286b17b89a3c
exp20	Decrease WEIGHT_DECAY from 0.1 to 0.05	1.079830	5.9	299000	17.0	2736	discard	Lowering weight decay can sometimes improve performance if the current level is 	NVIDIA GeForce RTX 5090	14e1f266a40c145cf5bfb2bae54d286b17b89a3c
exp21	Increase WARMUP_RATIO from 0.0 to 0.05	1.081702	5.9	299000	17.0	2738	discard	Currently, there is no warmup phase (WARMUP_RATIO=0.0), which can sometimes caus	NVIDIA GeForce RTX 5090	14e1f266a40c145cf5bfb2bae54d286b17b89a3c
exp22	Decrease UNEMBEDDING_LR from 0.004 to 0.002	1.082510	5.9	299000	17.0	2738	discard	Previous reductions in other learning rates have generally led to improved val_b	NVIDIA GeForce RTX 5090	14e1f266a40c145cf5bfb2bae54d286b17b89a3c
exp23	Decrease SCALAR_LR from 0.2 to 0.15	1.077855	5.9	299000	17.0	2737	keep	Previous reductions to SCALAR_LR have yielded small but consistent improvements 	NVIDIA GeForce RTX 5090	14e1f266a40c145cf5bfb2bae54d286b17b89a3c
exp24	Decrease MATRIX_LR from 0.02 to 0.015	1.079936	5.9	298900	17.0	2737	discard	Recent experiments show consistent gains from reducing learning rates for differ	NVIDIA GeForce RTX 5090	14e1f266a40c145cf5bfb2bae54d286b17b89a3c
exp25	Decrease HEAD_DIM from 128 to 112	1.085482	6.5	252582	16.6	2314	discard	Prior experiments decreasing HEAD_DIM too much (to 96) hurt performance, but a m	NVIDIA GeForce RTX 5090	14e1f266a40c145cf5bfb2bae54d286b17b89a3c
exp26	Decrease SCALAR_LR from 0.15 to 0.12	1.078883	5.9	299000	17.0	2736	discard	Lowering SCALAR_LR has consistently improved val_bpb in several successful exper	NVIDIA GeForce RTX 5090	14e1f266a40c145cf5bfb2bae54d286b17b89a3c
exp27	Decrease SCALAR_LR from 0.15 to 0.1	1.079204	5.9	299000	17.0	2737	discard	Previous reductions of SCALAR_LR consistently improved or maintained val_bpb, wi	NVIDIA GeForce RTX 5090	14e1f266a40c145cf5bfb2bae54d286b17b89a3c
exp28	Decrease EMBEDDING_LR from 0.3 to 0.27	1.078024	5.9	298900	17.0	2738	discard	EMBEDDING_LR has been decreased incrementally with slight improvements in val_bp	NVIDIA GeForce RTX 5090	14e1f266a40c145cf5bfb2bae54d286b17b89a3c
exp29	Decrease EMBEDDING_LR from 0.3 to 0.26	1.078309	5.9	298900	17.0	2738	discard	While decreasing EMBEDDING_LR below 0.3 showed slight regressions or no improvem	NVIDIA GeForce RTX 5090	14e1f266a40c145cf5bfb2bae54d286b17b89a3c
exp30	Decrease WARMDOWN_RATIO from 0.7 to 0.6	1.077572	5.9	299000	17.0	2736	keep	The warndown schedule has been very slightly beneficial at higher ratios, but pr	NVIDIA GeForce RTX 5090	14e1f266a40c145cf5bfb2bae54d286b17b89a3c
exp31	Decrease EMBEDDING_LR from 0.3 to 0.22	1.077499	5.9	298900	17.0	2738	keep	Previous attempts to reduce EMBEDDING_LR below 0.3 (to 0.2, 0.25, 0.28, etc.) ha	NVIDIA GeForce RTX 5090	14e1f266a40c145cf5bfb2bae54d286b17b89a3c
exp32	Decrease EMBEDDING_LR from 0.22 to 0.20	1.077683	5.9	298900	17.0	2738	discard	Recent experiments show small but consistent gains from reducing EMBEDDING_LR, w	NVIDIA GeForce RTX 5090	14e1f266a40c145cf5bfb2bae54d286b17b89a3c
exp33	Decrease SCALAR_LR from 0.15 to 0.12	1.077615	5.9	298567	17.0	2735	discard	The SCALAR_LR has shown incremental improvements when decreased in the past (see	NVIDIA GeForce RTX 5090	14e1f266a40c145cf5bfb2bae54d286b17b89a3c
exp34	Decrease MATRIX_LR from 0.02 to 0.015	1.079582	5.9	298666	17.0	2735	discard	Lowering the MATRIX_LR has previously shown benefits or near-neutral effects unt	NVIDIA GeForce RTX 5090	14e1f266a40c145cf5bfb2bae54d286b17b89a3c
exp35	Decrease TOTAL_BATCH_SIZE from _hp_defaults['total_batch_size'] to 0.9 * _hp_defaults['total_batch_size']	0.000000	0.0	0	0.0	0	crash	training crashed or timed out	NVIDIA GeForce RTX 5090	14e1f266a40c145cf5bfb2bae54d286b17b89a3c
exp36	Decrease SCALAR_LR from 0.15 to 0.13	1.077566	5.9	298900	17.0	2736	discard	Previous reductions in SCALAR_LR consistently yielded improvements in val_bpb do	NVIDIA GeForce RTX 5090	14e1f266a40c145cf5bfb2bae54d286b17b89a3c
exp37	Decrease MATRIX_LR from 0.02 to 0.018	1.078601	5.9	298900	17.0	2738	discard	Recent decreases in MATRIX_LR have generally led to small but consistent improve	NVIDIA GeForce RTX 5090	14e1f266a40c145cf5bfb2bae54d286b17b89a3c
exp38	Decrease SCALAR_LR from 0.15 to 0.13	1.077550	5.9	299000	17.0	2738	discard	Previous experiments show incremental improvements or similar val_bpb scores whe	NVIDIA GeForce RTX 5090	14e1f266a40c145cf5bfb2bae54d286b17b89a3c
exp39	Decrease WARMDOWN_RATIO from 0.6 to 0.5	1.077875	5.9	298900	17.0	2738	discard	Previously, WARMDOWN_RATIO was increased to 0.7 (exp4) showing minor improvement	NVIDIA GeForce RTX 5090	14e1f266a40c145cf5bfb2bae54d286b17b89a3c
exp40	Increase EMBEDDING_LR from 0.22 to 0.24	1.077771	5.9	299000	17.0	2738	discard	Decreasing EMBEDDING_LR below 0.22 did not improve val_bpb, and the plateau sugg	NVIDIA GeForce RTX 5090	14e1f266a40c145cf5bfb2bae54d286b17b89a3c
exp41	Increase DEPTH from _hp_defaults['depth'] to _hp_defaults['depth'] + 2	1.087215	9.0	195601	19.9	1791	discard	Increasing model depth (if memory allows) can increase model capacity and expres	NVIDIA GeForce RTX 5090	14e1f266a40c145cf5bfb2bae54d286b17b89a3c
exp42	Decrease WARMDOWN_RATIO from 0.6 to 0.55	1.077761	5.9	298900	17.0	2738	discard	Recent experiments tuning WARMDOWN_RATIO have shown modest but consistent gains 	NVIDIA GeForce RTX 5090	14e1f266a40c145cf5bfb2bae54d286b17b89a3c
exp43	Increase EMBEDDING_LR from 0.22 to 0.25	1.077652	5.9	299000	17.0	2737	discard	The results show that decreasing EMBEDDING_LR below 0.22 does not further improv	NVIDIA GeForce RTX 5090	14e1f266a40c145cf5bfb2bae54d286b17b89a3c
exp44	Increase WINDOW_PATTERN from "SSSL" to "LLLL"	1.037604	5.8	543333	35.8	4973	keep	All prior experiments adjusting model and optimization hyperparameters have resu	NVIDIA GeForce RTX 5090	14e1f266a40c145cf5bfb2bae54d286b17b89a3c
exp45	Decrease EMBEDDING_LR from 0.22 to 0.18	1.036711	5.8	542333	35.8	4964	keep	Lowering the embedding learning rate has provided incremental improvements in pr	NVIDIA GeForce RTX 5090	14e1f266a40c145cf5bfb2bae54d286b17b89a3c
exp46	Decrease SCALAR_LR from 0.15 to 0.12	1.036414	5.8	543000	35.8	4970	keep	The recent decrease of EMBEDDING_LR led to measurable improvement in val_bpb, an	NVIDIA GeForce RTX 5090	14e1f266a40c145cf5bfb2bae54d286b17b89a3c
exp47	Decrease EMBEDDING_LR from 0.18 to 0.15	1.036476	5.8	543000	35.8	4972	discard	Lowering the embedding learning rate has led to consistent improvements in val_b	NVIDIA GeForce RTX 5090	14e1f266a40c145cf5bfb2bae54d286b17b89a3c
exp48	Decrease EMBEDDING_LR from 0.18 to 0.16	1.036574	5.8	542333	35.8	4964	discard	The steady reduction of EMBEDDING_LR has shown incremental improvement in val_bp	NVIDIA GeForce RTX 5090	14e1f266a40c145cf5bfb2bae54d286b17b89a3c
exp49	Decrease SCALAR_LR from 0.12 to 0.10	1.036521	5.8	543333	35.8	4973	discard	Lowering the scalar learning rate further can produce smaller, more stable updat	NVIDIA GeForce RTX 5090	14e1f266a40c145cf5bfb2bae54d286b17b89a3c
exp50	Decrease MATRIX_LR from 0.02 to 0.018	1.036465	5.8	542666	35.8	4969	discard	Recent experiments suggest moderate benefits from reducing learning rates, but g	NVIDIA GeForce RTX 5090	14e1f266a40c145cf5bfb2bae54d286b17b89a3c
exp51	Decrease EMBEDDING_LR from 0.18 to 0.14	1.036590	5.8	543333	35.8	4974	discard	Decreasing EMBEDDING_LR to 0.18 showed improvement, and further small decreases 	NVIDIA GeForce RTX 5090	14e1f266a40c145cf5bfb2bae54d286b17b89a3c
exp52	Decrease EMBEDDING_LR from 0.18 to 0.13	1.036554	5.8	542666	35.8	4968	discard	When EMBEDDING_LR was decreased to 0.15–0.16, val_bpb was stable, but with aggre	NVIDIA GeForce RTX 5090	14e1f266a40c145cf5bfb2bae54d286b17b89a3c
exp53	Decrease WARMDOWN_RATIO from 0.6 to 0.5	1.036995	5.8	543666	35.8	4976	discard	The current WARMDOWN_RATIO is set to 0.6, meaning learning rates begin to decrea	NVIDIA GeForce RTX 5090	14e1f266a40c145cf5bfb2bae54d286b17b89a3c
exp54	Decrease WEIGHT_DECAY from 0.1 to 0.08	1.036435	5.8	543333	35.8	4974	discard	The weight decay was previously reduced (from 0.2 to 0.1) and resulted in a mode	NVIDIA GeForce RTX 5090	14e1f266a40c145cf5bfb2bae54d286b17b89a3c
exp55	Decrease SCALAR_LR from 0.12 to 0.10	1.036813	5.8	542333	35.8	4965	discard	The previous reduction of SCALAR_LR from 0.15 to 0.12 improved val_bpb, and expe	NVIDIA GeForce RTX 5090	14e1f266a40c145cf5bfb2bae54d286b17b89a3c
exp56	Decrease EMBEDDING_LR from 0.18 to 0.17	1.036544	5.8	542666	35.8	4967	discard	The previous experiments indicate that reducing the embedding learning rate belo	NVIDIA GeForce RTX 5090	14e1f266a40c145cf5bfb2bae54d286b17b89a3c
exp57	Decrease DEVICE_BATCH_SIZE from _hp_defaults['device_batch_size'] to 0.8 * _hp_defaults['device_batch_size']	0.000000	0.0	0	0.0	0	crash	training crashed or timed out	NVIDIA GeForce RTX 5090	14e1f266a40c145cf5bfb2bae54d286b17b89a3c
exp58	Decrease EMBEDDING_LR from 0.18 to 0.16	1.036474	5.8	543000	35.8	4971	discard	Recent decreases of EMBEDDING_LR from 0.22 down to 0.18 consistently improved va	NVIDIA GeForce RTX 5090	14e1f266a40c145cf5bfb2bae54d286b17b89a3c
exp59	Decrease MATRIX_LR from 0.02 to 0.016	1.036980	5.8	542666	35.8	4968	discard	MATRIX_LR was last changed in this regime at exp50 and exp37, but both went smal	NVIDIA GeForce RTX 5090	14e1f266a40c145cf5bfb2bae54d286b17b89a3c
exp60	Decrease WEIGHT_DECAY from 0.1 to 0.07	1.036493	5.8	542666	35.8	4968	discard	Lowering weight decay slightly may reduce over-regularization, which could allow	NVIDIA GeForce RTX 5090	14e1f266a40c145cf5bfb2bae54d286b17b89a3c
exp61	Decrease EMBEDDING_LR from 0.18 to 0.12	1.036820	5.8	543000	35.8	4970	discard	Recent reductions in EMBEDDING_LR to 0.15 and 0.13 were not tested in the new hi	NVIDIA GeForce RTX 5090	14e1f266a40c145cf5bfb2bae54d286b17b89a3c
exp62	Decrease SCALAR_LR from 0.12 to 0.11	1.036521	5.8	542666	35.8	4968	discard	Lowering SCALAR_LR has been consistently beneficial up to this point, and the la	NVIDIA GeForce RTX 5090	14e1f266a40c145cf5bfb2bae54d286b17b89a3c
exp63	Decrease WARMDOWN_RATIO from 0.6 to 0.55	1.037016	5.8	542333	35.8	4965	discard	The learning rate warmdown phase controls how quickly learning rates decay towar	NVIDIA GeForce RTX 5090	14e1f266a40c145cf5bfb2bae54d286b17b89a3c
exp64	Decrease EMBEDDING_LR from 0.18 to 0.15	1.036632	5.8	541000	35.7	4952	discard	While prior decreases below 0.18 did not improve val_bpb, the step size was smal	NVIDIA GeForce RTX 5090	14e1f266a40c145cf5bfb2bae54d286b17b89a3c
exp65	Decrease MATRIX_LR from 0.02 to 0.017	1.036759	5.8	539153	35.5	4937	discard	Many learning rate decreases (EMBEDDING_LR and SCALAR_LR) around this region pro	NVIDIA GeForce RTX 5090	14e1f266a40c145cf5bfb2bae54d286b17b89a3c
exp66	Decrease EMBEDDING_LR from 0.18 to 0.13	1.037025	5.8	541666	35.7	4958	discard	EMBEDDING_LR was recently tuned downward, and lowering LR can sometimes yield ma	NVIDIA GeForce RTX 5090	14e1f266a40c145cf5bfb2bae54d286b17b89a3c
exp67	Increase WARMDOWN_RATIO from 0.6 to 0.65	1.036446	5.8	543000	35.8	4972	discard	The recent increases in WARMDOWN_RATIO (exp4, exp30) have either slightly helped	NVIDIA GeForce RTX 5090	14e1f266a40c145cf5bfb2bae54d286b17b89a3c
exp68	Decrease WEIGHT_DECAY from 0.1 to 0.09	1.036612	5.8	542819	35.8	4972	discard	Further small decreases in weight decay have not harmed performance in this regi	NVIDIA GeForce RTX 5090	14e1f266a40c145cf5bfb2bae54d286b17b89a3c
exp69	Increase MATRIX_LR from 0.02 to 0.022	1.037017	5.8	541000	35.7	4954	discard	Since decreasing MATRIX_LR below 0.02 yielded no benefit and component LRs are n	NVIDIA GeForce RTX 5090	14e1f266a40c145cf5bfb2bae54d286b17b89a3c
exp70	Decrease SCALAR_LR from 0.12 to 0.11	1.036648	5.8	542000	35.7	4962	discard	Lowering learning rates for scalar parameters has shown small but consistent imp	NVIDIA GeForce RTX 5090	14e1f266a40c145cf5bfb2bae54d286b17b89a3c
exp71	Decrease WEIGHT_DECAY from 0.1 to 0.06	1.036736	5.8	541666	35.7	4959	discard	The previous attempts to decrease weight decay below 0.1 (to 0.08, 0.09, 0.07, 0	NVIDIA GeForce RTX 5090	14e1f266a40c145cf5bfb2bae54d286b17b89a3c
exp72	Increase WARMDOWN_RATIO from 0.6 to 0.7	1.036612	5.8	542666	35.8	4967	discard	Increasing the WARMDOWN_RATIO allows for a longer LR decay period toward the end	NVIDIA GeForce RTX 5090	14e1f266a40c145cf5bfb2bae54d286b17b89a3c
exp73	Increase ASPECT_RATIO from 64 to 80	1.041918	7.3	388666	36.4	3558	discard	Increasing the ASPECT_RATIO boosts the model dimension (model width) without dee	NVIDIA GeForce RTX 5090	14e1f266a40c145cf5bfb2bae54d286b17b89a3c
exp74	Increase MATRIX_LR from 0.02 to 0.024	1.037261	5.8	543000	35.8	4972	discard	Now that the learning rates for embedding and scalar parameters have been tuned 	NVIDIA GeForce RTX 5090	14e1f266a40c145cf5bfb2bae54d286b17b89a3c
exp75	Decrease EMBEDDING_LR from 0.18 to 0.145	1.036755	5.8	541666	35.7	4959	discard	Recent experiments show diminishing returns when lowering EMBEDDING_LR below 0.1	NVIDIA GeForce RTX 5090	14e1f266a40c145cf5bfb2bae54d286b17b89a3c
exp76	Increase HEAD_DIM from 128 to 144	1.046210	6.5	441666	35.0	4043	discard	HEAD_DIM controls the attention head dimension and has so far not been increased	NVIDIA GeForce RTX 5090	14e1f266a40c145cf5bfb2bae54d286b17b89a3c
exp77	Decrease WEIGHT_DECAY from 0.1 to 0.085	1.036616	5.8	541333	35.7	4957	discard	Lowering weight decay can sometimes improve generalization, especially as learni	NVIDIA GeForce RTX 5090	14e1f266a40c145cf5bfb2bae54d286b17b89a3c
exp78	Decrease WEIGHT_DECAY from 0.1 to 0.075	1.036405	5.8	543000	35.8	4971	keep	The effect of weight decay in this region has not been meaningfully explored bel	NVIDIA GeForce RTX 5090	14e1f266a40c145cf5bfb2bae54d286b17b89a3c
exp79	Decrease EMBEDDING_LR from 0.18 to 0.16	1.036438	5.8	541333	35.7	4956	discard	Past experiments show that decreasing EMBEDDING_LR below 0.18 often resulted in 	NVIDIA GeForce RTX 5090	14e1f266a40c145cf5bfb2bae54d286b17b89a3c
exp80	Decrease SCALAR_LR from 0.12 to 0.10	1.036517	5.8	542333	35.8	4966	discard	Recent similar reductions to SCALAR_LR (from 0.15 to 0.12) did not harm performa	NVIDIA GeForce RTX 5090	14e1f266a40c145cf5bfb2bae54d286b17b89a3c
exp81	Decrease SCALAR_LR from 0.12 to 0.11	1.036606	5.8	540666	35.6	4949	discard	The scalar learning rate has shown improvement when decreased from higher values	NVIDIA GeForce RTX 5090	14e1f266a40c145cf5bfb2bae54d286b17b89a3c
exp82	Decrease SCALAR_LR from 0.12 to 0.11	1.036587	5.8	542152	35.8	4966	discard	Previous decreases in SCALAR_LR improved val_bpb up to 0.12, but further reducti	NVIDIA GeForce RTX 5090	14e1f266a40c145cf5bfb2bae54d286b17b89a3c
exp83	Decrease SCALAR_LR from 0.12 to 0.09	1.036874	5.8	542666	35.8	4969	discard	Reducing the SCALAR_LR further might help with stability and allow more effectiv	NVIDIA GeForce RTX 5090	14e1f266a40c145cf5bfb2bae54d286b17b89a3c
exp84	Increase EMBEDDING_LR from 0.18 to 0.20	1.036496	5.8	542333	35.8	4964	discard	Lowering the embedding learning rate below 0.18 did not yield further improvemen	NVIDIA GeForce RTX 5090	14e1f266a40c145cf5bfb2bae54d286b17b89a3c
exp85	Decrease SCALAR_LR from 0.12 to 0.09	1.037315	5.8	542333	35.8	4966	discard	Review of the experiment history shows that reducing SCALAR_LR to 0.10 or below 	NVIDIA GeForce RTX 5090	14e1f266a40c145cf5bfb2bae54d286b17b89a3c
exp86	Increase EMBEDDING_LR from 0.18 to 0.19	1.036271	5.8	542666	35.8	4969	keep	The previous increases to EMBEDDING_LR above 0.18 were primarily decreases, and 	NVIDIA GeForce RTX 5090	14e1f266a40c145cf5bfb2bae54d286b17b89a3c
exp87	Increase TOTAL_BATCH_SIZE from _hp_defaults['total_batch_size'] to 1.05 * _hp_defaults['total_batch_size']	0.000000	0.0	0	0.0	0	crash	training crashed or timed out	NVIDIA GeForce RTX 5090	14e1f266a40c145cf5bfb2bae54d286b17b89a3c
exp88	Increase WARMDOWN_RATIO from 0.6 to 0.65	1.036331	5.8	543666	35.8	4976	discard	Increasing the warmdown ratio will prolong the learning rate decay phase, which 	NVIDIA GeForce RTX 5090	14e1f266a40c145cf5bfb2bae54d286b17b89a3c
exp89	Increase EMBEDDING_LR from 0.19 to 0.21	1.036669	5.8	542000	35.7	4963	discard	Increasing the embedding learning rate has previously shown consistent and somet	NVIDIA GeForce RTX 5090	14e1f266a40c145cf5bfb2bae54d286b17b89a3c
exp90	Increase SCALAR_LR from 0.12 to 0.13	1.036328	5.8	542000	35.7	4963	discard	Recent experiments showed best val_bpb at SCALAR_LR=0.12, with slight degradatio	NVIDIA GeForce RTX 5090	14e1f266a40c145cf5bfb2bae54d286b17b89a3c
exp91	Increase SCALAR_LR from 0.12 to 0.13	1.036381	5.8	542333	35.8	4965	discard	Slightly increasing SCALAR_LR could provide more aggressive updates to per-layer	NVIDIA GeForce RTX 5090	14e1f266a40c145cf5bfb2bae54d286b17b89a3c
exp92	Increase MATRIX_LR from 0.02 to 0.022	1.037475	5.8	541666	35.7	4958	discard	Experiments decreasing MATRIX_LR showed little or negative impact, but a single 	NVIDIA GeForce RTX 5090	14e1f266a40c145cf5bfb2bae54d286b17b89a3c
exp93	Increase MATRIX_LR from 0.02 to 0.021	1.036509	5.8	543000	35.8	4970	discard	Minor increases in MATRIX_LR above 0.02 have not been explored, and small learni	NVIDIA GeForce RTX 5090	14e1f266a40c145cf5bfb2bae54d286b17b89a3c
exp94	Increase EMBEDDING_LR from 0.19 to 0.195	1.036120	5.8	543152	35.8	4974	keep	The last successful increase from 0.18 to 0.19 (exp86) slightly improved val_bpb	NVIDIA GeForce RTX 5090	14e1f266a40c145cf5bfb2bae54d286b17b89a3c
