exp	description	val_bpb	peak_mem_gb	tok_sec	mfu	steps	status	notes	gpu_name	baseline_sha
exp95	Increase FINAL_LR_FRAC from 0.04 to 0.06	1.064404	5.9	351000	21.0	3212	discard	Increasing FINAL_LR_FRAC maintains a slightly higher learning rate toward the en	NVIDIA GeForce RTX 5090	3296a77d448a3027ead5767cd9e29cb3587af052
exp96	Decrease MATRIX_LR from 0.025 to 0.022	1.065643	5.9	350883	21.0	3214	discard	The current MATRIX_LR of 0.025 is a moderately aggressive setting for the optimi	NVIDIA GeForce RTX 5090	3296a77d448a3027ead5767cd9e29cb3587af052
exp97	Increase FINAL_LR_FRAC from 0.04 to 0.06	1.064267	5.9	351216	21.0	3217	discard	The best recent results were achieved with FINAL_LR_FRAC set to 0.04. A slightly	NVIDIA GeForce RTX 5090	3296a77d448a3027ead5767cd9e29cb3587af052
exp98	Increase FINAL_LR_FRAC from 0.04 to 0.05	1.063998	5.9	351216	21.0	3216	discard	Most recent experiments show that a small nonzero FINAL_LR_FRAC helps, but going	NVIDIA GeForce RTX 5090	3296a77d448a3027ead5767cd9e29cb3587af052
exp99	Increase FINAL_LR_FRAC from 0.04 to 0.08	1.064521	5.9	351000	21.0	3214	discard	A slightly higher final learning rate fraction can help maintain learning progre	NVIDIA GeForce RTX 5090	3296a77d448a3027ead5767cd9e29cb3587af052
