exp	description	val_bpb	peak_mem_gb	tok_sec	mfu	steps	status	notes	gpu_name	baseline_sha
exp95	Decrease EMBEDDING_LR from 0.28 to 0.26	1.046683	5.2	529156	30.1	4847	discard	Prior reductions in EMBEDDING_LR have sometimes helped, and we are not yet at a 	NVIDIA GeForce RTX 5090	950a228fa3f0b687b1dc8b9feb6c9d1849c0e7c9
exp96	Decrease WEIGHT_DECAY from 0.041 to 0.04	1.045631	5.2	529666	30.1	4848	keep	Reducing weight decay slightly may allow the model weights to fit the data a bit	NVIDIA GeForce RTX 5090	950a228fa3f0b687b1dc8b9feb6c9d1849c0e7c9
exp97	Decrease EMBEDDING_LR from 0.28 to 0.26	1.046454	5.2	528157	30.1	4838	discard	Recent experiments show that gradual reductions in WEIGHT_DECAY continue to prov	NVIDIA GeForce RTX 5090	950a228fa3f0b687b1dc8b9feb6c9d1849c0e7c9
exp98	Decrease EMBEDDING_LR from 0.28 to 0.26	1.046383	5.2	527666	30.0	4830	discard	Several previous reductions in EMBEDDING_LR yielded improvements until 0.28. Tho	NVIDIA GeForce RTX 5090	950a228fa3f0b687b1dc8b9feb6c9d1849c0e7c9
exp99	Decrease WEIGHT_DECAY from 0.04 to 0.038	1.046325	5.2	529000	30.1	4842	discard	Recent successful experiments show incremental gains from slightly reducing WEIG	NVIDIA GeForce RTX 5090	950a228fa3f0b687b1dc8b9feb6c9d1849c0e7c9
