exp	description	val_bpb	peak_mem_gb	tok_sec	mfu	steps	status	notes	gpu_name	baseline_sha
exp0	baseline (no modifications)	1.090375	5.9	298900	17.0	2737	baseline	depth=8, NVIDIA GeForce RTX 5090	NVIDIA GeForce RTX 5090	950a228fa3f0b687b1dc8b9feb6c9d1849c0e7c9
exp1	Decrease DEVICE_BATCH_SIZE from _hp_defaults['device_batch_size'] to half its value	0.000000	0.0	0	0.0	0	crash	training crashed or timed out	NVIDIA GeForce RTX 5090	950a228fa3f0b687b1dc8b9feb6c9d1849c0e7c9
exp2	Decrease DEPTH from _hp_defaults['depth'] to one less than its current value	1.087382	5.3	345333	17.6	3161	keep	Since smaller batches were not possible due to a crash (likely OOM at even small	NVIDIA GeForce RTX 5090	950a228fa3f0b687b1dc8b9feb6c9d1849c0e7c9
exp3	Decrease DEVICE_BATCH_SIZE from _hp_defaults['device_batch_size'] to one less than its current value	0.000000	0.0	0	0.0	0	crash	training crashed or timed out	NVIDIA GeForce RTX 5090	950a228fa3f0b687b1dc8b9feb6c9d1849c0e7c9
exp4	Increase WARMDOWN_RATIO from 0.5 to 0.7	1.083532	5.3	345666	17.6	3164	keep	Increasing the warmdown ratio means the learning rate decays for a larger portio	NVIDIA GeForce RTX 5090	950a228fa3f0b687b1dc8b9feb6c9d1849c0e7c9
exp5	Decrease ASPECT_RATIO from 64 to 56	1.084114	5.3	345000	17.6	3158	discard	Lowering ASPECT_RATIO reduces the model's width, which decreases memory usage an	NVIDIA GeForce RTX 5090	950a228fa3f0b687b1dc8b9feb6c9d1849c0e7c9
exp6	Decrease TOTAL_BATCH_SIZE from _hp_defaults['total_batch_size'] to 0.75 * _hp_defaults['total_batch_size']	0.000000	0.0	0	0.0	0	crash	training crashed or timed out	NVIDIA GeForce RTX 5090	950a228fa3f0b687b1dc8b9feb6c9d1849c0e7c9
exp7	Decrease WEIGHT_DECAY from 0.2 to 0.1	1.079597	5.3	345333	17.6	3163	keep	Weight decay can sometimes over-regularize smaller or more efficient models, par	NVIDIA GeForce RTX 5090	950a228fa3f0b687b1dc8b9feb6c9d1849c0e7c9
exp8	Decrease DEVICE_BATCH_SIZE from _hp_defaults['device_batch_size'] to the next lower value supported by divisibility constraints (e.g., nearest lower power of 2)	0.000000	0.0	0	0.0	0	crash	training crashed or timed out	NVIDIA GeForce RTX 5090	950a228fa3f0b687b1dc8b9feb6c9d1849c0e7c9
exp9	Increase WARMDOWN_RATIO from 0.7 to 0.8	1.078751	5.3	345218	17.6	3162	keep	Increasing the warmdown ratio further may help the model anneal its learning rat	NVIDIA GeForce RTX 5090	950a228fa3f0b687b1dc8b9feb6c9d1849c0e7c9
exp10	Decrease HEAD_DIM from 128 to 112	1.085624	4.7	374875	15.4	3434	discard	Reducing the attention head dimension lowers per-token memory and compute cost, 	NVIDIA GeForce RTX 5090	950a228fa3f0b687b1dc8b9feb6c9d1849c0e7c9
exp11	Decrease SCALAR_LR from 0.5 to 0.3	1.079343	5.3	344551	17.5	3157	discard	The SCALAR_LR controls the learning rate for per-layer scalars, and a high value	NVIDIA GeForce RTX 5090	950a228fa3f0b687b1dc8b9feb6c9d1849c0e7c9
exp12	Decrease EMBEDDING_LR from 0.6 to 0.4	1.077641	5.3	345333	17.6	3161	keep	Lowering the embedding learning rate may improve the stability of token represen	NVIDIA GeForce RTX 5090	950a228fa3f0b687b1dc8b9feb6c9d1849c0e7c9
exp13	Decrease UNEMBEDDING_LR from 0.004 to 0.002	1.082525	5.3	344551	17.5	3154	discard	The unembedding layer (lm_head) is susceptible to overfitting with overly aggres	NVIDIA GeForce RTX 5090	950a228fa3f0b687b1dc8b9feb6c9d1849c0e7c9
exp14	Decrease MATRIX_LR from 0.04 to 0.03	1.078494	5.3	345333	17.6	3162	discard	Lowering MATRIX_LR may help stabilize training and improve generalization, espec	NVIDIA GeForce RTX 5090	950a228fa3f0b687b1dc8b9feb6c9d1849c0e7c9
exp15	Decrease TOTAL_BATCH_SIZE from _hp_defaults['total_batch_size'] to 0.9 * _hp_defaults['total_batch_size']	0.000000	0.0	0	0.0	0	crash	training crashed or timed out	NVIDIA GeForce RTX 5090	950a228fa3f0b687b1dc8b9feb6c9d1849c0e7c9
exp16	Decrease SCALAR_LR from 0.5 to 0.4	1.077131	5.3	345333	17.6	3162	keep	Lowering SCALAR_LR may reduce instability in the per-layer scalar parameters, as	NVIDIA GeForce RTX 5090	950a228fa3f0b687b1dc8b9feb6c9d1849c0e7c9
exp17	Increase WARMDOWN_RATIO from 0.8 to 0.9	1.077703	5.3	345218	17.6	3162	discard	Increasing the warmdown ratio allocates a larger portion of training to graduall	NVIDIA GeForce RTX 5090	950a228fa3f0b687b1dc8b9feb6c9d1849c0e7c9
exp18	Decrease EMBEDDING_LR from 0.4 to 0.3	1.078409	5.3	345000	17.6	3160	discard	Lowering the embedding learning rate may help prevent overfitting or instability	NVIDIA GeForce RTX 5090	950a228fa3f0b687b1dc8b9feb6c9d1849c0e7c9
exp19	Decrease EMBEDDING_LR from 0.4 to 0.35	1.077850	5.3	345551	17.6	3164	discard	Recent results showed that lowering EMBEDDING_LR from 0.4 to 0.3 resulted in a s	NVIDIA GeForce RTX 5090	950a228fa3f0b687b1dc8b9feb6c9d1849c0e7c9
exp20	Decrease WARMDOWN_RATIO from 0.8 to 0.7	1.077388	5.3	345218	17.6	3162	discard	The prior attempt to increase WARMDOWN_RATIO from 0.8 to 0.9 (exp17) resulted in	NVIDIA GeForce RTX 5090	950a228fa3f0b687b1dc8b9feb6c9d1849c0e7c9
exp21	Decrease UNEMBEDDING_LR from 0.004 to 0.003	1.077159	5.3	345218	17.6	3162	discard	Prior results indicate that lowering UNEMBEDDING_LR to 0.002 slightly degraded v	NVIDIA GeForce RTX 5090	950a228fa3f0b687b1dc8b9feb6c9d1849c0e7c9
exp22	Decrease ASPECT_RATIO from 64 to 60	1.077248	5.3	345333	17.6	3163	discard	The best improvements have come from settings that allow more gradient steps wit	NVIDIA GeForce RTX 5090	950a228fa3f0b687b1dc8b9feb6c9d1849c0e7c9
exp23	Increase DEPTH from _hp_defaults['depth'] - 1 to _hp_defaults['depth']	1.079430	5.9	298900	17.0	2738	discard	Since maximizing gradient steps within the time budget is crucial but reducing D	NVIDIA GeForce RTX 5090	950a228fa3f0b687b1dc8b9feb6c9d1849c0e7c9
exp24	Increase MATRIX_LR from 0.04 to 0.05	1.081157	5.3	345333	17.6	3162	discard	Previous results indicate that decreasing MATRIX_LR did not improve val_bpb (see	NVIDIA GeForce RTX 5090	950a228fa3f0b687b1dc8b9feb6c9d1849c0e7c9
exp25	Increase MLP_RATIO from default to 1.5 times its current value	1.077246	5.3	345551	17.6	3164	discard	The MLP ratio controls the hidden expansion inside transformer MLP blocks, and i	NVIDIA GeForce RTX 5090	950a228fa3f0b687b1dc8b9feb6c9d1849c0e7c9
exp26	Decrease WARMDOWN_RATIO from 0.8 to 0.6	1.078058	5.3	345551	17.6	3164	discard	Most recent experiments pushing WARMDOWN_RATIO higher (even past 0.8) did not im	NVIDIA GeForce RTX 5090	950a228fa3f0b687b1dc8b9feb6c9d1849c0e7c9
exp27	Decrease WEIGHT_DECAY from 0.1 to 0.05	1.077769	5.3	345333	17.6	3162	discard	The consistent improvement with lower weight decay (exp7, 0.2→0.1 yielded large 	NVIDIA GeForce RTX 5090	950a228fa3f0b687b1dc8b9feb6c9d1849c0e7c9
exp28	Decrease EMBEDDING_LR from 0.4 to 0.38	1.078639	5.3	345218	17.6	3162	discard	Prior experiments show that reducing EMBEDDING_LR from 0.6 to 0.4 resulted in a 	NVIDIA GeForce RTX 5090	950a228fa3f0b687b1dc8b9feb6c9d1849c0e7c9
exp29	Decrease EMBEDDING_LR from 0.4 to 0.36	1.078894	5.3	345666	17.6	3164	discard	EMBEDDING_LR at 0.4 has already shown improvement over higher values, while decr	NVIDIA GeForce RTX 5090	950a228fa3f0b687b1dc8b9feb6c9d1849c0e7c9
exp30	Increase WINDOW_PATTERN from "SSSL" to "LLSL"	1.051176	5.2	529666	30.2	4850	keep	The window pattern determines the attention span at each layer, with "L" indicat	NVIDIA GeForce RTX 5090	950a228fa3f0b687b1dc8b9feb6c9d1849c0e7c9
exp31	Decrease DEVICE_BATCH_SIZE from _hp_defaults['device_batch_size'] to two-thirds its value	0.000000	0.0	0	0.0	0	crash	training crashed or timed out	NVIDIA GeForce RTX 5090	950a228fa3f0b687b1dc8b9feb6c9d1849c0e7c9
exp32	Decrease WARMDOWN_RATIO from 0.8 to 0.6	1.052121	5.2	529333	30.1	4846	discard	Given that tuning WARMDOWN_RATIO beyond 0.8 did not help and that lower values h	NVIDIA GeForce RTX 5090	950a228fa3f0b687b1dc8b9feb6c9d1849c0e7c9
exp33	Decrease WEIGHT_DECAY from 0.1 to 0.08	1.050062	5.2	529666	30.2	4849	keep	Lowering weight decay can sometimes help the model fit the data more closely, es	NVIDIA GeForce RTX 5090	950a228fa3f0b687b1dc8b9feb6c9d1849c0e7c9
exp34	Decrease SCALAR_LR from 0.4 to 0.35	1.048934	5.2	530000	30.2	4851	keep	Now that batch size and memory usage are optimal (steps and throughput are maxim	NVIDIA GeForce RTX 5090	950a228fa3f0b687b1dc8b9feb6c9d1849c0e7c9
exp35	Decrease WEIGHT_DECAY from 0.08 to 0.06	1.048222	5.2	529666	30.1	4848	keep	Previous reductions in weight decay consistently improved val_bpb, and the decre	NVIDIA GeForce RTX 5090	950a228fa3f0b687b1dc8b9feb6c9d1849c0e7c9
exp36	Decrease SCALAR_LR from 0.35 to 0.3	1.051166	5.2	529000	30.1	4844	discard	Lowering the SCALAR_LR may improve stability and prevent overshooting as the cur	NVIDIA GeForce RTX 5090	950a228fa3f0b687b1dc8b9feb6c9d1849c0e7c9
exp37	Decrease EMBEDDING_LR from 0.4 to 0.35	1.049249	5.2	529666	30.2	4850	discard	Now that the batch size is stable and model/optimizer settings are better tuned,	NVIDIA GeForce RTX 5090	950a228fa3f0b687b1dc8b9feb6c9d1849c0e7c9
exp38	Decrease SCALAR_LR from 0.35 to 0.32	1.047993	5.2	530000	30.2	4853	keep	The sequence of experiments shows that lowering SCALAR_LR from 0.4 to 0.35 (exp3	NVIDIA GeForce RTX 5090	950a228fa3f0b687b1dc8b9feb6c9d1849c0e7c9
exp39	Decrease WEIGHT_DECAY from 0.06 to 0.05	1.047776	5.2	529823	30.2	4852	keep	Recent experiments show that reducing WEIGHT_DECAY has consistently led to impro	NVIDIA GeForce RTX 5090	950a228fa3f0b687b1dc8b9feb6c9d1849c0e7c9
exp40	Decrease SCALAR_LR from 0.32 to 0.30	1.051132	5.2	529333	30.1	4846	discard	The previous decrease in SCALAR_LR from 0.35 to 0.32 resulted in a modest improv	NVIDIA GeForce RTX 5090	950a228fa3f0b687b1dc8b9feb6c9d1849c0e7c9
exp41	Decrease SCALAR_LR from 0.32 to 0.28	1.050960	5.2	529666	30.1	4848	discard	Recent decreases in SCALAR_LR yielded slight improvements in val_bpb, but too la	NVIDIA GeForce RTX 5090	950a228fa3f0b687b1dc8b9feb6c9d1849c0e7c9
exp42	Decrease WEIGHT_DECAY from 0.05 to 0.04	1.047895	5.2	529666	30.1	4848	discard	Recent experiments show continual improvements as WEIGHT_DECAY is reduced, with 	NVIDIA GeForce RTX 5090	950a228fa3f0b687b1dc8b9feb6c9d1849c0e7c9
exp43	Decrease WARMDOWN_RATIO from 0.8 to 0.7	1.047985	5.2	529666	30.1	4848	discard	Lowering the warmdown ratio reduces the amount of time the learning rate is spen	NVIDIA GeForce RTX 5090	950a228fa3f0b687b1dc8b9feb6c9d1849c0e7c9
exp44	Decrease EMBEDDING_LR from 0.4 to 0.38	1.048391	5.2	529000	30.1	4842	discard	The learning rate for token embeddings may still be slightly high, potentially l	NVIDIA GeForce RTX 5090	950a228fa3f0b687b1dc8b9feb6c9d1849c0e7c9
exp45	Decrease MATRIX_LR from 0.04 to 0.03	1.047487	5.2	528490	30.1	4841	keep	Previous experiments decreasing WEIGHT_DECAY and SCALAR_LR have yielded incremen	NVIDIA GeForce RTX 5090	950a228fa3f0b687b1dc8b9feb6c9d1849c0e7c9
exp46	Decrease WEIGHT_DECAY from 0.05 to 0.04	1.047885	5.2	529666	30.1	4848	discard	Recent reductions in WEIGHT_DECAY yielded steady improvements, with 0.05 current	NVIDIA GeForce RTX 5090	950a228fa3f0b687b1dc8b9feb6c9d1849c0e7c9
exp47	Decrease WEIGHT_DECAY from 0.05 to 0.045	1.046691	5.2	528666	30.1	4840	keep	Recent experiments show that gradually reducing WEIGHT_DECAY has consistently im	NVIDIA GeForce RTX 5090	950a228fa3f0b687b1dc8b9feb6c9d1849c0e7c9
exp48	Decrease MATRIX_LR from 0.03 to 0.025	1.049581	5.2	529333	30.1	4845	discard	Lowering the learning rate for matrix parameters can sometimes improve stability	NVIDIA GeForce RTX 5090	950a228fa3f0b687b1dc8b9feb6c9d1849c0e7c9
exp49	Decrease SCALAR_LR from 0.32 to 0.29	1.050069	5.2	528823	30.1	4844	discard	Recent experiments lowering SCALAR_LR below 0.32 (to 0.3 or below) were previous	NVIDIA GeForce RTX 5090	950a228fa3f0b687b1dc8b9feb6c9d1849c0e7c9
exp50	Decrease EMBEDDING_LR from 0.4 to 0.36	1.046663	5.2	529666	30.1	4848	keep	Lowering the embedding learning rate could provide a small regularization benefi	NVIDIA GeForce RTX 5090	950a228fa3f0b687b1dc8b9feb6c9d1849c0e7c9
exp51	Decrease WEIGHT_DECAY from 0.045 to 0.04	1.047277	5.2	529333	30.1	4847	discard	Lowering weight decay can further reduce the regularization effect, possibly all	NVIDIA GeForce RTX 5090	950a228fa3f0b687b1dc8b9feb6c9d1849c0e7c9
exp52	Decrease MATRIX_LR from 0.03 to 0.028	1.049878	5.2	528823	30.1	4844	discard	The recent successful trend shows that decreasing learning rates and weight deca	NVIDIA GeForce RTX 5090	950a228fa3f0b687b1dc8b9feb6c9d1849c0e7c9
exp53	Decrease EMBEDDING_LR from 0.36 to 0.34	1.046662	5.2	529156	30.1	4845	keep	The previous reductions of EMBEDDING_LR from 0.4 to 0.36 yielded consistent impr	NVIDIA GeForce RTX 5090	950a228fa3f0b687b1dc8b9feb6c9d1849c0e7c9
exp54	Decrease WEIGHT_DECAY from 0.045 to 0.04	1.047435	5.2	529666	30.1	4848	discard	Previous smaller decreases to WEIGHT_DECAY improved val_bpb up to 0.045 (current	NVIDIA GeForce RTX 5090	950a228fa3f0b687b1dc8b9feb6c9d1849c0e7c9
exp55	Decrease EMBEDDING_LR from 0.34 to 0.32	1.046613	5.2	529666	30.2	4850	keep	Lowering the EMBEDDING_LR incrementally might further stabilize embedding learni	NVIDIA GeForce RTX 5090	950a228fa3f0b687b1dc8b9feb6c9d1849c0e7c9
exp56	Decrease WEIGHT_DECAY from 0.045 to 0.042	1.047973	5.2	530000	30.2	4851	discard	Recent experiments show small, consistent improvements from modestly lowering we	NVIDIA GeForce RTX 5090	950a228fa3f0b687b1dc8b9feb6c9d1849c0e7c9
exp57	Decrease EMBEDDING_LR from 0.32 to 0.30	1.047949	5.2	530000	30.2	4851	discard	Recent decreases in EMBEDDING_LR have consistently led to improvements in val_bp	NVIDIA GeForce RTX 5090	950a228fa3f0b687b1dc8b9feb6c9d1849c0e7c9
exp58	Decrease WEIGHT_DECAY from 0.045 to 0.043	1.047866	5.2	529666	30.1	4849	discard	Previous reductions in WEIGHT_DECAY from 0.08 to 0.045 consistently improved val	NVIDIA GeForce RTX 5090	950a228fa3f0b687b1dc8b9feb6c9d1849c0e7c9
exp59	Decrease SCALAR_LR from 0.32 to 0.31	1.050173	5.2	530000	30.2	4851	discard	Lowering SCALAR_LR further may stabilize training and prevent overshooting, as p	NVIDIA GeForce RTX 5090	950a228fa3f0b687b1dc8b9feb6c9d1849c0e7c9
exp60	Decrease EMBEDDING_LR from 0.32 to 0.30	1.046767	5.2	528666	30.1	4840	discard	Recent experiments decreasing EMBEDDING_LR (from 0.36 downward) have consistentl	NVIDIA GeForce RTX 5090	950a228fa3f0b687b1dc8b9feb6c9d1849c0e7c9
exp61	Decrease WEIGHT_DECAY from 0.045 to 0.044	1.046380	5.2	530000	30.2	4853	keep	Recent experiments suggest that lowering WEIGHT_DECAY from 0.05 to 0.045 improve	NVIDIA GeForce RTX 5090	950a228fa3f0b687b1dc8b9feb6c9d1849c0e7c9
exp62	Decrease EMBEDDING_LR from 0.32 to 0.30	1.047265	5.2	530000	30.2	4852	discard	Further gradual reduction of EMBEDDING_LR may reduce overfitting and improve gen	NVIDIA GeForce RTX 5090	950a228fa3f0b687b1dc8b9feb6c9d1849c0e7c9
exp63	Decrease MATRIX_LR from 0.03 to 0.028	1.046264	5.2	529666	30.2	4849	keep	Recent decreases to MATRIX_LR below 0.03 were tested before several beneficial L	NVIDIA GeForce RTX 5090	950a228fa3f0b687b1dc8b9feb6c9d1849c0e7c9
exp64	Decrease EMBEDDING_LR from 0.32 to 0.30	1.047490	5.2	529666	30.2	4849	discard	Previous reductions in EMBEDDING_LR have led to modest improvements in val_bpb, 	NVIDIA GeForce RTX 5090	950a228fa3f0b687b1dc8b9feb6c9d1849c0e7c9
exp65	Decrease SCALAR_LR from 0.32 to 0.31	1.049577	5.2	529666	30.2	4849	discard	SCALAR_LR was previously decreased in gradual steps, and the last reduction from	NVIDIA GeForce RTX 5090	950a228fa3f0b687b1dc8b9feb6c9d1849c0e7c9
exp66	Decrease WEIGHT_DECAY from 0.044 to 0.042	1.046468	5.2	529666	30.2	4849	discard	Recent experiments indicate incremental improvements with slightly reducing weig	NVIDIA GeForce RTX 5090	950a228fa3f0b687b1dc8b9feb6c9d1849c0e7c9
exp67	Decrease EMBEDDING_LR from 0.32 to 0.31	1.047237	5.2	529666	30.2	4850	discard	Lowering the embedding learning rate has previously shown incremental improvemen	NVIDIA GeForce RTX 5090	950a228fa3f0b687b1dc8b9feb6c9d1849c0e7c9
exp68	Decrease UNEMBEDDING_LR from 0.004 to 0.0035	1.047175	5.2	529333	30.1	4847	discard	UNEMBEDDING_LR has not been directly explored in this regime after aggressive tu	NVIDIA GeForce RTX 5090	950a228fa3f0b687b1dc8b9feb6c9d1849c0e7c9
exp69	Decrease SCALAR_LR from 0.32 to 0.31	1.049894	5.2	529666	30.2	4849	discard	Previous experiments show incremental improvements from lowering SCALAR_LR, thou	NVIDIA GeForce RTX 5090	950a228fa3f0b687b1dc8b9feb6c9d1849c0e7c9
exp70	Decrease EMBEDDING_LR from 0.32 to 0.31	1.046407	5.2	529333	30.1	4846	discard	EMBEDDING_LR has been successfully decreased several times before, and recent dr	NVIDIA GeForce RTX 5090	950a228fa3f0b687b1dc8b9feb6c9d1849c0e7c9
exp71	Decrease SCALAR_LR from 0.32 to 0.29	1.049901	5.2	529666	30.2	4850	discard	Previous reductions in SCALAR_LR have led to improved val_bpb until a plateau, a	NVIDIA GeForce RTX 5090	950a228fa3f0b687b1dc8b9feb6c9d1849c0e7c9
exp72	Decrease WEIGHT_DECAY from 0.044 to 0.043	1.046140	5.2	529823	30.2	4851	keep	The previous decreases in WEIGHT_DECAY from higher values to 0.044 led to steady	NVIDIA GeForce RTX 5090	950a228fa3f0b687b1dc8b9feb6c9d1849c0e7c9
exp73	Decrease MATRIX_LR from 0.028 to 0.026	1.048195	5.2	530000	30.2	4851	discard	Recent decreases in MATRIX_LR have led to steady and incremental improvements in	NVIDIA GeForce RTX 5090	950a228fa3f0b687b1dc8b9feb6c9d1849c0e7c9
exp74	Decrease WEIGHT_DECAY from 0.043 to 0.042	1.046556	5.2	529490	30.1	4848	discard	Recent successful experiments have shown incremental improvements in val_bpb by 	NVIDIA GeForce RTX 5090	950a228fa3f0b687b1dc8b9feb6c9d1849c0e7c9
exp75	Decrease MATRIX_LR from 0.028 to 0.027	1.049808	5.2	530000	30.2	4851	discard	Recent learning rate decreases for other parameters produced marginal improvemen	NVIDIA GeForce RTX 5090	950a228fa3f0b687b1dc8b9feb6c9d1849c0e7c9
exp76	Decrease WEIGHT_DECAY from 0.043 to 0.042	1.046869	5.2	527000	30.0	4824	discard	Previous decreases in WEIGHT_DECAY have sometimes yielded marginal improvements 	NVIDIA GeForce RTX 5090	950a228fa3f0b687b1dc8b9feb6c9d1849c0e7c9
exp77	Decrease EMBEDDING_LR from 0.32 to 0.305	1.047466	5.2	529000	30.1	4842	discard	Several recent decreases in EMBEDDING_LR toward 0.30 either improved or negligib	NVIDIA GeForce RTX 5090	950a228fa3f0b687b1dc8b9feb6c9d1849c0e7c9
exp78	Decrease WEIGHT_DECAY from 0.043 to 0.042	1.046503	5.2	530666	30.2	4857	discard	Recent successful reductions in weight decay (from 0.045 down to 0.043) have con	NVIDIA GeForce RTX 5090	950a228fa3f0b687b1dc8b9feb6c9d1849c0e7c9
exp79	Decrease WEIGHT_DECAY from 0.043 to 0.042	1.046701	5.2	530333	30.2	4855	discard	There has been a slight but consistent benefit from decreasing WEIGHT_DECAY, and	NVIDIA GeForce RTX 5090	950a228fa3f0b687b1dc8b9feb6c9d1849c0e7c9
exp80	Decrease EMBEDDING_LR from 0.32 to 0.29	1.046350	5.2	530156	30.2	4856	discard	Most recent reductions of EMBEDDING_LR below 0.32 were clustered around 0.30–0.3	NVIDIA GeForce RTX 5090	950a228fa3f0b687b1dc8b9feb6c9d1849c0e7c9
exp81	Decrease EMBEDDING_LR from 0.32 to 0.28	1.045957	5.2	530000	30.2	4851	keep	Recent experiments show that slightly lowering the EMBEDDING_LR often reduces ov	NVIDIA GeForce RTX 5090	950a228fa3f0b687b1dc8b9feb6c9d1849c0e7c9
exp82	Decrease WEIGHT_DECAY from 0.043 to 0.041	1.046488	5.2	530333	30.2	4854	discard	Recent experiments show slight incremental improvement with reductions in weight	NVIDIA GeForce RTX 5090	950a228fa3f0b687b1dc8b9feb6c9d1849c0e7c9
exp83	Decrease WEIGHT_DECAY from 0.043 to 0.041	1.046406	5.2	530333	30.2	4856	discard	Recent reductions in WEIGHT_DECAY have shown incremental improvements in val_bpb	NVIDIA GeForce RTX 5090	950a228fa3f0b687b1dc8b9feb6c9d1849c0e7c9
exp84	Decrease WEIGHT_DECAY from 0.043 to 0.042	1.046630	5.2	530000	30.2	4851	discard	Several recent experiments have found small stepwise improvements by reducing WE	NVIDIA GeForce RTX 5090	950a228fa3f0b687b1dc8b9feb6c9d1849c0e7c9
exp85	Decrease WEIGHT_DECAY from 0.043 to 0.04	1.046224	5.2	530000	30.2	4853	discard	Recent successful experiments indicate incremental improvements as WEIGHT_DECAY 	NVIDIA GeForce RTX 5090	950a228fa3f0b687b1dc8b9feb6c9d1849c0e7c9
exp86	Decrease WEIGHT_DECAY from 0.043 to 0.042	1.047486	5.2	529666	30.1	4848	discard	The recent trend shows that small reductions to weight decay have sometimes led 	NVIDIA GeForce RTX 5090	950a228fa3f0b687b1dc8b9feb6c9d1849c0e7c9
exp87	Decrease WEIGHT_DECAY from 0.043 to 0.041	1.047086	5.2	530000	30.2	4851	discard	Recent trends suggest small reductions in weight decay can offer slight improvem	NVIDIA GeForce RTX 5090	950a228fa3f0b687b1dc8b9feb6c9d1849c0e7c9
exp88	Decrease WEIGHT_DECAY from 0.043 to 0.038	1.046322	5.2	530000	30.2	4851	discard	Recent successful experiments indicate that small reductions in weight decay can	NVIDIA GeForce RTX 5090	950a228fa3f0b687b1dc8b9feb6c9d1849c0e7c9
exp89	Decrease EMBEDDING_LR from 0.28 to 0.26	1.046132	5.2	529333	30.1	4847	discard	Lowering the embedding learning rate further may help with stability and final v	NVIDIA GeForce RTX 5090	950a228fa3f0b687b1dc8b9feb6c9d1849c0e7c9
exp90	Decrease WEIGHT_DECAY from 0.043 to 0.039	1.046162	5.2	529666	30.2	4850	discard	Recent decreases in WEIGHT_DECAY have led to incremental but consistent improvem	NVIDIA GeForce RTX 5090	950a228fa3f0b687b1dc8b9feb6c9d1849c0e7c9
exp91	Decrease EMBEDDING_LR from 0.28 to 0.26	1.046447	5.2	529666	30.2	4850	discard	Several recent experiments suggest that slight reductions in EMBEDDING_LR can le	NVIDIA GeForce RTX 5090	950a228fa3f0b687b1dc8b9feb6c9d1849c0e7c9
exp92	Decrease WEIGHT_DECAY from 0.043 to 0.041	1.045892	5.2	529490	30.2	4850	keep	Recent experiments find marginal but consistent improvements as WEIGHT_DECAY is 	NVIDIA GeForce RTX 5090	950a228fa3f0b687b1dc8b9feb6c9d1849c0e7c9
exp93	Decrease EMBEDDING_LR from 0.28 to 0.26	1.046873	5.2	529333	30.1	4846	discard	The trend shows that gradual reductions in EMBEDDING_LR have repeatedly given sm	NVIDIA GeForce RTX 5090	950a228fa3f0b687b1dc8b9feb6c9d1849c0e7c9
exp94	Decrease MATRIX_LR from 0.028 to 0.026	1.047969	5.2	529666	30.2	4850	discard	MATRIX_LR is still at a moderate value and the last improvement from 0.03 to 0.0	NVIDIA GeForce RTX 5090	950a228fa3f0b687b1dc8b9feb6c9d1849c0e7c9
