exp	description	val_bpb	peak_mem_gb	tok_sec	mfu	steps	status	notes	gpu_name	baseline_sha
exp95	Increase EMBEDDING_LR from 0.195 to 0.2	1.036497	5.8	543333	35.8	4974	discard	Recent experiments (exps 86, 89, 94) show that increasing EMBEDDING_LR toward 0.	NVIDIA GeForce RTX 5090	14e1f266a40c145cf5bfb2bae54d286b17b89a3c
exp96	Increase WARMDOWN_RATIO from 0.6 to 0.62	1.035914	5.8	542333	35.8	4966	keep	Previous experiments established that a longer warmdown phase improves final val	NVIDIA GeForce RTX 5090	14e1f266a40c145cf5bfb2bae54d286b17b89a3c
exp97	Increase EMBEDDING_LR from 0.195 to 0.198	1.036379	5.8	539333	35.6	4939	discard	Increasing the embedding learning rate in small increments previously yielded co	NVIDIA GeForce RTX 5090	14e1f266a40c145cf5bfb2bae54d286b17b89a3c
exp98	Increase EMBEDDING_LR from 0.195 to 0.197	1.036320	5.8	541000	35.7	4954	discard	Small increases in EMBEDDING_LR (from 0.18 upwards) have mostly maintained or ve	NVIDIA GeForce RTX 5090	14e1f266a40c145cf5bfb2bae54d286b17b89a3c
exp99	Increase EMBEDDING_LR from 0.195 to 0.196	1.036455	5.8	542000	35.7	4962	discard	The current best run (exp96) uses EMBEDDING_LR=0.195, and there are no experimen	NVIDIA GeForce RTX 5090	14e1f266a40c145cf5bfb2bae54d286b17b89a3c
