exp	description	val_bpb	peak_mem_gb	tok_sec	mfu	steps	status	notes	gpu_name	baseline_sha
exp0	baseline (no modifications)	1.090311	5.9	298900	17.0	2736	baseline	depth=8, NVIDIA GeForce RTX 5090	NVIDIA GeForce RTX 5090	3296a77d448a3027ead5767cd9e29cb3587af052
exp1	Decrease DEVICE_BATCH_SIZE to increase gradient step count per fixed time.	0.000000	0.0	0	0.0	0	crash	training crashed or timed out	NVIDIA GeForce RTX 5090	3296a77d448a3027ead5767cd9e29cb3587af052
exp2	Decrease ASPECT_RATIO from 64 to 48	1.093616	4.5	426524	15.3	3906	discard	Reducing ASPECT_RATIO lowers the model's width (model_dim), thus uses less memor	NVIDIA GeForce RTX 5090	3296a77d448a3027ead5767cd9e29cb3587af052
exp3	Decrease MATRIX_LR from 0.04 to 0.03	1.087346	5.9	299000	17.0	2736	keep	The relatively high MATRIX_LR may cause less stable or suboptimal updates to the	NVIDIA GeForce RTX 5090	3296a77d448a3027ead5767cd9e29cb3587af052
exp4	Decrease TOTAL_BATCH_SIZE to increase number of gradient steps per fixed time.	0.000000	0.0	0	0.0	0	crash	training crashed or timed out	NVIDIA GeForce RTX 5090	3296a77d448a3027ead5767cd9e29cb3587af052
exp5	Decrease WEIGHT_DECAY from 0.2 to 0.1	1.083566	5.9	298900	17.0	2738	keep	The current weight decay may be too strong and could limit the model’s capacity 	NVIDIA GeForce RTX 5090	3296a77d448a3027ead5767cd9e29cb3587af052
exp6	Increase WARMDOWN_RATIO from 0.5 to 0.7	1.082465	5.9	298666	17.0	2735	keep	A higher warmdown ratio extends the period during which the learning rate decays	NVIDIA GeForce RTX 5090	3296a77d448a3027ead5767cd9e29cb3587af052
exp7	Decrease DEVICE_BATCH_SIZE from _hp_defaults['device_batch_size'] to 75% of its value to increase gradient steps per fixed time.	0.000000	0.0	0	0.0	0	crash	training crashed or timed out	NVIDIA GeForce RTX 5090	3296a77d448a3027ead5767cd9e29cb3587af052
exp8	Decrease SCALAR_LR from 0.5 to 0.35	1.080508	5.9	298233	16.9	2731	keep	A slightly lower learning rate for per-layer scalars may encourage more stable a	NVIDIA GeForce RTX 5090	3296a77d448a3027ead5767cd9e29cb3587af052
exp9	Decrease HEAD_DIM from 128 to 96	1.092263	6.6	234921	16.2	2153	discard	Reducing HEAD_DIM will decrease the per-layer parameter and computational footpr	NVIDIA GeForce RTX 5090	3296a77d448a3027ead5767cd9e29cb3587af052
exp10	Decrease EMBEDDING_LR from 0.6 to 0.45	1.078229	5.9	298567	17.0	2735	keep	The embedding layer often benefits from slightly more conservative learning rate	NVIDIA GeForce RTX 5090	3296a77d448a3027ead5767cd9e29cb3587af052
exp11	Decrease UNEMBEDDING_LR from 0.008 to 0.004	1.078002	5.9	298567	17.0	2735	keep	Lowering the learning rate for the unembedding (lm_head) reduces the chance of d	NVIDIA GeForce RTX 5090	3296a77d448a3027ead5767cd9e29cb3587af052
exp12	Increase WARMDOWN_RATIO from 0.7 to 0.85	1.079231	5.9	298567	17.0	2735	discard	WARMDOWN_RATIO controls how much of the training budget is spent decaying the le	NVIDIA GeForce RTX 5090	3296a77d448a3027ead5767cd9e29cb3587af052
exp13	Decrease MLP ratio in hidden layers from default to 3.5	1.077993	5.9	299000	17.0	2736	keep	Lowering the MLP ratio reduces the size of the feedforward layers, which can dec	NVIDIA GeForce RTX 5090	3296a77d448a3027ead5767cd9e29cb3587af052
exp14	Decrease ASPECT_RATIO from 64 to 56	1.077610	5.9	298900	17.0	2737	keep	Lowering ASPECT_RATIO reduces overall model width (model_dim), which can decreas	NVIDIA GeForce RTX 5090	3296a77d448a3027ead5767cd9e29cb3587af052
exp15	Decrease WEIGHT_DECAY from 0.1 to 0.05	1.079099	5.9	298233	17.0	2732	discard	Lowering weight decay could reduce excessive regularization now that we have alr	NVIDIA GeForce RTX 5090	3296a77d448a3027ead5767cd9e29cb3587af052
exp16	Decrease MLP_RATIO from 3.5 to 3.0	1.078262	5.9	298567	17.0	2734	discard	Lowering the MLP ratio slightly reduces the hidden dimension of the feedforward 	NVIDIA GeForce RTX 5090	3296a77d448a3027ead5767cd9e29cb3587af052
exp17	Decrease WARMDOWN_RATIO from 0.7 to 0.5	1.079395	5.9	298333	17.0	2731	discard	In previous experiments, lowering the warmdown ratio (i.e., shortening the learn	NVIDIA GeForce RTX 5090	3296a77d448a3027ead5767cd9e29cb3587af052
exp18	Decrease MATRIX_LR from 0.03 to 0.02	1.078460	5.9	298900	17.0	2738	discard	Lowering the learning rate for matrix parameters could help achieve a more stabl	NVIDIA GeForce RTX 5090	3296a77d448a3027ead5767cd9e29cb3587af052
exp19	Decrease TOTAL_BATCH_SIZE by 10% to increase the number of gradient steps per fixed time.	0.000000	0.0	0	0.0	0	crash	training crashed or timed out	NVIDIA GeForce RTX 5090	3296a77d448a3027ead5767cd9e29cb3587af052
exp20	Increase DEPTH by 2 over the current _hp_defaults['depth']	1.087377	9.0	195000	19.8	1784	discard	Increasing model depth should, in principle, enhance expressivity, potentially l	NVIDIA GeForce RTX 5090	3296a77d448a3027ead5767cd9e29cb3587af052
exp21	Increase MLP_RATIO from 3.5 to 4.0	1.077758	5.9	298567	17.0	2735	discard	Prior experiments decreasing the MLP_RATIO below typical values (default ~4) hav	NVIDIA GeForce RTX 5090	3296a77d448a3027ead5767cd9e29cb3587af052
exp22	Decrease HEAD_DIM from 128 to 112	1.087546	5.2	323892	14.8	2967	discard	Lowering HEAD_DIM will slightly reduce attention computation and overall model w	NVIDIA GeForce RTX 5090	3296a77d448a3027ead5767cd9e29cb3587af052
exp23	Increase WARMDOWN_RATIO from 0.7 to 0.8	1.078293	5.9	298666	17.0	2733	discard	Prior experiments show that increasing the WARMDOWN_RATIO from 0.5 to 0.7 provid	NVIDIA GeForce RTX 5090	3296a77d448a3027ead5767cd9e29cb3587af052
exp24	Decrease SCALAR_LR from 0.35 to 0.25	1.078654	5.9	298900	17.0	2736	discard	SCALAR_LR is still relatively high, and further reducing it may decrease overfit	NVIDIA GeForce RTX 5090	3296a77d448a3027ead5767cd9e29cb3587af052
exp25	Decrease WARMDOWN_RATIO from 0.7 to 0.6	1.078098	5.9	298900	17.0	2737	discard	Prior experiments show best val_bpb with WARMDOWN_RATIO at 0.7, but performance 	NVIDIA GeForce RTX 5090	3296a77d448a3027ead5767cd9e29cb3587af052
exp26	Decrease MLP_RATIO from 3.5 to 3.2	1.077858	5.9	298567	17.0	2735	discard	Reducing the MLP_RATIO lowers the capacity of the feedforward blocks, which will	NVIDIA GeForce RTX 5090	3296a77d448a3027ead5767cd9e29cb3587af052
exp27	Decrease UNEMBEDDING_LR from 0.004 to 0.002	1.082208	5.9	298233	17.0	2732	discard	Previous reductions in UNEMBEDDING_LR led to improvements in val_bpb, possibly d	NVIDIA GeForce RTX 5090	3296a77d448a3027ead5767cd9e29cb3587af052
exp28	Decrease MLP_RATIO from 3.5 to 3.3	1.077656	5.9	298333	17.0	2731	discard	Previous decreases in MLP_RATIO below 3.5 were only modestly worse or neutral, b	NVIDIA GeForce RTX 5090	3296a77d448a3027ead5767cd9e29cb3587af052
exp29	Increase DEPTH by 1 over the current _hp_defaults['depth']	1.077901	6.6	280333	18.0	2567	discard	Increasing model depth tends to improve model capacity as long as GPU memory all	NVIDIA GeForce RTX 5090	3296a77d448a3027ead5767cd9e29cb3587af052
exp30	Decrease SCALAR_LR from 0.35 to 0.3	1.079701	5.9	298900	17.0	2737	discard	Previous reductions to SCALAR_LR showed improvements (exp8: from 0.5 to 0.35 red	NVIDIA GeForce RTX 5090	3296a77d448a3027ead5767cd9e29cb3587af052
exp31	Decrease ASPECT_RATIO from 56 to 48	1.082193	4.5	426333	15.3	3903	discard	Prior results (exp2, exp14) suggest reducing ASPECT_RATIO can sometimes help by 	NVIDIA GeForce RTX 5090	3296a77d448a3027ead5767cd9e29cb3587af052
exp32	Increase WEIGHT_DECAY from 0.1 to 0.15	1.079118	5.9	299000	17.0	2737	discard	The history suggests that decreasing weight decay below 0.1 (to 0.05) was not be	NVIDIA GeForce RTX 5090	3296a77d448a3027ead5767cd9e29cb3587af052
exp33	Increase HEAD_DIM from 128 to 144	1.103086	6.6	201666	13.9	1847	discard	Larger attention head dimensions may improve model expressivity and sequence mod	NVIDIA GeForce RTX 5090	3296a77d448a3027ead5767cd9e29cb3587af052
exp34	Decrease WARMDOWN_RATIO from 0.7 to 0.65	1.078493	5.9	298666	17.0	2735	discard	Prior experiments show a slight improvement when setting WARMDOWN_RATIO to 0.7, 	NVIDIA GeForce RTX 5090	3296a77d448a3027ead5767cd9e29cb3587af052
exp35	Decrease EMBEDDING_LR from 0.45 to 0.35	1.079394	5.9	298567	17.0	2735	discard	Reducing the embedding learning rate may help the model converge more smoothly, 	NVIDIA GeForce RTX 5090	3296a77d448a3027ead5767cd9e29cb3587af052
exp36	Decrease ASPECT_RATIO from 56 to 52	1.077966	5.9	298567	17.0	2735	discard	Lowering the ASPECT_RATIO will slightly reduce the width of each layer, decreasi	NVIDIA GeForce RTX 5090	3296a77d448a3027ead5767cd9e29cb3587af052
exp37	Increase HEAD_DIM from 128 to 136	1.107864	6.3	198933	12.5	1821	discard	Prior reductions of HEAD_DIM (to 112 and 96) worsened validation bpb, while incr	NVIDIA GeForce RTX 5090	3296a77d448a3027ead5767cd9e29cb3587af052
exp38	Increase WINDOW_PATTERN complexity from "SSSL" to "SSLL"	1.068762	5.9	351000	21.0	3213	keep	A slightly less local window pattern (more "L" full-context attention blocks) ma	NVIDIA GeForce RTX 5090	3296a77d448a3027ead5767cd9e29cb3587af052
exp39	Decrease ASPECT_RATIO from 56 to 52	1.068730	5.9	351000	21.0	3213	keep	Lowering ASPECT_RATIO will reduce the model dimension, lowering per-forward memo	NVIDIA GeForce RTX 5090	3296a77d448a3027ead5767cd9e29cb3587af052
exp40	Decrease WEIGHT_DECAY from 0.1 to 0.08	1.068469	5.9	350883	21.0	3215	keep	Lowering weight decay may allow the model to use capacity more freely and reduce	NVIDIA GeForce RTX 5090	3296a77d448a3027ead5767cd9e29cb3587af052
exp41	Decrease SCALAR_LR from 0.35 to 0.28	1.067205	5.9	350883	21.0	3215	keep	The scalar learning rate has previously been beneficially reduced (see exp8, whi	NVIDIA GeForce RTX 5090	3296a77d448a3027ead5767cd9e29cb3587af052
exp42	Decrease EMBEDDING_LR from 0.45 to 0.36	1.066578	5.9	350883	21.0	3215	keep	Lowering the embedding learning rate may further stabilize training and reduce o	NVIDIA GeForce RTX 5090	3296a77d448a3027ead5767cd9e29cb3587af052
exp43	Decrease UNEMBEDDING_LR from 0.004 to 0.003 to fine-tune output layer learning.	1.066039	5.9	351333	21.0	3216	keep	Previous reductions in UNEMBEDDING_LR improved validation bpb until reaching 0.0	NVIDIA GeForce RTX 5090	3296a77d448a3027ead5767cd9e29cb3587af052
exp44	Decrease MATRIX_LR from 0.03 to 0.025	1.065343	5.9	351000	21.0	3215	keep	Lowering the learning rate for matrix parameters may help further stabilize late	NVIDIA GeForce RTX 5090	3296a77d448a3027ead5767cd9e29cb3587af052
exp45	Decrease DEVICE_BATCH_SIZE by ~10% to increase the number of gradient steps per fixed time.	0.000000	0.0	0	0.0	0	crash	training crashed or timed out	NVIDIA GeForce RTX 5090	3296a77d448a3027ead5767cd9e29cb3587af052
exp46	Decrease SCALAR_LR from 0.28 to 0.22	1.065071	5.9	351333	21.0	3216	keep	Recent reductions in SCALAR_LR (from 0.35 to 0.28) have shown improvements in va	NVIDIA GeForce RTX 5090	3296a77d448a3027ead5767cd9e29cb3587af052
exp47	Decrease EMBEDDING_LR from 0.36 to 0.28	1.065927	5.9	351000	21.0	3213	discard	Smaller learning rates for embeddings have trended positively, and the other lea	NVIDIA GeForce RTX 5090	3296a77d448a3027ead5767cd9e29cb3587af052
exp48	Decrease UNEMBEDDING_LR from 0.003 to 0.0025	1.067029	5.9	351000	21.0	3213	discard	Recent fine-grained decreases in learning rates have led to incremental gains, a	NVIDIA GeForce RTX 5090	3296a77d448a3027ead5767cd9e29cb3587af052
exp49	Decrease MATRIX_LR from 0.025 to 0.02	1.066579	5.9	350883	21.0	3212	discard	Since all learning rates have systematically trended downward, and each incremen	NVIDIA GeForce RTX 5090	3296a77d448a3027ead5767cd9e29cb3587af052
exp50	Decrease WEIGHT_DECAY from 0.08 to 0.06	1.066025	5.9	351000	21.0	3214	discard	Gradually lowering weight decay can help determine if a slight reduction in regu	NVIDIA GeForce RTX 5090	3296a77d448a3027ead5767cd9e29cb3587af052
exp51	Decrease SCALAR_LR from 0.22 to 0.18	1.066306	5.9	351000	21.0	3215	discard	Previous reductions in SCALAR_LR have shown consistent improvements to val_bpb, 	NVIDIA GeForce RTX 5090	3296a77d448a3027ead5767cd9e29cb3587af052
exp52	Decrease WARMDOWN_RATIO from 0.7 to 0.6	1.065203	5.9	350883	21.0	3213	discard	Since too aggressive a warmdown has sometimes slightly degraded results in previ	NVIDIA GeForce RTX 5090	3296a77d448a3027ead5767cd9e29cb3587af052
exp53	Decrease SCALAR_LR from 0.22 to 0.16	1.067758	5.9	350883	21.0	3214	discard	Reducing the scalar learning rate incrementally has consistently improved val_bp	NVIDIA GeForce RTX 5090	3296a77d448a3027ead5767cd9e29cb3587af052
exp54	Decrease EMBEDDING_LR from 0.36 to 0.32	1.065976	5.9	350883	21.0	3212	discard	Recent reductions in learning rates (especially fine-tuning around embedding par	NVIDIA GeForce RTX 5090	3296a77d448a3027ead5767cd9e29cb3587af052
exp55	Decrease DEVICE_BATCH_SIZE by approximately 7% to attempt higher gradient step count per fixed time.	0.000000	0.0	0	0.0	0	crash	training crashed or timed out	NVIDIA GeForce RTX 5090	3296a77d448a3027ead5767cd9e29cb3587af052
exp56	Decrease WARMUP_RATIO from 0.0 to 0.0 (no change, already at minimum—so INCREASE FINAL_LR_FRAC from 0.0 to 0.04 instead)	1.064615	5.9	350666	21.0	3209	keep	With the learning rate warmup already at zero and warmdown fairly aggressive, mo	NVIDIA GeForce RTX 5090	3296a77d448a3027ead5767cd9e29cb3587af052
exp57	Decrease SCALAR_LR from 0.22 to 0.19	1.065625	5.9	350883	21.0	3215	discard	Recent reductions in SCALAR_LR from higher values have consistently improved val	NVIDIA GeForce RTX 5090	3296a77d448a3027ead5767cd9e29cb3587af052
exp58	Decrease SCALAR_LR from 0.22 to 0.20	1.064812	5.9	350883	21.0	3212	discard	Recent history shows consistent improvement as SCALAR_LR is decreased, until aro	NVIDIA GeForce RTX 5090	3296a77d448a3027ead5767cd9e29cb3587af052
exp59	Decrease WARMDOWN_RATIO from 0.7 to 0.65	1.064391	5.9	350549	21.0	3209	keep	WARMDOWN_RATIO determines how quickly the learning rate is reduced near the end 	NVIDIA GeForce RTX 5090	3296a77d448a3027ead5767cd9e29cb3587af052
exp60	Decrease SCALAR_LR from 0.22 to 0.17	1.066417	5.9	350666	21.0	3210	discard	Recent experiments show some improvement when reducing SCALAR_LR, but decreases 	NVIDIA GeForce RTX 5090	3296a77d448a3027ead5767cd9e29cb3587af052
exp61	Decrease WEIGHT_DECAY from 0.08 to 0.07	1.064590	5.9	351000	21.0	3214	discard	Recent successful reductions in weight decay (to 0.08) have yielded improved val	NVIDIA GeForce RTX 5090	3296a77d448a3027ead5767cd9e29cb3587af052
exp62	Decrease ASPECT_RATIO from 52 to 50.	1.064108	5.9	350883	21.0	3215	keep	Previous decreases in ASPECT_RATIO generally produced slight improvements in val	NVIDIA GeForce RTX 5090	3296a77d448a3027ead5767cd9e29cb3587af052
exp63	Decrease WEIGHT_DECAY from 0.08 to 0.075	1.064646	5.9	350549	21.0	3210	discard	Prior reductions in WEIGHT_DECAY (from 0.1 to 0.08, exp40/50/61) have trended to	NVIDIA GeForce RTX 5090	3296a77d448a3027ead5767cd9e29cb3587af052
exp64	Decrease MLP_RATIO from 3.5 to 3.2	1.063767	5.9	351333	21.1	3218	keep	Reducing the MLP_RATIO shrinks the feed-forward network width, which typically d	NVIDIA GeForce RTX 5090	3296a77d448a3027ead5767cd9e29cb3587af052
exp65	Decrease WARMDOWN_RATIO from 0.65 to 0.6	1.064197	5.9	350883	21.0	3213	discard	In previous experiments, slightly reducing the warmdown ratio increased the prop	NVIDIA GeForce RTX 5090	3296a77d448a3027ead5767cd9e29cb3587af052
exp66	Decrease MATRIX_LR from 0.025 to 0.02	1.066161	5.9	348217	20.9	3190	discard	Recent improvements were seen with moderate reductions in learning rates. MATRIX	NVIDIA GeForce RTX 5090	3296a77d448a3027ead5767cd9e29cb3587af052
exp67	Decrease MLP_RATIO from 3.2 to 3.0	1.064277	5.9	351000	21.0	3214	discard	Lowering MLP_RATIO slightly (within a healthy range) can reduce the hidden feedf	NVIDIA GeForce RTX 5090	3296a77d448a3027ead5767cd9e29cb3587af052
exp68	Decrease WARMDOWN_RATIO from 0.65 to 0.6	1.064333	5.9	351000	21.0	3212	discard	The current WARMDOWN_RATIO is 0.65, and previous attempts to decrease it from hi	NVIDIA GeForce RTX 5090	3296a77d448a3027ead5767cd9e29cb3587af052
exp69	Decrease WEIGHT_DECAY from 0.08 to 0.06	1.064834	5.9	351000	21.0	3212	discard	Lowering weight decay can sometimes enable better convergence and lower over-reg	NVIDIA GeForce RTX 5090	3296a77d448a3027ead5767cd9e29cb3587af052
exp70	Decrease ASPECT_RATIO from 50 to 48	1.070668	4.5	506333	19.4	4636	discard	Reducing ASPECT_RATIO will slightly shrink the model's width, lowering per-step 	NVIDIA GeForce RTX 5090	3296a77d448a3027ead5767cd9e29cb3587af052
exp71	Decrease WEIGHT_DECAY from 0.08 to 0.07	1.064571	5.9	350883	21.0	3215	discard	Past experiments reducing weight decay below 0.08 showed largely neutral or slig	NVIDIA GeForce RTX 5090	3296a77d448a3027ead5767cd9e29cb3587af052
exp72	Decrease UNEMBEDDING_LR from 0.003 to 0.0028	1.065287	5.9	351000	21.0	3213	discard	Recent decreases in the output (lm_head) learning rate modestly improved validat	NVIDIA GeForce RTX 5090	3296a77d448a3027ead5767cd9e29cb3587af052
exp73	Decrease WEIGHT_DECAY from 0.08 to 0.05	1.064692	5.9	351216	21.0	3217	discard	Weight decay can sometimes be excessively regularizing when already at relativel	NVIDIA GeForce RTX 5090	3296a77d448a3027ead5767cd9e29cb3587af052
exp74	Decrease WEIGHT_DECAY from 0.08 to 0.06	1.064899	5.9	351216	21.0	3218	discard	The recent tweaks around weight decay (especially to slightly lower values) did 	NVIDIA GeForce RTX 5090	3296a77d448a3027ead5767cd9e29cb3587af052
exp75	Decrease WARMDOWN_RATIO from 0.65 to 0.6	1.064107	5.9	350883	21.0	3213	discard	Previous attempts to decrease WARMDOWN_RATIO showed slight worsening or no impro	NVIDIA GeForce RTX 5090	3296a77d448a3027ead5767cd9e29cb3587af052
exp76	Decrease FINAL_LR_FRAC from 0.04 to 0.02	1.064543	5.9	351000	21.0	3213	discard	Gradual decay to a slightly lower final learning rate may help consolidate gains	NVIDIA GeForce RTX 5090	3296a77d448a3027ead5767cd9e29cb3587af052
exp77	Decrease SCALAR_LR from 0.22 to 0.20	1.065025	5.9	350666	21.0	3211	discard	Several attempts to lower SCALAR_LR beyond 0.22 did not yield improvements, but 	NVIDIA GeForce RTX 5090	3296a77d448a3027ead5767cd9e29cb3587af052
exp78	Decrease EMBEDDING_LR from 0.36 to 0.32	1.065462	5.9	350883	21.0	3212	discard	The embedding learning rate has been decreased in prior experiments with some in	NVIDIA GeForce RTX 5090	3296a77d448a3027ead5767cd9e29cb3587af052
exp79	Decrease WEIGHT_DECAY from 0.08 to 0.07	1.064630	5.9	350000	20.9	3203	discard	Several minor reductions in WEIGHT_DECAY in similar ranges (to 0.075 and 0.07) w	NVIDIA GeForce RTX 5090	3296a77d448a3027ead5767cd9e29cb3587af052
exp80	Decrease MATRIX_LR from 0.025 to 0.022	1.066113	5.9	349333	20.9	3197	discard	Recent successful experiments achieved improvements by fine-tuning learning rate	NVIDIA GeForce RTX 5090	3296a77d448a3027ead5767cd9e29cb3587af052
exp81	Decrease WARMDOWN_RATIO from 0.65 to 0.6	1.064264	5.9	350883	21.0	3213	discard	The WARMDOWN_RATIO controls how quickly learning rates decay towards the end of 	NVIDIA GeForce RTX 5090	3296a77d448a3027ead5767cd9e29cb3587af052
exp82	Decrease SCALAR_LR from 0.22 to 0.20	1.064882	5.9	351333	21.0	3216	discard	The current SCALAR_LR (per-layer scalar Adam learning rate) has shown consistent	NVIDIA GeForce RTX 5090	3296a77d448a3027ead5767cd9e29cb3587af052
exp83	Decrease MATRIX_LR from 0.025 to 0.023	1.065874	5.9	350883	21.0	3215	discard	In recent experiments, small decreases in MATRIX_LR around this range have led t	NVIDIA GeForce RTX 5090	3296a77d448a3027ead5767cd9e29cb3587af052
exp84	Decrease WARMDOWN_RATIO from 0.65 to 0.6	1.064174	5.9	350883	21.0	3215	discard	Several prior experiments around WARMDOWN_RATIO indicate that values lower than 	NVIDIA GeForce RTX 5090	3296a77d448a3027ead5767cd9e29cb3587af052
exp85	Decrease SCALAR_LR from 0.22 to 0.21	1.064782	5.9	351000	21.0	3213	discard	Recent experiments indicate that lowering SCALAR_LR from higher values improved 	NVIDIA GeForce RTX 5090	3296a77d448a3027ead5767cd9e29cb3587af052
exp86	Decrease FINAL_LR_FRAC from 0.04 to 0.02	1.064559	5.9	351000	21.0	3214	discard	Since we have already improved results by increasing FINAL_LR_FRAC from 0.0 to 0	NVIDIA GeForce RTX 5090	3296a77d448a3027ead5767cd9e29cb3587af052
exp87	Decrease WARMDOWN_RATIO from 0.65 to 0.60	1.064142	5.9	351333	21.0	3216	discard	The previous attempts at reducing WARMDOWN_RATIO from 0.65 to 0.6 have slightly 	NVIDIA GeForce RTX 5090	3296a77d448a3027ead5767cd9e29cb3587af052
exp88	Decrease SCALAR_LR from 0.22 to 0.21	1.064379	5.9	351000	21.0	3214	discard	Previous attempts to decrease SCALAR_LR beyond 0.22 (such as to 0.20, 0.19, or l	NVIDIA GeForce RTX 5090	3296a77d448a3027ead5767cd9e29cb3587af052
exp89	Decrease DEVICE_BATCH_SIZE by approximately 5% to increase the number of gradient steps per fixed time.	0.000000	0.0	0	0.0	0	crash	training crashed or timed out	NVIDIA GeForce RTX 5090	3296a77d448a3027ead5767cd9e29cb3587af052
exp90	Increase MLP_RATIO from 3.2 to 3.4	1.064098	5.9	350883	21.0	3213	discard	The recent reduction of MLP_RATIO from 3.5 to 3.2 yielded the current best val_b	NVIDIA GeForce RTX 5090	3296a77d448a3027ead5767cd9e29cb3587af052
exp91	Decrease WARMDOWN_RATIO from 0.65 to 0.62	1.064026	5.9	351000	21.0	3215	discard	Several attempts to lower WARMDOWN_RATIO below 0.65 produced minor, inconsistent	NVIDIA GeForce RTX 5090	3296a77d448a3027ead5767cd9e29cb3587af052
exp92	Decrease SCALAR_LR from 0.22 to 0.20	1.064631	5.9	351000	21.0	3215	discard	Recent attempts to decrease SCALAR_LR below 0.22 have shown only slight increase	NVIDIA GeForce RTX 5090	3296a77d448a3027ead5767cd9e29cb3587af052
exp93	Decrease EMBEDDING_LR from 0.36 to 0.32	1.065330	5.9	351216	21.0	3216	discard	While previous reductions of EMBEDDING_LR to 0.32 were not effective when other 	NVIDIA GeForce RTX 5090	3296a77d448a3027ead5767cd9e29cb3587af052
exp94	Increase ASPECT_RATIO from 50 to 52.	1.063994	5.9	351000	21.0	3214	discard	Reducing ASPECT_RATIO from 52 to 50 yielded only a very small improvement, and d	NVIDIA GeForce RTX 5090	3296a77d448a3027ead5767cd9e29cb3587af052
