exp	description	val_bpb	peak_mem_gb	tok_sec	mfu	steps	status	notes	gpu_name	baseline_sha	watts	joules_per_token	total_energy_joules
exp82	Initialize resid_lambdas to 0.9 instead of 1.0 to weaken initial residual connections, acting as a deterministic form of stochastic depth that encourages shallower feature reuse early in training	1.100920	6.0	0	0.0	0	discard	kimi-k25-r1-controlled	NVIDIA GeForce RTX 5070 Ti	3fb6704	0.0	0.000000	0.0
exp83	Reduce value embedding gate channels from 32 to 16 to decrease gating capacity and increase regularization	1.095621	6.0	0	0.0	0	discard	kimi-k25-r1-controlled	NVIDIA GeForce RTX 5070 Ti	3fb6704	0.0	0.000000	0.0
exp84	Fix MLP double residual bug and add DropPath (stochastic depth) with 0.1 probability to residual connections	1.116815	6.5	0	0.0	0	discard	kimi-k25-r1-controlled	NVIDIA GeForce RTX 5070 Ti	3fb6704	0.0	0.000000	0.0
exp85	Add LayerDrop (stochastic layer dropping) with 0.1 probability to randomly skip transformer block computation during training, improving throughput for more steps and regularizing via depth variation	1.289336	11.6	0	0.0	0	discard	kimi-k25-r1-controlled	NVIDIA GeForce RTX 5070 Ti	3fb6704	0.0	0.000000	0.0
exp86	Add DropPath (stochastic depth) with 0.1 drop probability to residual connections in transformer blocks	1.134592	6.0	0	0.0	0	discard	kimi-k25-r1-controlled	NVIDIA GeForce RTX 5070 Ti	3fb6704	0.0	0.000000	0.0
exp87	Add DropPath (stochastic depth) regularization with 0.1 drop probability to residual connections in even-indexed transformer layers only (layers 0, 2, 4, ...) to test if regularizing alternating layers improves generalization over uniform application	1.127716	6.0	0	0.0	0	discard	kimi-k25-r1-controlled	NVIDIA GeForce RTX 5070 Ti	3fb6704	0.0	0.000000	0.0
exp88	Increase value embedding gate channels from 32 to 64 to enhance gating capacity for the ResFormer value residual stream	1.114635	6.0	0	0.0	0	discard	kimi-k25-r1-controlled	NVIDIA GeForce RTX 5070 Ti	3fb6704	0.0	0.000000	0.0
exp89	Maintain non-zero learning rate at end of training by setting FINAL_LR_FRAC to 0.1 instead of 0.0 to prevent premature convergence	1.103528	6.0	0	0.0	0	discard	kimi-k25-r1-controlled	NVIDIA GeForce RTX 5070 Ti	3fb6704	0.0	0.000000	0.0
exp90	Add scheduled Gaussian noise to gradients (std=0.0001*(1-progress)) after backward to improve generalization and escape sharp minima	1.570795	6.0	0	0.0	0	discard	kimi-k25-r1-controlled	NVIDIA GeForce RTX 5070 Ti	3fb6704	0.0	0.000000	0.0
exp91	Share value embeddings (ResFormer) across all transformer layers instead of having separate embeddings per layer. This reduces parameter count and acts as a regularization mechanism by forcing all layers to use the same value residual representation.	1.115430	5.8	0	0.0	0	discard	kimi-k25-r1-controlled	NVIDIA GeForce RTX 5070 Ti	3fb6704	0.0	0.000000	0.0
exp92	Add DropPath (stochastic depth) regularization with 0.1 drop probability to residual connections in transformer blocks to improve generalization	1.098172	6.0	0	0.0	0	discard	kimi-k25-r1-controlled	NVIDIA GeForce RTX 5070 Ti	3fb6704	0.0	0.000000	0.0
exp93	Reduce Muon momentum warmup duration from 500 to 200 steps to reach optimal momentum faster, allowing more training steps at high momentum within the 5-minute budget	1.133077	6.0	0	0.0	0	discard	kimi-k25-r1-controlled	NVIDIA GeForce RTX 5070 Ti	3fb6704	0.0	0.000000	0.0
exp94	Apply attention temperature scaling by multiplying queries by 1.25 after normalization to sharpen the attention distribution, encouraging more focused attention patterns and potentially improving generalization.	1.130290	6.0	0	0.0	0	discard	kimi-k25-r1-controlled	NVIDIA GeForce RTX 5070 Ti	3fb6704	0.0	0.000000	0.0
exp95	Align value embeddings optimizer betas with main embeddings by changing from (0.9, 0.999) to adam_betas (0.8, 0.95) for improved optimization consistency	1.157152	6.0	0	0.0	0	discard	kimi-k25-r1-controlled	NVIDIA GeForce RTX 5070 Ti	3fb6704	0.0	0.000000	0.0
exp96	Add DropPath (stochastic depth) regularization with 0.1 drop probability to the x0 residual connection (the per-layer addition of the initial embedding skip connection) to regularize the deep residual pathway	1.375569	11.6	0	0.0	0	discard	kimi-k25-r1-controlled	NVIDIA GeForce RTX 5070 Ti	3fb6704	0.0	0.000000	0.0
exp97	Add entropy regularization to the loss with coefficient 0.001 to encourage smoother output distributions and prevent overconfident predictions	1.090416	6.0	0	0.0	0	discard	kimi-k25-r1-controlled	NVIDIA GeForce RTX 5070 Ti	3fb6704	0.0	0.000000	0.0
exp98	Add DropPath (stochastic depth) with 0.1 probability to residual connections and apply light 0.01 dropout to MLP input after normalization to improve generalization beyond the current best	1.105854	6.1	0	0.0	0	discard	kimi-k25-r1-controlled	NVIDIA GeForce RTX 5070 Ti	3fb6704	0.0	0.000000	0.0
exp99	Disable z-loss regularization by zeroing its coefficient to reduce computational overhead and allow more gradient steps within the 5-minute budget	1.110936	6.0	0	0.0	0	discard	kimi-k25-r1-controlled	NVIDIA GeForce RTX 5070 Ti	3fb6704	0.0	0.000000	0.0
