exp	description	val_bpb	peak_mem_gb	tok_sec	mfu	steps	status	notes	gpu_name	baseline_sha	watts	joules_per_token	total_energy_joules
exp102	Increase EMA smoothing factor for train loss logging from 0.9 to 0.92 for more stable loss tracking, which may help adaptive schedules.	1.086959	6.0	0	0.0	0	discard	gpt41-r1-controlled	NVIDIA GeForce RTX 5070 Ti	3fb6704	0.0	0.0	0.0
exp103	Increase the initial value of x0_lambdas to 0.12 for slightly more direct input residual mixing at each layer.	1.091767	6.0	0	0.0	0	discard	gpt41-r1-controlled	NVIDIA GeForce RTX 5070 Ti	3fb6704	0.0	0.0	0.0
exp104	Add small normal noise (std=0.01) to all MLP c_proj weights after zero initialization in init_weights to encourage better gradient flow.	1.119664	6.0	0	0.0	0	discard	gpt41-r1-controlled	NVIDIA GeForce RTX 5070 Ti	3fb6704	0.0	0.0	0.0
exp105	Add small normal noise (std=0.01) to all MLP c_fc biases after zero initialization in init_weights to encourage better early neuron activation and gradient flow. [Traceback (most recent call last):	0.000000	0.0	0	0.0	0	crash	gpt41-r1-controlled	NVIDIA GeForce RTX 5070 Ti	3fb6704	0.0	0.0	0.0
exp106		0.000000	0.0	0	0.0	0	skip	gpt41-r1-controlled	NVIDIA GeForce RTX 5070 Ti	3fb6704	0.0	0.0	0.0
exp107		0.000000	0.0	0	0.0	0	skip	gpt41-r1-controlled	NVIDIA GeForce RTX 5070 Ti	3fb6704	0.0	0.0	0.0
exp108	Add small weight decay (0.001) to the x0_lambdas parameter group for additional regularization.	1.080401	6.0	0	0.0	0	discard	gpt41-r1-controlled	NVIDIA GeForce RTX 5070 Ti	3fb6704	0.0	0.0	0.0
exp109	Increase the MLP residual connection scaling factor from 1.2 (previous best) to 1.25 for potentially even stronger MLP updates.	1.101731	6.0	0	0.0	0	discard	gpt41-r1-controlled	NVIDIA GeForce RTX 5070 Ti	3fb6704	0.0	0.0	0.0
exp110	Increase the EMA smoothing factor for train loss logging to 0.96 for more stable loss tracking and potentially better adaptive schedule response.	1.081793	6.0	0	0.0	0	discard	gpt41-r1-controlled	NVIDIA GeForce RTX 5070 Ti	3fb6704	0.0	0.0	0.0
exp111	Increase MLP hidden size multiplier from 4x to 4.75x for more capacity without changing normalization.	1.098787	6.4	0	0.0	0	discard	gpt41-r1-controlled	NVIDIA GeForce RTX 5070 Ti	3fb6704	0.0	0.0	0.0
exp112	Add small normal noise (std=0.01) to all MLP c_fc weights after uniform init in init_weights to encourage better gradient flow and neuron activation.	1.096848	6.0	0	0.0	0	discard	gpt41-r1-controlled	NVIDIA GeForce RTX 5070 Ti	3fb6704	0.0	0.0	0.0
exp113	Increase the EMA smoothing factor for train loss logging to 0.94 for more stable loss tracking, which may help schedule adaptation.	1.081165	6.0	0	0.0	0	discard	gpt41-r1-controlled	NVIDIA GeForce RTX 5070 Ti	3fb6704	0.0	0.0	0.0
exp114	Increase the initial value of x0_lambdas from 0.1 to 0.2 for stronger input residual mixing at each layer.	1.079794	6.0	0	0.0	0	discard	gpt41-r1-controlled	NVIDIA GeForce RTX 5070 Ti	3fb6704	0.0	0.0	0.0
exp115	Increase the proportion of long attention layers by changing the window pattern from SSSL to SSL.	1.081883	6.0	0	0.0	0	discard	gpt41-r1-controlled	NVIDIA GeForce RTX 5070 Ti	3fb6704	0.0	0.0	0.0
exp116	Increase the MLP residual connection scaling factor from 1.2 (previous best) to 1.25 for even stronger MLP updates.	1.100828	6.0	0	0.0	0	discard	gpt41-r1-controlled	NVIDIA GeForce RTX 5070 Ti	3fb6704	0.0	0.0	0.0
exp117	Increase the MLP hidden size multiplier from 4x to 4.25x for increased capacity without changing normalization or causing recompilation.	1.088525	6.1	0	0.0	0	discard	gpt41-r1-controlled	NVIDIA GeForce RTX 5070 Ti	3fb6704	0.0	0.0	0.0
exp118	Switch the MLP activation from relu^2 to squared leaky_relu (with negative_slope=0.01) for improved gradient flow and reduced dead neurons.	1.081889	6.0	0	0.0	0	discard	gpt41-r1-controlled	NVIDIA GeForce RTX 5070 Ti	3fb6704	0.0	0.0	0.0
# test trigger — verify CI workflow fires
