exp	description	val_bpb	peak_mem_gb	tok_sec	mfu	steps	status	notes	gpu_name	baseline_sha	watts	joules_per_token	total_energy_joules
exp83	Use parallel attention and MLP blocks (PaLM/GPT-J style) to reduce normalization operations and increase training throughput, allowing more optimization steps within the 5-minute budget	1.090523	5.5	0	0.0	0	discard	controlled-kimi-k25-r2-controlled	NVIDIA GeForce RTX 5070 Ti	7ad22e5	0.0	0.000000	0.0
exp84	Reduce token embedding weight decay from 0.001 to 0.0005 for less aggressive regularization on the wide model's embeddings during short training	1.083882	6.0	0	0.0	0	discard	controlled-kimi-k25-r2-controlled	NVIDIA GeForce RTX 5070 Ti	7ad22e5	0.0	0.000000	0.0
exp85	FAILED TO APPLY: Apply layer-wise learning rate decay to Muon optimizer: use 0.9x learning rate for deeper transformer layers (second half of model) compared to early layers to stabilize training of higher-level representations	0.000000	0.0	0	0.0	0	crash	controlled-kimi-k25-r2-controlled	NVIDIA GeForce RTX 5070 Ti	7ad22e5	0.0	0.000000	0.0
exp86	Set FINAL_LR_FRAC to 0.05 to maintain small but non-zero learning rate updates at the end of training, potentially improving final convergence beyond the current best	1.075750	6.0	0	0.0	0	discard	controlled-kimi-k25-r2-controlled	NVIDIA GeForce RTX 5070 Ti	7ad22e5	0.0	0.000000	0.0
exp87	Replace standard cross-entropy with focal loss (gamma=2) to focus training on hard examples, which may improve sample efficiency during the short 5-minute training window	0.997218	7.0	0	0.0	0	discard	controlled-kimi-k25-r2-controlled	NVIDIA GeForce RTX 5070 Ti	7ad22e5	0.0	0.000000	0.0
exp88	Add depth-scaled residual connections by scaling attention and MLP residual branches by 1/sqrt(n_layer) to improve gradient flow and training stability in deep networks	1.151683	6.0	0	0.0	0	discard	controlled-kimi-k25-r2-controlled	NVIDIA GeForce RTX 5070 Ti	7ad22e5	0.0	0.000000	0.0
exp89	Combine optimal narrow configuration (ASPECT_RATIO=32, 3x MLP expansion, SS window pattern) with removal of deep residual connection (x0_lambdas=0.0) to maximize training steps and improve gradient flow [File "/home/pat/autoresearch/.venv/lib/python3.12/site-packages/torch/_prims_common/wrappers.py", li]	0.000000	0.0	0	0.0	0	crash	controlled-kimi-k25-r2-controlled	NVIDIA GeForce RTX 5070 Ti	7ad22e5	0.0	0.000000	0.0
exp90	Initialize resid_lambdas to 0.9 instead of 1.0 to weaken initial residual connection strength, combining with the current best x0_lambdas=0.0 configuration for improved gradient flow	1.088285	6.0	0	0.0	0	discard	controlled-kimi-k25-r2-controlled	NVIDIA GeForce RTX 5070 Ti	7ad22e5	0.0	0.000000	0.0
exp91	Add stochastic depth (layer dropout) with 10% probability to each transformer block for regularization, improving gradient flow and generalization in the deep 12-layer narrow configuration	1.266619	11.6	0	0.0	0	discard	controlled-kimi-k25-r2-controlled	NVIDIA GeForce RTX 5070 Ti	7ad22e5	0.0	0.000000	0.0
exp92	Set logit softcap to 15 for slightly sharper predictions while maintaining training stability	1.080102	6.0	0	0.0	0	discard	controlled-kimi-k25-r2-controlled	NVIDIA GeForce RTX 5070 Ti	7ad22e5	0.0	0.000000	0.0
exp93	Remove weight decay on value embeddings (set to 0.0) to reduce regularization on residual connection parameters, potentially allowing faster adaptation of value residual paths	1.083916	6.0	0	0.0	0	discard	controlled-kimi-k25-r2-controlled	NVIDIA GeForce RTX 5070 Ti	7ad22e5	0.0	0.000000	0.0
exp94	Increase attention heads in wide config: change HEAD_DIM from 128 to 96 (8 heads instead of 6) for better representational capacity without increasing FLOPs or memory, building on the current best wide configuration	1.188016	6.7	0	0.0	0	discard	controlled-kimi-k25-r2-controlled	NVIDIA GeForce RTX 5070 Ti	7ad22e5	0.0	0.000000	0.0
exp95	Initialize attention and MLP output projection weights (c_proj) with small normal distribution (std=0.02) instead of zeros to improve initial gradient flow and signal propagation	1.094298	6.0	0	0.0	0	discard	controlled-kimi-k25-r2-controlled	NVIDIA GeForce RTX 5070 Ti	7ad22e5	0.0	0.000000	0.0
exp96	Apply optimal narrow configuration (ASPECT_RATIO=32, 3x MLP, SS window) with x0_lambdas=0.0 and align value embeddings AdamW betas to (0.8, 0.95) for faster residual adaptation	0.963668	2.9	0	0.0	0	discard	controlled-kimi-k25-r2-controlled	NVIDIA GeForce RTX 5070 Ti	7ad22e5	0.0	0.000000	0.0
exp97	Combine best residual settings: remove deep residual (x0_lambdas=0.0) and weaken main residual (resid_lambdas=0.9) for improved gradient flow	1.060014	6.0	0	0.0	0	discard	controlled-kimi-k25-r2-controlled	NVIDIA GeForce RTX 5070 Ti	7ad22e5	0.0	0.000000	0.0
exp98	Switch to SS window pattern (all short-window layers except last) and remove deep residual connection (x0_lambdas=0.0) to maximize training throughput with the wide model configuration, allowing significantly more optimization steps within the 5-minute budget while maintaining effective capacity	1.107938	6.0	0	0.0	0	discard	controlled-kimi-k25-r2-controlled	NVIDIA GeForce RTX 5070 Ti	7ad22e5	0.0	0.000000	0.0
exp99	Align value embeddings AdamW betas with other AdamW parameters (0.8, 0.95) instead of (0.9, 0.999) for faster adaptation of residual connections in the wide configuration	1.080931	6.0	0	0.0	0	discard	controlled-kimi-k25-r2-controlled	NVIDIA GeForce RTX 5070 Ti	7ad22e5	0.0	0.000000	0.0
