exp	description	val_bpb	peak_mem_gb	tok_sec	mfu	steps	status	notes	gpu_name	baseline_sha	watts	joules_per_token	total_energy_joules
exp82	Implement scheduled focal loss gamma that anneals linearly from 2.0 to 3.0 during training to gradually increase focus on hard examples while maintaining stable early optimization [Traceback (most recent call last):	0.000000	0.0	0	0.0	0	crash	kimi-k25-r3-controlled	NVIDIA GeForce RTX 5070 Ti	3fb6704	0.0	0.000000	0.0
exp83	Combine focal loss (gamma=2.5) with optimal residual initialization (resid_lambdas=0.8, x0_lambdas=0.2) and double learning rate for token embeddings (1.2) to maximize convergence speed	0.972331	7.0	0	0.0	0	keep	kimi-k25-r3-controlled	NVIDIA GeForce RTX 5070 Ti	3fb6704	0.0	0.000000	0.0
exp84	Initialize value embedding gate weights to 1.0 instead of 0.0 for moderate initial gating strength (~1.46) between neutral (1.0) and the previously tested 2.0 (~1.76)	0.979754	7.0	0	0.0	0	discard	kimi-k25-r3-controlled	NVIDIA GeForce RTX 5070 Ti	3fb6704	0.0	0.000000	0.0
exp85	Reduce WARMDOWN_RATIO from 0.5 to 0.25 to spend 75% of the training time at maximum learning rate instead of 50%, allowing more optimization steps at full LR before cooldown in the short 5-minute window.	1.063666	6.0	0	0.0	0	discard	kimi-k25-r3-controlled	NVIDIA GeForce RTX 5070 Ti	3fb6704	0.0	0.000000	0.0
exp86	Add a learnable bias term to the language modeling head (lm_head) and initialize it to zero, giving the model an adjustable per-token logit offset that can improve optimization flexibility.	1.087328	6.0	0	0.0	0	discard	kimi-k25-r3-controlled	NVIDIA GeForce RTX 5070 Ti	3fb6704	0.0	0.000000	0.0
exp87	Remove weight decay from residual path scalars (resid_lambdas) by setting weight_decay=0.0, allowing the residual weights to adapt freely without regularization pulling them toward zero	1.082663	6.0	0	0.0	0	discard	kimi-k25-r3-controlled	NVIDIA GeForce RTX 5070 Ti	3fb6704	0.0	0.000000	0.0
exp88	Combine focal loss (gamma=2.5) with optimal residual initialization (resid_lambdas=0.8, x0_lambdas=0.2), double learning rate for token embeddings (1.2), and initialize VE gate weights to 1.0 for moderate initial gating strength	0.968240	7.0	0	0.0	0	keep	kimi-k25-r3-controlled	NVIDIA GeForce RTX 5070 Ti	3fb6704	0.0	0.000000	0.0
exp89	Detach probability values (p_t) in focal loss to treat focal weights as constants during backprop, stabilizing gradients through the confidence weighting term	0.970632	6.0	0	0.0	0	discard	kimi-k25-r3-controlled	NVIDIA GeForce RTX 5070 Ti	3fb6704	0.0	0.000000	0.0
exp90	Implement focal loss (gamma=2.5) with temperature-scaled probabilities (T=0.8) for confidence weighting, combined with optimal residual initialization (resid_lambdas=0.8, x0_lambdas=0.2), doubled token embedding LR (1.2), and VE gate weight initialization of 1.0	0.957437	6.0	0	0.0	0	keep	kimi-k25-r3-controlled	NVIDIA GeForce RTX 5070 Ti	3fb6704	0.0	0.000000	0.0
exp91	Remove torch.no_grad() from focal loss computation to allow gradients to flow through the focal weighting term (p_t), improving optimization signal	0.945984	8.0	0	0.0	0	keep	kimi-k25-r3-controlled	NVIDIA GeForce RTX 5070 Ti	3fb6704	0.0	0.000000	0.0
exp92	Implement curriculum learning for sequence length: start with 512 tokens and linearly increase to MAX_SEQ_LEN over the first 50% of training time. This allows faster iterations early in training (more optimizer steps within the 5-minute budget) while still utilizing full context later for long-range dependency learning. [^^^^^^^^^^^^^^^^^^^^^^^^^^^^^^^^^^^^^^^^^^^^^^	0.000000	0.0	0	0.0	0	crash	kimi-k25-r3-controlled	NVIDIA GeForce RTX 5070 Ti	3fb6704	0.0	0.000000	0.0
exp93	Add 10% dropout to attention weights in scaled_dot_product_attention to regularize attention patterns during training	1.099283	6.0	0	0.0	0	discard	kimi-k25-r3-controlled	NVIDIA GeForce RTX 5070 Ti	3fb6704	0.0	0.000000	0.0
exp94	Implement focal loss with gamma=3.0 to sharpen focus on hard-to-predict tokens beyond the gamma=2.5 baseline, allowing gradients to flow through the focal weighting term (p_t) as in the best-performing configuration	0.970378	7.0	0	0.0	0	discard	kimi-k25-r3-controlled	NVIDIA GeForce RTX 5070 Ti	3fb6704	0.0	0.000000	0.0
exp95	Implement focal loss with gamma=2.5, allowing gradients to flow through the focal weighting term (p_t) without detaching. This focuses training on hard examples while maintaining gradient flow through the probability calculation. [File "/home/pat/autoresearch/.venv/lib/python3.12/site-packages/torch/_subclasses/fake_tensor.py", l]	0.000000	0.0	0	0.0	0	crash	kimi-k25-r3-controlled	NVIDIA GeForce RTX 5070 Ti	3fb6704	0.0	0.000000	0.0
exp96	Combine focal loss (gamma=2.5, no detach) with optimal deep residual initialization (resid_lambdas=0.8, x0_lambdas=0.2) and moderate VE gate initialization (1.0)	0.965285	7.0	0	0.0	0	discard	kimi-k25-r3-controlled	NVIDIA GeForce RTX 5070 Ti	3fb6704	0.0	0.000000	0.0
exp97	Apply gradient centralization by subtracting the mean from each parameter's gradient before the optimizer step, which improves training stability and convergence speed.	1.059736	6.0	0	0.0	0	discard	kimi-k25-r3-controlled	NVIDIA GeForce RTX 5070 Ti	3fb6704	0.0	0.000000	0.0
exp98	Use half sequence length (1024) to accelerate attention computation and fit more optimizer steps within the 5-minute budget [^^^^^^^^^^^^^^^^^^^^^^^^^^^^^^^^^^^^^^^^^^^^^^	0.000000	0.0	0	0.0	0	crash	kimi-k25-r3-controlled	NVIDIA GeForce RTX 5070 Ti	3fb6704	0.0	0.000000	0.0
exp99	Add 5% dropout to MLP intermediate activations (after ReLU^2) for regularization	1.089443	6.5	0	0.0	0	discard	kimi-k25-r3-controlled	NVIDIA GeForce RTX 5070 Ti	3fb6704	0.0	0.000000	0.0
