exp	description	val_bpb	peak_mem_gb	tok_sec	mfu	steps	status	notes	gpu_name	baseline_sha
exp0	baseline (no modifications)	1.124399	89.2	155252	8.0	356	baseline	depth=12, AMD Instinct MI300X	AMD Instinct MI300X	c3182ef04f2b2ac03006f1013655a091a2d56c39
exp1	Decrease DEVICE_BATCH_SIZE from default to 8 to increase gradient steps	1.161083	12.7	119427	6.1	274	discard	The baseline achieved only 356 steps in 5 minutes. Since maximizing gradient ste	AMD Instinct MI300X	c3182ef04f2b2ac03006f1013655a091a2d56c39
exp2	Decrease DEVICE_BATCH_SIZE from default to 16 to increase gradient steps	1.144123	23.6	134596	6.9	309	discard	The baseline achieved better val_bpb than the aggressive reduction to batch size	AMD Instinct MI300X	c3182ef04f2b2ac03006f1013655a091a2d56c39
exp3	Increase MATRIX_LR from 0.04 to 0.06	1.124780	89.2	154587	7.9	355	discard	The baseline performed best so far, suggesting the default batch sizes are well-	AMD Instinct MI300X	c3182ef04f2b2ac03006f1013655a091a2d56c39
exp4	Decrease MATRIX_LR from 0.04 to 0.02	1.139904	89.2	154896	7.9	355	discard	The baseline performed best so far, and increasing MATRIX_LR to 0.06 hurt perfor	AMD Instinct MI300X	c3182ef04f2b2ac03006f1013655a091a2d56c39
exp5	Increase SCALAR_LR from 0.5 to 0.7	1.134084	89.2	154742	7.9	355	discard	The baseline performed best so far, suggesting the current hyperparameters are w	AMD Instinct MI300X	c3182ef04f2b2ac03006f1013655a091a2d56c39
exp6	Decrease EMBEDDING_LR from 0.6 to 0.4	1.124881	89.2	155252	8.0	356	discard	The embedding layer is critical for token representation learning, and the curre	AMD Instinct MI300X	c3182ef04f2b2ac03006f1013655a091a2d56c39
exp7	Increase WARMUP_RATIO from 0.0 to 0.1	1.131030	89.2	154948	7.9	355	discard	The baseline has no learning rate warmup, but a gradual warmup can help stabiliz	AMD Instinct MI300X	c3182ef04f2b2ac03006f1013655a091a2d56c39
exp8	Decrease WARMDOWN_RATIO from 0.5 to 0.3	1.129106	89.2	155304	8.0	356	discard	The baseline is still best, suggesting the default learning rate schedule might 	AMD Instinct MI300X	c3182ef04f2b2ac03006f1013655a091a2d56c39
exp9	Increase DEPTH from default to 14 to improve model capacity	1.142115	115.5	117647	9.1	270	discard	All learning rate and batch size experiments have failed to improve on baseline.	AMD Instinct MI300X	c3182ef04f2b2ac03006f1013655a091a2d56c39
exp10	Decrease WEIGHT_DECAY from 0.2 to 0.1	1.125707	89.2	154742	7.9	355	discard	All learning rate modifications have failed to improve upon the baseline. Weight	AMD Instinct MI300X	c3182ef04f2b2ac03006f1013655a091a2d56c39
exp11	Increase EMBEDDING_LR from 0.6 to 0.8	1.129501	89.2	154742	7.9	355	discard	The baseline is still the best performer, suggesting the current hyperparameters	AMD Instinct MI300X	c3182ef04f2b2ac03006f1013655a091a2d56c39
exp12	Decrease UNEMBEDDING_LR from 0.004 to 0.002	1.133395	89.2	155304	8.0	356	discard	The unembedding layer (lm_head) is critical for final predictions, and its learn	AMD Instinct MI300X	c3182ef04f2b2ac03006f1013655a091a2d56c39
exp13	Increase UNEMBEDDING_LR from 0.004 to 0.006	1.128292	89.2	154793	7.9	355	discard	The unembedding layer (lm_head) is crucial for final predictions and may benefit	AMD Instinct MI300X	c3182ef04f2b2ac03006f1013655a091a2d56c39
exp14	Change ADAM_BETAS from (0.8, 0.95) to (0.9, 0.95)	1.130817	89.2	155355	8.0	356	discard	The current beta1 of 0.8 is quite low compared to typical values (0.9). Higher b	AMD Instinct MI300X	c3182ef04f2b2ac03006f1013655a091a2d56c39
exp15	Change ADAM_BETAS from (0.8, 0.95) to (0.9, 0.999)	1.134090	89.2	154845	7.9	355	discard	The baseline's Adam beta values are quite unusual - typically beta2 is closer to	AMD Instinct MI300X	c3182ef04f2b2ac03006f1013655a091a2d56c39
exp16	Change WINDOW_PATTERN from "SSSL" to "SSSS" to reduce attention complexity	1.129649	89.2	151031	7.5	346	discard	The current pattern "SSSL" includes full attention layers (L) which are computat	AMD Instinct MI300X	c3182ef04f2b2ac03006f1013655a091a2d56c39
exp17	Decrease FINAL_LR_FRAC from 0.0 to 0.1 to maintain higher learning rates late in training	1.122091	89.2	155000	8.0	355	keep	The baseline uses a complete learning rate decay to 0.0, but maintaining a small	AMD Instinct MI300X	c3182ef04f2b2ac03006f1013655a091a2d56c39
exp18	Increase HEAD_DIM from 128 to 160 to improve attention capacity	1.129093	92.2	136922	7.5	314	discard	The current best experiment (exp17) improved val_bpb by adjusting the learning r	AMD Instinct MI300X	c3182ef04f2b2ac03006f1013655a091a2d56c39
exp19	Decrease FINAL_LR_FRAC from 0.1 to 0.05 to maintain even higher learning rates in the final phase	1.122495	89.2	154845	7.9	355	discard	The improvement from exp17 (setting FINAL_LR_FRAC to 0.1) suggests that maintain	AMD Instinct MI300X	c3182ef04f2b2ac03006f1013655a091a2d56c39
exp20	Decrease ASPECT_RATIO from 64 to 48 to reduce model width and allow for more gradient steps	1.103874	76.9	187749	7.1	430	keep	With many learning rate experiments showing minimal improvement, I should try ar	AMD Instinct MI300X	c3182ef04f2b2ac03006f1013655a091a2d56c39
exp21	Decrease ASPECT_RATIO from 48 to 40 to further reduce model width and allow for even more gradient steps	1.096058	64.6	235685	6.1	540	keep	The most successful experiment (exp20) reduced ASPECT_RATIO from 64 to 48, achie	AMD Instinct MI300X	c3182ef04f2b2ac03006f1013655a091a2d56c39
exp22	Decrease ASPECT_RATIO from 40 to 32 to further reduce model width and allow for even more gradient steps	1.095388	52.4	309666	5.1	709	keep	The trend is clear - decreasing ASPECT_RATIO has consistently improved val_bpb b	AMD Instinct MI300X	c3182ef04f2b2ac03006f1013655a091a2d56c39
exp23	Decrease ASPECT_RATIO from 32 to 28 to further reduce model width and allow for even more gradient steps	1.095080	52.4	310023	5.1	710	keep	The clear trend shows that reducing ASPECT_RATIO consistently improves val_bpb b	AMD Instinct MI300X	c3182ef04f2b2ac03006f1013655a091a2d56c39
exp24	Decrease ASPECT_RATIO from 28 to 24 to further reduce model width and allow for even more gradient steps	1.095152	52.4	310126	5.1	710	discard	The trend from exp20-exp23 shows consistent improvement by decreasing ASPECT_RAT	AMD Instinct MI300X	c3182ef04f2b2ac03006f1013655a091a2d56c39
exp25	Decrease ASPECT_RATIO from 28 to 26 to further reduce model width and allow for even more gradient steps	1.095311	52.4	310126	5.1	710	discard	The trend shows consistent improvement as ASPECT_RATIO decreases from 64→48→40→3	AMD Instinct MI300X	c3182ef04f2b2ac03006f1013655a091a2d56c39
exp26	Increase DEPTH from default to 14 to improve model capacity while maintaining current ASPECT_RATIO=28	1.104997	72.6	206127	6.2	472	discard	With ASPECT_RATIO optimized at 28, we now have room to increase model depth for 	AMD Instinct MI300X	c3182ef04f2b2ac03006f1013655a091a2d56c39
exp27	Increase HEAD_DIM from 128 to 96 to reduce attention computation while maintaining model quality	1.099568	52.4	305592	5.0	700	discard	The experiments show that reducing model width (ASPECT_RATIO) has been very effe	AMD Instinct MI300X	c3182ef04f2b2ac03006f1013655a091a2d56c39
exp28	Decrease HEAD_DIM from 128 to 112 to reduce attention computation overhead while maintaining model quality	1.120326	47.9	266911	3.5	611	discard	The current best configuration has ASPECT_RATIO=28 yielding 710 gradient steps. 	AMD Instinct MI300X	c3182ef04f2b2ac03006f1013655a091a2d56c39
exp29	Increase HEAD_DIM from 128 to 144 to improve attention capacity while maintaining efficient computation	1.112753	57.0	238587	4.7	546	discard	The experiments show that reducing ASPECT_RATIO to 28 gave the best performance 	AMD Instinct MI300X	c3182ef04f2b2ac03006f1013655a091a2d56c39
exp30	Change WINDOW_PATTERN from "SSSL" to "LLLL" to use full attention everywhere and potentially improve model quality	1.080123	52.4	371542	7.3	851	keep	The current best configuration (exp23) uses ASPECT_RATIO=28 with WINDOW_PATTERN=	AMD Instinct MI300X	c3182ef04f2b2ac03006f1013655a091a2d56c39
exp31	Decrease HEAD_DIM from 128 to 64 to reduce attention computation overhead and allow for more gradient steps	1.088479	52.4	368210	7.2	843	discard	The current best result (exp30) uses full attention everywhere with ASPECT_RATIO	AMD Instinct MI300X	c3182ef04f2b2ac03006f1013655a091a2d56c39
exp32	Decrease ASPECT_RATIO from 28 to 30 to slightly increase model width while maintaining efficient gradient steps	1.080072	52.4	372085	7.3	852	keep	The current best result (1.0801) uses ASPECT_RATIO=28 with WINDOW_PATTERN="LLLL"	AMD Instinct MI300X	c3182ef04f2b2ac03006f1013655a091a2d56c39
exp33	Increase ASPECT_RATIO from 30 to 32 to further increase model width while maintaining high gradient step count	1.079942	52.4	372085	7.3	852	keep	The trend from exp21-23 showed decreasing val_bpb as ASPECT_RATIO decreased from	AMD Instinct MI300X	c3182ef04f2b2ac03006f1013655a091a2d56c39
exp34	Increase ASPECT_RATIO from 32 to 34 to further increase model width while maintaining high gradient step count	1.078536	64.6	279294	8.5	640	keep	The trend from exp30-33 shows consistent improvement as ASPECT_RATIO increases f	AMD Instinct MI300X	c3182ef04f2b2ac03006f1013655a091a2d56c39
exp35	Increase ASPECT_RATIO from 34 to 36 to further increase model width while maintaining high gradient step count	1.078820	64.6	279147	8.5	639	discard	The trend shows consistent improvement as ASPECT_RATIO increased from 28→30→32→3	AMD Instinct MI300X	c3182ef04f2b2ac03006f1013655a091a2d56c39
exp36	Increase ASPECT_RATIO from 34 to 35 to further increase model width while maintaining high gradient step count	1.078416	64.6	279480	8.5	640	keep	The trend shows consistent improvement as we increased ASPECT_RATIO from 32→34, 	AMD Instinct MI300X	c3182ef04f2b2ac03006f1013655a091a2d56c39
exp37	Increase ASPECT_RATIO from 35 to 36 to further increase model width while maintaining high gradient step count	1.078355	64.6	279480	8.5	640	keep	The trend shows consistent improvement as ASPECT_RATIO increased from 32 (1.0799	AMD Instinct MI300X	c3182ef04f2b2ac03006f1013655a091a2d56c39
exp38	Increase ASPECT_RATIO from 36 to 37 to further increase model width while maintaining high gradient step count	1.078602	64.6	279054	8.5	639	discard	The trend from exp34-37 shows consistent improvement in val_bpb as ASPECT_RATIO 	AMD Instinct MI300X	c3182ef04f2b2ac03006f1013655a091a2d56c39
exp39	Decrease WARMDOWN_RATIO from 0.5 to 0.4 to maintain higher learning rates for more of the training	1.080063	64.6	279333	8.5	639	discard	The current best configuration has found a good balance between model capacity a	AMD Instinct MI300X	c3182ef04f2b2ac03006f1013655a091a2d56c39
exp40	Decrease WEIGHT_DECAY from 0.2 to 0.15	1.078161	64.6	279333	8.5	639	keep	With the current optimal architecture (ASPECT_RATIO=36, DEPTH=12, HEAD_DIM=128, 	AMD Instinct MI300X	c3182ef04f2b2ac03006f1013655a091a2d56c39
exp41	Decrease WEIGHT_DECAY from 0.15 to 0.1	1.078066	64.6	279387	8.5	640	keep	The recent improvement from reducing weight decay from 0.2 to 0.15 suggests that	AMD Instinct MI300X	c3182ef04f2b2ac03006f1013655a091a2d56c39
exp42	Decrease WEIGHT_DECAY from 0.1 to 0.05	1.078217	64.6	279534	8.5	641	discard	The trend from exp40-41 shows that reducing weight decay from 0.2 to 0.15 to 0.1	AMD Instinct MI300X	c3182ef04f2b2ac03006f1013655a091a2d56c39
exp43	Increase MATRIX_LR from 0.04 to 0.05	1.078750	64.6	279627	8.5	641	discard	The current best configuration has WEIGHT_DECAY=0.1 and ASPECT_RATIO=36, achievi	AMD Instinct MI300X	c3182ef04f2b2ac03006f1013655a091a2d56c39
exp44	Decrease MATRIX_LR from 0.04 to 0.035	1.079087	64.6	279054	8.5	639	discard	The current best configuration has ASPECT_RATIO=36, WEIGHT_DECAY=0.1, and MATRIX	AMD Instinct MI300X	c3182ef04f2b2ac03006f1013655a091a2d56c39
exp45	Increase SCALAR_LR from 0.5 to 0.6	1.078075	64.6	279387	8.5	640	discard	The current best configuration has optimized model size and weight decay, but sc	AMD Instinct MI300X	c3182ef04f2b2ac03006f1013655a091a2d56c39
exp46	Increase EMBEDDING_LR from 0.6 to 0.7	1.078447	64.6	279387	8.5	640	discard	The current best configuration has WEIGHT_DECAY=0.1 and ASPECT_RATIO=36. Since w	AMD Instinct MI300X	c3182ef04f2b2ac03006f1013655a091a2d56c39
exp47	Decrease UNEMBEDDING_LR from 0.004 to 0.003	1.079405	64.6	279627	8.5	641	discard	The current best configuration has optimal ASPECT_RATIO=36, DEPTH=12, WEIGHT_DEC	AMD Instinct MI300X	c3182ef04f2b2ac03006f1013655a091a2d56c39
exp48	Increase UNEMBEDDING_LR from 0.004 to 0.005	1.078947	64.6	279294	8.5	640	discard	The current best configuration has val_bpb=1.078066 with WEIGHT_DECAY=0.1. Since	AMD Instinct MI300X	c3182ef04f2b2ac03006f1013655a091a2d56c39
exp49	Change ADAM_BETAS from (0.8, 0.95) to (0.9, 0.99)	1.081614	64.6	279294	8.5	640	discard	The current best configuration uses WEIGHT_DECAY=0.1 with ASPECT_RATIO=36. Since	AMD Instinct MI300X	c3182ef04f2b2ac03006f1013655a091a2d56c39
exp50	Decrease WARMDOWN_RATIO from 0.5 to 0.2 to maintain higher learning rates longer	1.084880	64.6	279666	8.5	640	discard	The current best configuration has found a good balance of model size and optimi	AMD Instinct MI300X	c3182ef04f2b2ac03006f1013655a091a2d56c39
exp51	Increase HEAD_DIM from 128 to 120 to reduce attention computation while maintaining model quality	1.100728	61.5	243252	6.7	557	discard	The current best model (exp41) has found a good balance with ASPECT_RATIO=36 and	AMD Instinct MI300X	c3182ef04f2b2ac03006f1013655a091a2d56c39
exp52	Increase WARMUP_RATIO from 0.0 to 0.05 to allow gradual ramp-up of learning rates	1.085604	64.6	279294	8.5	640	discard	The current best configuration has no warmup, which can cause instability in ear	AMD Instinct MI300X	c3182ef04f2b2ac03006f1013655a091a2d56c39
exp53	Decrease HEAD_DIM from 128 to 112 to reduce attention computation overhead and allow for more gradient steps	1.099292	58.5	256914	6.3	588	discard	The current best configuration has 640 gradient steps. Previous experiments show	AMD Instinct MI300X	c3182ef04f2b2ac03006f1013655a091a2d56c39
exp54	Decrease HEAD_DIM from 128 to 64 to significantly reduce attention computation overhead and allow for more gradient steps	1.086498	58.5	317576	7.8	728	discard	The current best configuration has ASPECT_RATIO=36 and HEAD_DIM=128, achieving 6	AMD Instinct MI300X	c3182ef04f2b2ac03006f1013655a091a2d56c39
exp55	Change WINDOW_PATTERN from "LLLL" to "LSLS" to reduce attention computation while maintaining some full attention layers	1.089689	64.6	252000	7.0	577	discard	The current best configuration uses full attention everywhere ("LLLL"), but this	AMD Instinct MI300X	c3182ef04f2b2ac03006f1013655a091a2d56c39
exp56	Increase HEAD_DIM from 128 to 144 to improve attention capacity while staying below the current best configuration's compute cost	1.093099	56.9	292902	6.8	671	discard	Previous experiments showed HEAD_DIM=144 (exp29) achieved 1.1128 val_bpb with 54	AMD Instinct MI300X	c3182ef04f2b2ac03006f1013655a091a2d56c39
exp57	Increase ASPECT_RATIO from 36 to 38 to further increase model width while maintaining high gradient step count	1.078072	64.6	279294	8.5	640	discard	The trend shows steady improvement as we increased ASPECT_RATIO from 32→34→35→36	AMD Instinct MI300X	c3182ef04f2b2ac03006f1013655a091a2d56c39
exp58	Decrease ASPECT_RATIO from 36 to 35 to slightly reduce model width and potentially allow for more gradient steps	1.078260	64.6	279294	8.5	640	discard	The current best configuration has ASPECT_RATIO=36, but we see from exp36 that A	AMD Instinct MI300X	c3182ef04f2b2ac03006f1013655a091a2d56c39
exp59	Increase HEAD_DIM from 128 to 136 to improve attention capacity while maintaining efficient computation	1.099811	67.6	235842	7.8	540	discard	The current best configuration uses ASPECT_RATIO=36, HEAD_DIM=128, and WEIGHT_DE	AMD Instinct MI300X	c3182ef04f2b2ac03006f1013655a091a2d56c39
exp60	Decrease HEAD_DIM from 128 to 96 to reduce attention computation overhead while maintaining model quality	1.084259	61.5	290709	8.0	666	discard	The current best configuration has ASPECT_RATIO=36 and HEAD_DIM=128. Previous ex	AMD Instinct MI300X	c3182ef04f2b2ac03006f1013655a091a2d56c39
exp61	Decrease HEAD_DIM from 128 to 80 to reduce attention computation overhead while maintaining model quality	1.090952	61.5	280239	7.7	642	discard	The pattern shows that reducing HEAD_DIM can significantly reduce memory usage a	AMD Instinct MI300X	c3182ef04f2b2ac03006f1013655a091a2d56c39
exp62	Decrease FINAL_LR_FRAC from 0.1 to 0.05 to maintain higher learning rates in the final phase of training	1.078157	64.6	279480	8.5	640	discard	The current best configuration has WEIGHT_DECAY=0.1 and FINAL_LR_FRAC=0.1. Previ	AMD Instinct MI300X	c3182ef04f2b2ac03006f1013655a091a2d56c39
exp63	Increase HEAD_DIM from 128 to 160 to improve attention capacity while maintaining the optimal ASPECT_RATIO=36	1.081297	61.5	295234	8.1	676	discard	The current best configuration has ASPECT_RATIO=36, HEAD_DIM=128, and WEIGHT_DEC	AMD Instinct MI300X	c3182ef04f2b2ac03006f1013655a091a2d56c39
exp64	Decrease HEAD_DIM from 128 to 104 to reduce attention computation overhead while maintaining model quality	1.112168	65.3	210246	6.5	482	discard	The experiments show that HEAD_DIM modifications have been tried at 64, 80, 96, 	AMD Instinct MI300X	c3182ef04f2b2ac03006f1013655a091a2d56c39
exp65	Decrease HEAD_DIM from 128 to 88 to reduce attention computation overhead while maintaining model quality	1.096980	57.7	279573	6.7	640	discard	The experiments show that reducing HEAD_DIM can improve performance by reducing 	AMD Instinct MI300X	c3182ef04f2b2ac03006f1013655a091a2d56c39
exp66	Increase DEPTH from 12 to 13 to improve model capacity while maintaining the optimal ASPECT_RATIO=36	1.081936	68.6	259740	8.5	595	discard	The current best configuration has ASPECT_RATIO=36, WEIGHT_DECAY=0.1, and uses f	AMD Instinct MI300X	c3182ef04f2b2ac03006f1013655a091a2d56c39
exp67	Increase DEPTH from 12 to 14 to improve model capacity while maintaining the optimal ASPECT_RATIO=36	1.086204	72.5	242928	8.5	557	discard	The current best configuration (exp41) has ASPECT_RATIO=36, DEPTH=12, and WEIGHT	AMD Instinct MI300X	c3182ef04f2b2ac03006f1013655a091a2d56c39
exp68	Decrease HEAD_DIM from 128 to 120 to reduce attention computation overhead while maintaining model quality	1.100258	61.5	243090	6.7	557	discard	The current best configuration uses ASPECT_RATIO=36, DEPTH=12, HEAD_DIM=128, ach	AMD Instinct MI300X	c3182ef04f2b2ac03006f1013655a091a2d56c39
exp69	Decrease HEAD_DIM from 128 to 72 to reduce attention computation overhead and allow for more gradient steps	1.100025	57.0	284238	6.6	651	discard	The experiment history shows a consistent pattern where reducing model complexit	AMD Instinct MI300X	c3182ef04f2b2ac03006f1013655a091a2d56c39
exp70	Increase ASPECT_RATIO from 36 to 37 to slightly increase model width while maintaining optimal gradient step count	1.077795	64.6	279534	8.5	641	keep	The current best configuration has ASPECT_RATIO=36 with excellent performance (1	AMD Instinct MI300X	c3182ef04f2b2ac03006f1013655a091a2d56c39
exp71	Increase ASPECT_RATIO from 37 to 38 to further increase model width while maintaining optimal gradient step count	1.077894	64.6	279480	8.5	640	discard	The trend shows consistent improvement as ASPECT_RATIO increases from 32 to 37, 	AMD Instinct MI300X	c3182ef04f2b2ac03006f1013655a091a2d56c39
exp72	Decrease WARMDOWN_RATIO from 0.5 to 0.45 to maintain higher learning rates for slightly more of the training	1.078484	64.6	279387	8.5	640	discard	The current best configuration is finely tuned with ASPECT_RATIO=37. Since archi	AMD Instinct MI300X	c3182ef04f2b2ac03006f1013655a091a2d56c39
exp73	Decrease WARMDOWN_RATIO from 0.5 to 0.35 to maintain higher learning rates for more of the training	1.079937	64.6	279627	8.5	641	discard	The current best configuration has ASPECT_RATIO=37 and achieves val_bpb=1.0778. 	AMD Instinct MI300X	c3182ef04f2b2ac03006f1013655a091a2d56c39
exp74	Decrease WARMDOWN_RATIO from 0.5 to 0.6 to reduce learning rate more aggressively in the final phase	1.078045	64.6	278333	8.4	637	discard	The current best configuration has ASPECT_RATIO=37 which gives good model capaci	AMD Instinct MI300X	c3182ef04f2b2ac03006f1013655a091a2d56c39
exp75	Increase MATRIX_LR from 0.04 to 0.045	1.077942	64.6	279866	8.5	642	discard	The current best configuration (exp70) has found a sweet spot with ASPECT_RATIO=	AMD Instinct MI300X	c3182ef04f2b2ac03006f1013655a091a2d56c39
exp76	Increase FINAL_LR_FRAC from 0.1 to 0.15 to maintain higher learning rates in the final phase of training	1.078813	64.6	279480	8.5	640	discard	The current best configuration (exp70) has found an optimal balance of model siz	AMD Instinct MI300X	c3182ef04f2b2ac03006f1013655a091a2d56c39
exp77	Decrease SCALAR_LR from 0.5 to 0.45	1.078361	64.6	279480	8.5	640	discard	The current best configuration (exp70) has achieved val_bpb of 1.0778 with ASPEC	AMD Instinct MI300X	c3182ef04f2b2ac03006f1013655a091a2d56c39
exp78	Decrease EMBEDDING_LR from 0.6 to 0.5	1.078172	64.6	279573	8.5	640	discard	The current best configuration (exp70) has been optimized for model architecture	AMD Instinct MI300X	c3182ef04f2b2ac03006f1013655a091a2d56c39
exp79	Increase ASPECT_RATIO from 37 to 39 to further increase model width while maintaining optimal gradient step count	1.077901	64.6	279480	8.5	640	discard	The current best result (1.0778) came from increasing ASPECT_RATIO to 37, and ex	AMD Instinct MI300X	c3182ef04f2b2ac03006f1013655a091a2d56c39
