exp	description	val_bpb	peak_mem_gb	tok_sec	mfu	steps	status	notes	gpu_name	baseline_sha	watts	joules_per_token	total_energy_joules
exp0	baseline (no modifications)	1.090689	5.9	299233	17.0	2741	baseline	depth=8, NVIDIA GeForce RTX 5090	NVIDIA GeForce RTX 5090	6c3ee2eeb0bea54dc386a596ba89489cc0815b30	461.7	0.001543	138549.8
exp1	Reduce DEVICE_BATCH_SIZE to half its current value	0.000000	0.0	0	0.0	0	crash	training crashed or timed out	NVIDIA GeForce RTX 5090	6c3ee2eeb0bea54dc386a596ba89489cc0815b30	0.0	0.000000	0.0
exp2	Reduce TOTAL_BATCH_SIZE to half its current value	0.000000	0.0	0	0.0	0	crash	training crashed or timed out	NVIDIA GeForce RTX 5090	6c3ee2eeb0bea54dc386a596ba89489cc0815b30	0.0	0.000000	0.0
exp3	Increase WARMUP_RATIO from 0.0 to 0.05	1.088781	5.9	299333	17.0	2740	keep	A non-zero WARMUP_RATIO can help to stabilize training, especially for larger le	NVIDIA GeForce RTX 5090	6c3ee2eeb0bea54dc386a596ba89489cc0815b30	465.4	0.001555	139628.5
exp4	Increase WARMDOWN_RATIO from 0.5 to 0.8	1.084656	5.9	299233	17.0	2739	keep	Extending the warmdown period may help as more training steps receive a slowly d	NVIDIA GeForce RTX 5090	6c3ee2eeb0bea54dc386a596ba89489cc0815b30	467.6	0.001563	140315.4
exp5	Increase WARMUP_RATIO from 0.05 to 0.1	1.086848	5.9	299333	17.0	2741	discard	Prior experiments with WARMUP_RATIO showed improvement when it was increased fro	NVIDIA GeForce RTX 5090	6c3ee2eeb0bea54dc386a596ba89489cc0815b30	465.7	0.001556	139728.0
exp6	Increase FINAL_LR_FRAC from 0.0 to 0.05	1.084623	5.9	299233	17.0	2740	keep	Currently, the learning rate decays all the way to zero at the end of training, 	NVIDIA GeForce RTX 5090	6c3ee2eeb0bea54dc386a596ba89489cc0815b30	466.1	0.001558	139870.5
exp7	Increase WARMDOWN_RATIO from 0.8 to 0.95	1.083537	5.9	299233	17.0	2740	keep	Increasing the WARMDOWN_RATIO will extend the LR warmdown phase, which may furth	NVIDIA GeForce RTX 5090	6c3ee2eeb0bea54dc386a596ba89489cc0815b30	466.4	0.001559	139939.9
exp8	Decrease WEIGHT_DECAY from 0.2 to 0.15	1.081907	5.9	299233	17.0	2740	keep	The current weight decay is relatively high, which might unnecessarily hinder le	NVIDIA GeForce RTX 5090	6c3ee2eeb0bea54dc386a596ba89489cc0815b30	466.8	0.001560	140075.1
exp9	Increase DEPTH by 2	1.093312	9.0	195601	19.9	1790	discard	The RTX 5090 has substantial unused memory headroom (only ~6GB in use from 31GB 	NVIDIA GeForce RTX 5090	6c3ee2eeb0bea54dc386a596ba89489cc0815b30	521.6	0.002668	156519.1
exp10	Decrease DEVICE_BATCH_SIZE by approximately 25% to increase gradient steps within memory budget	0.000000	0.0	0	0.0	0	crash	training crashed or timed out	NVIDIA GeForce RTX 5090	6c3ee2eeb0bea54dc386a596ba89489cc0815b30	0.0	0.000000	0.0
exp11	Decrease ASPECT_RATIO from 64 to 56	1.081700	5.9	299233	17.0	2740	keep	Reducing ASPECT_RATIO will lower the model's width and, consequently, its parame	NVIDIA GeForce RTX 5090	6c3ee2eeb0bea54dc386a596ba89489cc0815b30	466.6	0.001560	140018.7
exp12	Decrease HEAD_DIM from 128 to 112	1.084942	5.2	324558	14.9	2973	discard	Decreasing HEAD_DIM will reduce memory usage per attention head, potentially all	NVIDIA GeForce RTX 5090	6c3ee2eeb0bea54dc386a596ba89489cc0815b30	456.1	0.001405	136872.3
exp13	Decrease MATRIX_LR from 0.04 to 0.032	1.082383	5.9	299000	17.0	2738	discard	With a higher warmdown ratio, reduced aspect ratio, and successfully decreased w	NVIDIA GeForce RTX 5090	6c3ee2eeb0bea54dc386a596ba89489cc0815b30	466.7	0.001561	140014.3
exp14	Increase DEPTH by 1 (from current _hp_defaults['depth'] to _hp_defaults['depth'] + 1)	1.081679	6.6	281239	18.1	2577	keep	Prior increase of DEPTH by 2 overran memory, but increasing by just 1 layer may 	NVIDIA GeForce RTX 5090	6c3ee2eeb0bea54dc386a596ba89489cc0815b30	468.9	0.001666	140702.0
exp15	Decrease ASPECT_RATIO from 56 to 48	1.081779	6.6	281572	18.1	2578	discard	Lowering ASPECT_RATIO will reduce the overall model dimension given a fixed dept	NVIDIA GeForce RTX 5090	6c3ee2eeb0bea54dc386a596ba89489cc0815b30	465.3	0.001653	139612.3
exp16	Increase MLP_RATIO from default to 1.5	1.081872	6.6	281572	18.1	2578	discard	Increasing the MLP_RATIO allocates a greater portion of the model's capacity to 	NVIDIA GeForce RTX 5090	6c3ee2eeb0bea54dc386a596ba89489cc0815b30	469.0	0.001666	140711.6
exp17	Increase SCALAR_LR from 0.5 to 0.8	1.082353	6.6	281572	18.1	2578	discard	Scalar parameters (layer scaling factors and similar) are often very robust to i	NVIDIA GeForce RTX 5090	6c3ee2eeb0bea54dc386a596ba89489cc0815b30	468.4	0.001664	140564.3
exp18	Decrease ASPECT_RATIO from 56 to 52	1.082062	6.6	281239	18.1	2577	discard	Lowering ASPECT_RATIO shrinks the model width, reducing memory footprint and pot	NVIDIA GeForce RTX 5090	6c3ee2eeb0bea54dc386a596ba89489cc0815b30	470.1	0.001670	141059.6
exp19	Increase FINAL_LR_FRAC from 0.05 to 0.1	1.083576	6.6	281333	18.1	2577	discard	Raising FINAL_LR_FRAC will cause the learning rate to decay to a higher value at	NVIDIA GeForce RTX 5090	6c3ee2eeb0bea54dc386a596ba89489cc0815b30	466.9	0.001659	140077.0
exp20	Decrease DEVICE_BATCH_SIZE by approximately 20% to increase gradient steps without exceeding memory budget	0.000000	0.0	0	0.0	0	crash	training crashed or timed out	NVIDIA GeForce RTX 5090	6c3ee2eeb0bea54dc386a596ba89489cc0815b30	0.0	0.000000	0.0
exp21	Increase WARMDOWN_RATIO from 0.95 to 0.98	1.081251	6.6	281572	18.1	2579	keep	Extending the warndown (decay) phase of the learning rate schedule can promote g	NVIDIA GeForce RTX 5090	6c3ee2eeb0bea54dc386a596ba89489cc0815b30	468.2	0.001663	140529.1
exp22	Increase EMBEDDING_LR from 0.6 to 0.9	1.081317	6.6	281239	18.1	2577	discard	The embedding learning rate impacts how quickly the input representations adapt,	NVIDIA GeForce RTX 5090	6c3ee2eeb0bea54dc386a596ba89489cc0815b30	468.3	0.001664	140527.6
exp23	Decrease HEAD_DIM from 128 to 120	1.088784	7.7	223258	18.6	2046	discard	HEAD_DIM has not yet been decreased below 128 in a kept experiment. Previous red	NVIDIA GeForce RTX 5090	6c3ee2eeb0bea54dc386a596ba89489cc0815b30	488.7	0.002188	146662.7
exp24	Decrease HEAD_DIM from 128 to 96	1.094255	7.4	222592	17.4	2039	discard	Lowering HEAD_DIM will reduce per-layer memory and compute cost, enabling either	NVIDIA GeForce RTX 5090	6c3ee2eeb0bea54dc386a596ba89489cc0815b30	455.1	0.002044	136571.7
exp25	Decrease ASPECT_RATIO from 56 to 54	1.082215	6.6	278573	17.9	2551	discard	Lowering the ASPECT_RATIO slightly reduces the model width, freeing up some memo	NVIDIA GeForce RTX 5090	6c3ee2eeb0bea54dc386a596ba89489cc0815b30	466.1	0.001673	139871.8
exp26	Decrease ASPECT_RATIO from 56 to 53	1.081557	6.6	281666	18.1	2578	discard	Lowering the ASPECT_RATIO decreases model width, reducing per-step memory usage.	NVIDIA GeForce RTX 5090	6c3ee2eeb0bea54dc386a596ba89489cc0815b30	468.8	0.001665	140637.9
exp27	Increase EMBEDDING_LR from 0.6 to 1.2	1.082353	6.6	281572	18.1	2580	discard	Prior increases in EMBEDDING_LR were modest (to 0.9, exp22) and did not affect v	NVIDIA GeForce RTX 5090	6c3ee2eeb0bea54dc386a596ba89489cc0815b30	468.2	0.001662	140490.6
exp28	Increase DEPTH by 1 (from _hp_defaults['depth'] + 1 to _hp_defaults['depth'] + 2)	1.093090	9.0	195536	19.9	1791	discard	Slightly increasing model depth can improve the representational power of the mo	NVIDIA GeForce RTX 5090	6c3ee2eeb0bea54dc386a596ba89489cc0815b30	521.1	0.002665	156396.2
exp29	Decrease DEVICE_BATCH_SIZE by approximately 10% to increase gradient steps while staying within memory constraints	0.000000	0.0	0	0.0	0	crash	training crashed or timed out	NVIDIA GeForce RTX 5090	6c3ee2eeb0bea54dc386a596ba89489cc0815b30	0.0	0.000000	0.0
