exp	description	val_bpb	peak_mem_gb	tok_sec	mfu	steps	status	notes	gpu_name	baseline_sha	watts	joules_per_token	total_energy_joules
exp0	baseline (no modifications)	1.089654	5.9	299233	17.0	2742	baseline	depth=8, NVIDIA GeForce RTX 5090	NVIDIA GeForce RTX 5090	3c0a028a2934743c81d8b559132c769cd095ea47	461.9	0.001543	138601.3
exp1	Decrease DEVICE_BATCH_SIZE to increase gradient steps per time budget.	0.000000	0.0	0	0.0	0	crash	training crashed or timed out	NVIDIA GeForce RTX 5090	3c0a028a2934743c81d8b559132c769cd095ea47	0.0	0.000000	0.0
exp2	Decrease WEIGHT_DECAY from 0.2 to 0.1	1.083684	5.9	298567	17.0	2735	keep	The current weight decay value may be too high, potentially causing underfitting	NVIDIA GeForce RTX 5090	3c0a028a2934743c81d8b559132c769cd095ea47	466.0	0.001561	139853.0
exp3	Decrease TOTAL_BATCH_SIZE to increase the number of gradient steps within the fixed time budget.	0.000000	0.0	0	0.0	0	crash	training crashed or timed out	NVIDIA GeForce RTX 5090	3c0a028a2934743c81d8b559132c769cd095ea47	0.0	0.000000	0.0
exp4	Decrease DEVICE_BATCH_SIZE from _hp_defaults['device_batch_size'] to half its value.	0.000000	0.0	0	0.0	0	crash	training crashed or timed out	NVIDIA GeForce RTX 5090	3c0a028a2934743c81d8b559132c769cd095ea47	0.0	0.000000	0.0
exp5	Increase WARMDOWN_RATIO from 0.5 to 0.7	1.082568	5.9	298233	17.0	2732	keep	Since maximizing gradient steps is key and prior attempts to decrease batch size	NVIDIA GeForce RTX 5090	3c0a028a2934743c81d8b559132c769cd095ea47	465.1	0.001559	139562.4
exp6	Decrease EMBEDDING_LR from 0.6 to 0.4	1.082774	5.9	298900	17.0	2738	discard	The embedding layer often benefits from a lower learning rate to avoid unstable 	NVIDIA GeForce RTX 5090	3c0a028a2934743c81d8b559132c769cd095ea47	468.0	0.001565	140421.0
exp7	Increase DEPTH from _hp_defaults['depth'] to _hp_defaults['depth'] + 2	1.087651	9.0	195268	19.9	1788	discard	Increasing the model depth typically increases the representational power of the	NVIDIA GeForce RTX 5090	3c0a028a2934743c81d8b559132c769cd095ea47	523.3	0.002681	157053.3
exp8	Decrease SCALAR_LR from 0.5 to 0.3	1.080856	5.9	299000	17.0	2737	keep	A lower per-layer scalar learning rate may help stabilize training, reducing noi	NVIDIA GeForce RTX 5090	3c0a028a2934743c81d8b559132c769cd095ea47	470.3	0.001573	141092.1
exp9	Decrease MATRIX_LR from 0.04 to 0.03	1.080204	5.9	298900	17.0	2738	keep	Lowering the learning rate for the matrix parameters may improve stability and a	NVIDIA GeForce RTX 5090	3c0a028a2934743c81d8b559132c769cd095ea47	470.0	0.001572	141022.8
