exp	description	val_bpb	peak_mem_gb	tok_sec	mfu	steps	status	notes	gpu_name	baseline_sha	watts	joules_per_token	total_energy_joules
exp0	baseline (no modifications)	1.089663	5.9	298666	17.0	2735	baseline	depth=8, NVIDIA GeForce RTX 5090	NVIDIA GeForce RTX 5090	3c800236c8a3ce84066697ec1907cb62bd6170ea	461.8	0.001546	138567.7
exp1	Halve TOTAL_BATCH_SIZE to increase number of gradient steps within time budget	1.100370	3.2	282666	16.1	5174	discard	The key insight is that smaller batches enable more gradient updates in fixed ti	NVIDIA GeForce RTX 5090	3c800236c8a3ce84066697ec1907cb62bd6170ea	448.7	0.001588	134605.2
exp2	Increase WARMUP_RATIO from 0.0 to 0.05	1.088467	5.9	299233	17.0	2739	keep	With a nonzero warmup ratio, the learning rates ramp up gradually instead of spi	NVIDIA GeForce RTX 5090	3c800236c8a3ce84066697ec1907cb62bd6170ea	468.0	0.001565	140460.8
exp3	Increase WARMDOWN_RATIO from 0.5 to 0.7	1.085508	5.9	298333	17.0	2732	keep	Lengthening the warmdown phase allows for a more gradual reduction of the learni	NVIDIA GeForce RTX 5090	3c800236c8a3ce84066697ec1907cb62bd6170ea	468.5	0.001570	140566.3
exp4	Increase FINAL_LR_FRAC from 0.0 to 0.05	1.085537	5.9	298333	17.0	2731	discard	Currently, the learning rate decays fully to zero at the end of training, which 	NVIDIA GeForce RTX 5090	3c800236c8a3ce84066697ec1907cb62bd6170ea	467.2	0.001567	140189.1
exp5	Decrease DEVICE_BATCH_SIZE to increase number of gradient steps within time budget	0.000000	0.0	0	0.0	0	crash	training crashed or timed out	NVIDIA GeForce RTX 5090	3c800236c8a3ce84066697ec1907cb62bd6170ea	0.0	0.000000	0.0
exp6	Decrease WEIGHT_DECAY from 0.2 to 0.15	1.083190	5.9	299333	17.0	2739	keep	The current weight decay may be relatively strong, possibly hindering the model'	NVIDIA GeForce RTX 5090	3c800236c8a3ce84066697ec1907cb62bd6170ea	468.7	0.001567	140624.4
exp7	Increase ASPECT_RATIO from 64 to 80	1.088867	7.3	233666	19.2	2139	discard	Increasing ASPECT_RATIO raises the model's width (model_dim), thereby increasing	NVIDIA GeForce RTX 5090	3c800236c8a3ce84066697ec1907cb62bd6170ea	493.4	0.002112	148054.2
exp8	Increase MLP_RATIO from default (unspecified) to 4.0	1.083284	5.9	298567	17.0	2733	discard	Increasing the MLP_RATIO raises the hidden dimension size in the transformer's f	NVIDIA GeForce RTX 5090	3c800236c8a3ce84066697ec1907cb62bd6170ea	467.2	0.001566	140216.2
exp9	Increase WARMUP_RATIO from 0.05 to 0.10	1.086557	5.9	299000	17.0	2736	discard	The increase from 0.0 to 0.05 improved val_bpb in exp2, suggesting that a higher	NVIDIA GeForce RTX 5090	3c800236c8a3ce84066697ec1907cb62bd6170ea	469.8	0.001572	140936.2
exp10	Decrease SCALAR_LR from 0.5 to 0.3	1.084795	5.9	298666	17.0	2735	discard	The SCALAR_LR is relatively high and applies to per-layer scaling factors, where	NVIDIA GeForce RTX 5090	3c800236c8a3ce84066697ec1907cb62bd6170ea	472.9	0.001583	141881.3
exp11	Decrease HEAD_DIM from 128 to 96	1.095429	6.6	235254	16.2	2154	discard	Reducing HEAD_DIM decreases the model's memory footprint, which could allow for 	NVIDIA GeForce RTX 5090	3c800236c8a3ce84066697ec1907cb62bd6170ea	492.1	0.002093	147693.4
exp12	Increase DEPTH by 2 to leverage potential for deeper models with activation checkpointing.	1.096171	9.0	194935	19.8	1786	discard	The RTX 5090 has substantial memory, and activation checkpointing is enabled, ma	NVIDIA GeForce RTX 5090	3c800236c8a3ce84066697ec1907cb62bd6170ea	526.7	0.002700	158038.3
exp13	Decrease MATRIX_LR from 0.04 to 0.03	1.081670	5.9	299000	17.0	2737	keep	Given that the weight decay decrease improved val_bpb, this suggests reducing ov	NVIDIA GeForce RTX 5090	3c800236c8a3ce84066697ec1907cb62bd6170ea	469.4	0.001570	140825.7
exp14	Decrease DEVICE_BATCH_SIZE by 1 step to increase the number of gradient steps within the fixed time budget.	0.000000	0.0	0	0.0	0	crash	training crashed or timed out	NVIDIA GeForce RTX 5090	3c800236c8a3ce84066697ec1907cb62bd6170ea	0.0	0.000000	0.0
exp15	Decrease UNEMBEDDING_LR from 0.004 to 0.002	1.088078	5.9	299000	17.0	2738	discard	The unembedding layer often benefits from a lower learning rate due to its sensi	NVIDIA GeForce RTX 5090	3c800236c8a3ce84066697ec1907cb62bd6170ea	467.5	0.001563	140269.2
exp16	Decrease EMBEDDING_LR from 0.6 to 0.4	1.079938	5.9	299233	17.0	2739	keep	EMBEDDING_LR is currently relatively high and may be causing instability or subo	NVIDIA GeForce RTX 5090	3c800236c8a3ce84066697ec1907cb62bd6170ea	469.0	0.001568	140734.6
exp17	Increase WARMDOWN_RATIO from 0.7 to 0.85	1.079851	5.9	299233	17.0	2739	keep	The increased warmdown may help the model converge more smoothly by providing a 	NVIDIA GeForce RTX 5090	3c800236c8a3ce84066697ec1907cb62bd6170ea	468.8	0.001567	140652.7
exp18	Increase DEPTH by 1 to leverage activation checkpointing for model capacity gains	1.085039	8.2	219666	20.4	2010	discard	Previous attempts to increase DEPTH by 2 (exp12) led to memory issues, likely ex	NVIDIA GeForce RTX 5090	3c800236c8a3ce84066697ec1907cb62bd6170ea	523.2	0.002383	156978.3
exp19	Increase WARMUP_RATIO from 0.05 to 0.08	1.082385	5.9	298233	17.0	2732	discard	Prior increases in WARMUP_RATIO above zero (exp2) helped, but an overly high val	NVIDIA GeForce RTX 5090	3c800236c8a3ce84066697ec1907cb62bd6170ea	468.8	0.001571	140662.4
exp20	Decrease HEAD_DIM from 128 to 112	1.090857	6.5	252666	16.6	2314	discard	Reducing HEAD_DIM moderately will shrink attention projection matrices and total	NVIDIA GeForce RTX 5090	3c800236c8a3ce84066697ec1907cb62bd6170ea	508.6	0.002013	152598.3
exp21	Decrease MATRIX_LR from 0.03 to 0.025	1.080518	5.9	299000	17.0	2738	discard	Lowering the matrix learning rate may help stabilize training and reduce oversho	NVIDIA GeForce RTX 5090	3c800236c8a3ce84066697ec1907cb62bd6170ea	467.6	0.001564	140290.2
exp22	Decrease WEIGHT_DECAY from 0.15 to 0.1	1.080122	5.9	299233	17.0	2739	discard	Regularization is important, but with improved learning rate and schedule tuning	NVIDIA GeForce RTX 5090	3c800236c8a3ce84066697ec1907cb62bd6170ea	466.3	0.001559	139917.3
exp23	Increase SCALAR_LR from 0.5 to 0.7	1.083552	5.9	298567	17.0	2735	discard	Scalar learning rates control per-layer scaling factors and can influence model 	NVIDIA GeForce RTX 5090	3c800236c8a3ce84066697ec1907cb62bd6170ea	466.9	0.001563	140103.6
exp24	Increase FINAL_LR_FRAC from 0.0 to 0.01	1.079339	5.9	298900	17.0	2737	keep	Keeping the final learning rate at zero means the model fully anneals learning r	NVIDIA GeForce RTX 5090	3c800236c8a3ce84066697ec1907cb62bd6170ea	467.8	0.001565	140382.3
exp25	Decrease WEIGHT_DECAY from 0.15 to 0.12	1.079441	5.9	298666	17.0	2735	discard	Lowering weight decay slightly can help reduce underfitting when the model is al	NVIDIA GeForce RTX 5090	3c800236c8a3ce84066697ec1907cb62bd6170ea	468.9	0.001570	140691.5
exp26	Decrease MATRIX_LR from 0.03 to 0.02	1.081645	5.9	298900	17.0	2737	discard	Given prior success with modest decreases in MATRIX_LR (exp13 was kept, exp21/22	NVIDIA GeForce RTX 5090	3c800236c8a3ce84066697ec1907cb62bd6170ea	470.1	0.001573	141065.3
exp27	Increase SCALAR_LR from 0.5 to 0.6	1.081933	5.9	298333	17.0	2731	discard	While a larger increase to 0.7 slightly degraded performance (exp23), a modest i	NVIDIA GeForce RTX 5090	3c800236c8a3ce84066697ec1907cb62bd6170ea	464.4	0.001557	139328.4
exp28	Increase FINAL_LR_FRAC from 0.01 to 0.02	1.079354	5.9	298567	17.0	2734	discard	The last increase of FINAL_LR_FRAC (exp24) yielded a small but measurable improv	NVIDIA GeForce RTX 5090	3c800236c8a3ce84066697ec1907cb62bd6170ea	469.1	0.001571	140778.3
exp29	Decrease MLP_RATIO from default (unspecified, likely 4) to 3.0	1.080532	5.9	297666	16.9	2724	discard	Architectural changes increasing model capacity (depth, width, head dim) have co	NVIDIA GeForce RTX 5090	3c800236c8a3ce84066697ec1907cb62bd6170ea	467.8	0.001572	140359.8
