exp	description	val_bpb	peak_mem_gb	tok_sec	mfu	steps	status	notes	gpu_name	baseline_sha
exp76	Reduce MATRIX_LR from 0.021 to 0.0208 to continue fine-tuning around the optimal value	1.057777	17.1	289903	33.6	1328	discard	The current best result (1.0572) uses MATRIX_LR=0.021, and previous experiments 	NVIDIA RTX PRO 6000 Blackwell Server Edition	dacda452b828482990bb83a976e53ae2b3129308
exp77	Reduce MATRIX_LR from 0.021 to 0.0205 to fine-tune between current best (0.021) and previous experiments	1.058596	17.1	290236	33.7	1329	discard	The current best val_bpb is 1.0572 with MATRIX_LR=0.021. Previous experiments sh	NVIDIA RTX PRO 6000 Blackwell Server Edition	dacda452b828482990bb83a976e53ae2b3129308
exp78	Increase FINAL_LR_FRAC from 0.1 to 0.15 to further improve end-of-training learning	1.059918	17.1	290000	33.7	1328	discard	The last experiment showed a significant improvement by adding FINAL_LR_FRAC=0.1	NVIDIA RTX PRO 6000 Blackwell Server Edition	dacda452b828482990bb83a976e53ae2b3129308
