exp	description	val_bpb	peak_mem_gb	tok_sec	mfu	steps	status	notes	gpu_name	baseline_sha
exp77	Increase HEAD_DIM from 128 to 132 to explore slightly larger attention heads with the optimized configuration	1.057270	27.7	282239	35.0	1292	discard	The current best configuration uses LSLS window pattern and MATRIX_LR of 0.022. 	NVIDIA RTX PRO 6000 Blackwell Server Edition	363047fc900c4be34f57d18292332252203d6a05
exp78	Decrease HEAD_DIM from 128 to 112 to reduce model size and potentially increase gradient steps	1.061272	18.0	273484	35.0	1252	discard	The current best configuration uses LSLS pattern with MATRIX_LR=0.022. Previous 	NVIDIA RTX PRO 6000 Blackwell Server Edition	363047fc900c4be34f57d18292332252203d6a05
